Decision,PA Ref,PROPOSAL,Decision issued,Determining Body,Property Address
Permitted,12/00508/B,Erection of a polytunnel,23-May-12,Senior Planning Officer - North (CB),Rushen Primary School Church Road Port St. Mary Isle Of Man IM9 5LW 
Permitted,12/00509/B,Alterations and erection of extensions to dwelling,16-May-12,Senior Planning Officer - North (CB),Southdown 18 Greeba Avenue Glen Vine Isle Of Man IM4 4EE 
Permitted,12/00510/B,Installation of replacement windows to front elevation,16-May-12,Senior Planning Officer - South (SC),5 Selborne Road Douglas Isle Of Man IM1 4BT
Permitted,12/00511/B,Alterations and extension to dwelling and alterations to driveway and access (Amendments to PA 11/00498/B),16-May-12,Senior Planning Officer - South (SC),5 Baldrine Park Baldrine Isle Of Man IM4 6DE 
Application Withdrawn,12/00512/B,"Erection of a detached building to provide indoor tennis court, squash court and gymnasium with timber bridge walkway through garden and new emergency and maintenance vehicular access onto Mountain Road",01-Jun-12,Withdrawn,Thie Ny Strooan Hillberry Green Douglas Isle Of Man IM2 6DE
Permitted,12/00513/B,Installation of roof lights and creation of gable window to dwelling,17-May-12,Senior Planning Officer - South (SC),Silver Lodge Baldhoon Road Laxey Isle Of Man IM4 7QG
Permitted,12/00514/B,"Realignment and replacement of railway lines, power supply posts and overhead power wiring, improvements to pedestrian access to station, re-grading of south end of Rose Garden to provide ramped access to station, replacement of ground finish to station p",18-Sep-12,Planning Committee,"Manx Electric Railway Station, Rose Garden And  Whitehouse Square  Main Road  Laxey Isle Of Man "
Permitted,12/00515/B,Erection of a conservatory to rear elevation of dwelling,17-May-12,Senior Planning Officer - South (SC),32 Carrick Park Sulby Isle Of Man IM7 2EY
Refused,12/00516/B,Alterations and erection of an extension to dwelling,16-May-12,Senior Planning Officer - South (SC),47 Maple Avenue Onchan Isle Of Man IM3 3GA
Permitted,12/00517/B,Installation of French doors to replace existing bay window,30-May-12,Planning Committee,1 Marathon Terrace Queens Promenade Douglas Isle Of Man IM2 4NH 
Permitted,12/00518/B,Installation of window to replace existing garage doors and door to side elevation,17-May-12,Senior Planning Officer - North (CB),Cair Vie Belle Vue Peel Isle Of Man IM5 1UH
Permitted,12/00519/B,Creation of a public car park and vehicular access,17-May-12,Senior Planning Officer - North (CB),Site Adjacent To Central Stores Main Road Union Mills Isle Of Man  
Permitted,12/00520/D,Erection of illuminated signage,17-May-12,Senior Planning Officer - South (SC),8 Castle Street Douglas Isle Of Man IM1 2EU 
Permitted,12/00521/D,Erection of signage,17-May-12,Senior Planning Officer - South (SC),Victoria Hall  Prospect Hill Douglas Isle Of Man IM1 2PX
Permitted,12/00522/A,Approval in principle for refurbishment and conversion of redundant barns into two dwellings,24-Aug-12,Head of Development Management,Skerrisdale Mooar Peel Road Kirk Michael Isle Of Man IM6 1HP
Permitted,12/00523/C,Use of part of Quarry floor for re-cycling of inert construction materials,11-Jul-12,Planning Committee,Cringle Quarry Ronague Castletown Isle Of Man IM9 4HJ 
Permitted,12/00524/B,Erection of a shed,13-Aug-12,Senior Planning Officer - North (CB),Land At Thie Rosien Castletown Road Port Erin Isle Of Man  
Permitted,12/00525/A,Approval in principle for erection of three dwellings,17-May-12,Senior Planning Officer - North (CB),"Field 432533,432534 And 432535  Phildraw Road Ballasalla Isle Of Man  "
Permitted,12/00526/B,Installation of replacement ground floor bay windows,17-May-12,Senior Planning Officer - South (SC),Flat 1   155 Woodbourne Road Douglas Isle Of Man IM2 3BB
Permitted,12/00527/B,Part demolition of existing building and erection of a dwelling on adjacent land,26-Jun-12,Planning Committee,Sycamore House Glen Duff Ramsey Isle Of Man IM7 2AT 
Permitted,12/00528/B,Replace existing garage door with bi fold uPVC doors,17-May-12,Senior Planning Officer - North (CB),Cronk Geayee Ballagawne Road Colby Isle Of Man IM9 4BB
Permitted,12/00529/C,Change of use of first floor apartment from residential to nursery use,17-May-12,Senior Planning Officer - South (SC),Pumpkin Patch Child Care Centre 13 & 14 Hailwood Court Douglas Isle Of Man IM2 7EA 
Permitted,12/00530/C,Additional use of residential dwelling as tourist accommodation,17-May-12,Senior Planning Officer - North (CB),1 Charles Street Peel Isle Of Man IM5 1AF
Deemed withdrawn 4(3) Dev Pro Order 2005,12/00531/B,Erection of two dwellings with associated parking,21-May-12,Withdrawn,Kalaw 41 Groudle Road Onchan Isle Of Man IM3 2EF
Permitted,12/00532/B,Installation of replacement windows to front elevation,17-May-12,Senior Planning Officer - North (CB),78A Malew Street Castletown Isle Of Man IM9 1LS
Permitted,12/00533/B,Erection of dwelling with garage,30-May-12,Planning Committee,Plot 23 Murrays Lake Drive Mount Murray Douglas Isle Of Man  
Permitted,12/00534/A,Approval in principle for development of site to create a builders and timber merchants premises,30-May-12,Planning Committee,Land Adjacent To Car Showroom Balthane Industrial Estate Balthane Ballasalla Isle Of Man  
Permitted,12/00535/B,Erection of an antenna with support poles and wires,13-Jun-12,Senior Planning Officer - South (SC),Dovedale Hillberry Road Onchan Isle Of Man IM3 3BQ
Permitted,12/00536/B,"Demolition of existing 14 dwellings and erection of 16 elderly persons dwellings with new access road, parking and associated Biomass Boiler House to serve community heating scheme (Amendments to PA 11/00013/B)",07-Aug-12,Department Application,Project 4 Site 1 - 27 Clagh Vane Ballasalla Isle Of Man IM9 2EU
Permitted,12/00537/B,Creation of vehicular access and hard-standing to side of dwelling,17-May-12,Senior Planning Officer - North (CB),1 Willow Close Ballawattleworth Estate Peel Isle Of Man IM5 1WL 
Application Withdrawn,12/00538/B,"Demolition of existing dwelling and erection of apartment buildings consisting of seven apartments with associated garaging, parking and site works",11-Dec-12,Withdrawn,Ballure Ballure Promenade Ramsey Isle Of Man IM8 1NN
Permitted,12/00539/B,Erection of a fence / trellis (retrospective),17-May-12,Senior Planning Officer - North (CB),Yn Darragh Darragh Port Erin Isle Of Man IM9 6JB
Permitted,12/00540/B,Erection of decking and shelter in rear garden and fencing in front garden (Retrospective),30-May-12,Planning Committee,6 Coronation Court Ramsey Isle Of Man IM8 3EF
Permitted,12/00541/B,Installation of replacement windows and doors,17-May-12,Senior Planning Officer - South (SC),Gymnasium Glencrutchery Special School Glencrutchery Road Douglas Isle Of Man IM2 6EB
Application Withdrawn,12/00542/C,Additional use of accommodation over garage as tourist accommodation,06-Jun-12,Withdrawn,Yn Rheash Corlea Road Ballasalla Isle Of Man IM9 3BA
Application Withdrawn,12/00543/B,Erection of a residential development comprising three apartments and one house,26-Jun-12,Withdrawn,Land Adjacent To Waterfall Hotel Carpark Shore Road Glen Maye Isle Of Man  
Permitted,12/00544/B,Installation of four roof lights,17-May-12,Senior Planning Officer - South (SC),The Barn Maughold Isle Of Man IM7 1AS 
Permitted,12/00545/B,Erection of a replacement dwelling,24-May-12,Senior Planning Officer - South (SC),Thie Ny Strooan Hillberry Green Douglas Isle Of Man IM2 6DE
Permitted,12/00546/B,Installation of replacement windows to roadside elevation,23-May-12,Senior Planning Officer - North (CB),Pinewoods Barrule Road Foxdale Isle Of Man IM4 3ES
Permitted,12/00547/B,Installation of replacement windows to front and rear elevations,23-May-12,Senior Planning Officer - North (CB),Flat 5  The Imperial The Promenade Port St. Mary Isle Of Man IM9 5DE
Permitted,12/00548/B,Installation of a roof light (retrospective),18-May-12,Senior Planning Officer - South (SC),7 Derby Road Douglas Isle Of Man IM2 3ES
Application Withdrawn,12/00549/C,Additional use of lower ground apartment as holiday accommodation,16-May-12,Withdrawn,Rhynefield West Baldwin Isle Of Man IM4 5HD 
Permitted,12/00550/B, Installation of a steel flue,23-May-12,Senior Planning Officer - North (CB),Peel Sailing And Cruising Club  The Rocket House Crown Street Peel Isle Of Man IM5 1AJ
Permitted,12/00551/B,Erection of an extension to existing detached garage,23-May-12,Senior Planning Officer - North (CB),Seathwaite 13 Perwick Road Port St. Mary Isle Of Man IM9 5PB
Permitted,12/00552/B,Alterations and extensions to dwelling,31-May-12,Senior Planning Officer - North (CB),Ballaman Ballnahowe Port Erin Isle Of Man IM9 6JF 
Permitted,12/00553/B,Alterations and extension to dwelling (comprising amendment to PA 09/01930/B),31-May-12,Senior Planning Officer - North (CB),Close Mooar Glen Darragh Road Glen Vine Isle Of Man IM4 4BE
Permitted,12/00554/B,Erection of a wooden potting shed and tool store and two netting tunnels,31-May-12,Senior Planning Officer - North (CB),The Secret Garden Nurseries Ballacharry Road St Marks Ballasalla Isle Of Man IM9 3AU 
Permitted,12/00555/B,Erection of a replacement shed,24-May-12,Senior Planning Officer - South (SC),Ivy Dene Wheel Hill Laxey Isle Of Man IM4 7NL
Permitted,12/00556/B,"Erection of a dwelling with associated services, driveway, vehicular access and detached double garage",12-Jun-12,Head of Development Management,Plot Adjacent To 15 Farmhill Drive Douglas Isle Of Man IM2 2EQ 
Permitted,12/00557/B,Installation of replacement windows and door to front elevation,31-May-12,Senior Planning Officer - South (SC),38 Demesne Road Douglas Isle Of Man IM1 3DY
Permitted,12/00558/B,Erection of a replacement dwelling,11-Jul-12,Planning Committee,Chibbraghin Dalby Isle Of Man IM5 3BW 
Refused,12/00559/B,Erection of a first floor extension with roof terrace above and erection of a detached toilet block,12-Jun-12,Head of Development Management,Grandstand Mountain Road Onchan Isle Of Man IM4 5BP
Permitted,12/00560/B,Erection of a first floor extension over garage and sun room extension to replace existing conservatory to rear elevation,24-May-12,Senior Planning Officer - South (SC),57 Governors Hill Douglas Isle Of Man IM2 7AU
Permitted,12/00561/B,"Alterations, erection of an extension and creation of a new driveway",24-May-12,Senior Planning Officer - South (SC),Highcroft Ramsey Road Laxey Isle Of Man IM4 7PR
Permitted,12/00562/B,Conversion of lower floor stores to provide ancillary living accommodation,05-Jun-12,Senior Planning Officer - South (SC),74 Ballabrooie Way Douglas Isle Of Man IM1 4HB
Permitted,12/00563/B, Demolition of existing chalet dwelling and replacement in new location with a single storey dwelling utilizing existing drive access,30-May-12,Planning Committee,Field 134924 Lower Glentramman Farm  Garey Road Garey Ramsey Isle Of Man  
Permitted,12/00564/B,Installation of solar panels to south elevation,24-May-12,Senior Planning Officer - South (SC),17 Palace Road Douglas Isle Of Man IM2 4LB 
Permitted,12/00565/B,Alterations and erection of a single storey and part two storey extension to dwelling,24-May-12,Senior Planning Officer - North (CB),3 Ballamillaghyn Estate Mount Rule Douglas Isle Of Man IM4 4HU
Permitted,12/00566/A,Approval in principle for erection of a farm worker's dwelling,30-May-12,Planning Committee,Part Of Field 432608 Douglas Road Ballasalla Isle Of Man  
Permitted,12/00567/B,Erection of extensions to existing agricultural building,16-Oct-12,Planning Committee,Agricultural Building  Seafield Farm Bollyn Road Ballaugh Isle Of Man  
Permitted,12/00568/B,Erection of a garden shed,23-May-12,Senior Planning Officer - North (CB),1 Campion Crescent Reayrt Ny Keylley Peel Isle Of Man IM5 1GE 
Permitted,12/00569/B,Erection of attached wood store,24-May-12,Senior Planning Officer - North (CB),11 Ballachrink Colby Isle Of Man IM9 4PB
Permitted,12/00570/B,"Environmental improvements including new road, parking facilities, enhanced paving surfaces, upgraded boundary fencing and improvements to communal areas",20-Nov-12,Department Application,"Kerroo Coar, Glen Faba, Roxwell Terrace, North View,  St Germans Place, Heathfield Drive, West View And Boilley Spittal  Peel"
Permitted,12/00571/B,"Alterations, erection of extensions to side and rear elevations and installation of roof lights and dormer window to dwelling",31-Oct-12,Planning Committee,Shan Vallah The Colony Port Lewaigue Ramsey Isle Of Man IM7 1AL
Permitted,12/00572/B,Re rendering work to dwelling,24-May-12,Senior Planning Officer - South (SC),29 Devonshire Road Douglas Isle Of Man IM2 3QZ
Permitted,12/00574/B,Alterations and extensions to dwelling (comprising amendments to PA 10/00542/B),24-May-12,Senior Planning Officer - South (SC),Ballagarraghyn Manor Main Road Greeba Isle Of Man IM4 3LH
Permitted,12/00575/B,Erection of an extension over existing detached garage,18-Oct-12,Senior Planning Officer - North (CB),26 Kerrocruin Kirk Michael Isle Of Man IM6 1AG
Permitted,12/00576/B,Infill extension to courtyard to create garden room,05-Jun-12,Senior Planning Officer - South (SC),Cronkould House Main Road Ballaugh Isle Of Man IM7 5ED
Permitted,12/00577/B,Installation of replacement windows to front and rear elevations,30-May-12,Planning Committee,Glen Villa  5 Sherwood Terrace Douglas Isle Of Man IM2 4EN 
Permitted,12/00578/B,Conversion of existing studio / store above existing garage to create additional ancillary living accommodation with additional use for tourist accommodation,24-May-12,Senior Planning Officer - North (CB),Cronk Froy Knock Froy Road Santon Isle Of Man IM4 1JD 
Refused,12/00579/A,Approval in principle for erection of two dwellings,29-May-12,Head of Development Management,Field 534183 Clypse Onchan Isle Of Man  
Permitted,12/00580/B,Creation of a driveway and vehicular access,13-Jul-12,Senior Planning Officer - South (SC),15 Clypse Road Douglas Isle Of Man IM2 6JE
Refused,12/00581/B,"Conversion of former vehicle showroom and workshop into a childrens play facility with cafe  ",21-Aug-12,Planning Committee,S & S Motors Milner Terrace/Alexandra Road  Castletown Isle Of Man
Refused,12/00582/B,"Creation of a temporary access track and erection of a temporary general purpose agricultural building to house garden maintenance machinery, vehicles and helicopter",12-Jun-12,Planning Committee,Cronk Breck Bernahara Road Andreas Isle Of Man IM7 3HH 
Permitted,12/00583/B,Installation of two display windows,31-May-12,Senior Planning Officer - South (SC),Unit 12A Tromode Estate Carrs Lane Tromode Douglas Isle Of Man IM4 4QD 
Refused,12/00584/A,Approval in principle for the erection of a dwelling,31-May-12,Senior Planning Officer - North (CB),Site Within Garden Of The Old Vicarage Barracks Road Port St. Mary Isle Of Man  
Refused,12/00585/B,Installation of replacement windows and door to front elevation,31-May-12,Senior Planning Officer - North (CB),8 The Crofts Castletown Isle Of Man IM9 1LW
Permitted,12/00586/B,Installation of replacement windows and door to front elevation,31-May-12,Senior Planning Officer - North (CB),Rhennybeg Rhenny Mooar Lane Greeba Isle Of Man IM4 2DT
Permitted,12/00587/B,Installation of replacement windows and front door,16-Jul-12,Senior Planning Officer - South (SC),Rencell Cottage Rencell Laxey Isle Of Man IM4 7BN 
Permitted,12/00588/B,Re positioning of personnel door to approved store building (PA 12/00005/B),31-May-12,Senior Planning Officer - North (CB),Cringle Quarry Ronague Castletown Isle Of Man IM9 4HJ 
Permitted,12/00589/B,Alteration to front porch,31-May-12,Senior Planning Officer - South (SC),Flat 2  Elfin Court Vernon Road Ramsey Isle Of Man IM8 2HB
Permitted,12/00590/B,Erection of a detached double garage and garden store with storage space above,29-May-12,Senior Planning Officer - North (CB),Mullen Rhenass Rhenass Road Cronk Y Voddy Kirk Michael Isle Of Man IM6 1BB
Permitted,12/00591/B,Erection of a double garage to replace existing garage,25-Jun-12,Senior Planning Officer - North (CB),Fuchsia Cottage Castletown Road Port St. Mary Isle Of Man IM9 5LT
Permitted,12/00592/B,Installation of replacement front door,07-Aug-12,Senior Planning Officer - North (CB),5 Market Place Peel Isle Of Man IM5 1AB
Permitted,12/00593/B,Erection of garage in rear yard (Retrospective),24-Jul-12,Senior Planning Officer - North (CB),62 Woodbourne Road Douglas Isle Of Man IM1 3AW
Permitted,12/00594/B,Alteration to rear patio doors,31-May-12,Senior Planning Officer - South (SC),30 Heywood Close Onchan Isle Of Man IM3 3AF
Permitted,12/00595/B,"Alterations, erection of rear extension, refurbishment of roof terrace and creation of a bridge link to rear garden",29-Jun-12,Senior Planning Officer - South (SC),14 Leigh Terrace Douglas Isle Of Man IM1 5AN
Permitted,12/00596/B,Alterations and installation of window to replace existing garage door,31-May-12,Senior Planning Officer - South (SC),Mauna Kea Ramsey Road Laxey Isle Of Man IM4 7PY
Refused,12/00597/A,Approval in principle for erection of a dwelling,21-Aug-12,Planning Committee,Garden Forming Part Of Mountain View Sound Road Glen Maye Isle Of Man IM5 3BJ
Permitted,12/00598/B,Installation of two dormers to replace existing roof lights to front elevation,31-May-12,Senior Planning Officer - North (CB),49 The Promenade Castletown Isle Of Man IM9 1BQ
Permitted,12/00599/B,Erection of garden walls,31-May-12,Senior Planning Officer - North (CB),16 Abbots Close Ballasalla Isle Of Man IM9 3EA 
Permitted,12/00600/B,Alterations and erection of extensions to dwelling,13-Jun-12,Head of Development Management,Far End 88 King Edward Road Onchan Isle Of Man IM3 2AU
Permitted,12/00601/B,Erection of a flat roof extension to dwelling,01-Jun-12,Senior Planning Officer - South (SC),9 Cooil Close Douglas Isle Of Man IM2 2HH
Permitted,12/00602/B,Installation of lighting to existing signage and installation of a display cabinet,01-Jun-12,Senior Planning Officer - South (SC),Living Hope Community Church  Former Gymnasium Adjacent To Palace Cinemas Car Park Central Promenade Douglas Isle Of Man  
Certificate of Lawfulness AGREED,12/00603/LAW,Application for a certificate of lawfulness seeking removal of an agricultural workers occupancy from dwelling,13-Aug-12,Head of Development Management,Corlea Bungalow Corlea Road Ballasalla Isle Of Man IM9 3BA
Permitted,12/00604/D,Erection of illuminated signage,07-Aug-12,Department Application,Sea Terminal Building Victoria Pier Douglas Isle Of Man IM1 2BZ 
Permitted,12/00605/B,Alterations and erection of an extension to rear of dwelling,01-Jun-12,Senior Planning Officer - South (SC),7 Ballaughton Villas Douglas Isle Of Man IM2 1JF
Permitted,12/00606/B,Replace existing window with french doors to northwest elevation of dwelling,29-May-12,Senior Planning Officer - North (CB),Balladane Queens Road Port St. Mary Isle Of Man IM9 5EZ
Permitted,12/00607/B,"Demolition of existing dilapidated outbuildings, repair of existing garden wall and provision of new car parking area",12-Jun-12,Planning Committee,Lorne House Douglas Street Castletown Isle Of Man IM9 1AZ 
Permitted,12/00608/B,Erection of an extension to replace conservatory to rear of dwelling,25-Jun-12,Planning Committee,Honiton Queens Road Port St. Mary Isle Of Man IM9 5EN
Permitted,12/00609/C,Change of use of approved tourist accommodation to residential accommodation,18-Jun-12,Senior Planning Officer - South (SC),Hillside Cottage Smeale Road Andreas Isle Of Man IM7 4JA
Permitted,12/00610/B,Replace existing garage door with patio doors,07-Jun-12,Director Delegation,8 Ballagale Avenue Surby Port Erin Isle Of Man IM9 6QN
Permitted,12/00611/B,Conversion of residential dwelling into three self contained flats,14-Jun-12,Head of Development Management,20 Mona Street Douglas Isle Of Man IM1 2QD
Permitted,12/00612/B,Installation of a replacement roof to sun lounge,14-Jun-12,Head of Development Management,47 Brunswick Road Douglas Isle Of Man IM2 3NW
Permitted,12/00613/D,Erection of signage,07-Jun-12,Director Delegation,"Unit's 15, L, 11B & 11A Snugborough Trading Estate Union Mills Isle Of Man IM4 4LH"
Permitted,12/00614/B,"Installation of two replacement windows, one with a lead finish roof and support brackets",07-Jun-12,Director Delegation,20 Fairway Close Port Erin Isle Of Man IM9 6LS
Permitted,12/00615/C,Change of use from car restoration garage to a garden centre retail outlet,14-Jun-12,Head of Development Management,Premises And Yard Auto Centre Workshop Albert Road Ramsey Isle Of Man IM8 1JB
Permitted,12/00616/B,Alterations and erection of a porch,07-Jun-12,Director Delegation,Quo Vadis Glen Chass Road Glen Chass Port St. Mary Isle Of Man IM9 5PN
Permitted,12/00617/B,Erection of three dwellings (amendments to three dwellings approved under PA 11/00684/B),07-Jun-12,Senior Planning Officer - North (CB),"Plots 1, 2 & 3 Croit Ny Glionney (former Colby Football Club Ground) Glen Road Colby Isle Of Man  "
Permitted,12/00618/B,Erection of an extension to dwelling,05-Jun-12,Senior Planning Officer - South (SC),33 Fairfield Avenue Onchan Isle Of Man IM3 4BG
Refused,12/00619/C,Additional use of office space above garage as tourist living accommodation,07-Jun-12,Senior Planning Officer - North (CB),Fo-Glion Glen Rushen Road Glen Maye Isle Of Man IM5 3BA
Permitted,12/00620/D,Erection of signage,14-Jun-12,Head of Development Management,St Andrew's United Reformed Church Glencrutchery Road Douglas Isle Of Man IM2 5HY
Application Withdrawn,12/00621/B,Erection of a detached building to provide garden machinery storage and a maintenance area,22-May-12,Withdrawn,Ballairgey Abbeylands Isle Of Man IM4 5EE 
Permitted,12/00622/B,Installation of replacement windows and door to front elevation,05-Jun-12,Senior Planning Officer - South (SC),7 Raphael Road Douglas Isle Of Man IM1 3EQ
Permitted,12/00623/B,Erection of a replacement agricultural building,20-Jun-12,Senior Planning Officer - North (CB),Field 234076 Peel Road Kirk Michael Isle Of Man  
Permitted,12/00624/B,Alterations and extensions to dwelling (amendment to PA 12/00214/B),14-Jun-12,Head of Development Management,79 Cronk Drean Douglas Isle Of Man IM2 6AS
Permitted,12/00625/B,Erection of an extension to dwelling,07-Jun-12,Senior Planning Officer - North (CB),61 Ballanawin Strang Douglas Isle Of Man IM4 4NU
Refused,12/00626/A,Approval in principle for the replacement of existing farm buildings with new farm buildings and agricultural workers accommodation,07-Jun-12,Senior Planning Officer - North (CB),Laurel Bank Farm Glen Helen Road Laurel Bank St Johns Isle Of Man IM4 3NJ
Permitted,12/00627/B,Creation of a first floor by raising the roof of dwelling,07-Jun-12,Senior Planning Officer - North (CB),Breckside Glen Darragh Road Glen Vine Isle Of Man IM4 4BE 
Deemed withdrawn 4(3) Dev Pro Order 2005,12/00628/C,Change of use of ground floor of dwelling as a recording studio,10-Sep-12,Withdrawn,The Old Bakery 4 Factory Lane Peel Isle Of Man IM5 1HF 
Permitted,12/00629/B,"Alterations, erection of extension and installation of replacement windows to dwelling",07-Jun-12,Senior Planning Officer - North (CB),Woodville Castletown Road Port St. Mary Isle Of Man IM9 5LT
Permitted,12/00630/B,Erection of a porch,14-Jun-12,Senior Planning Officer - North (CB),22 Pairk Beg Port Erin Isle Of Man IM9 6NQ
Permitted,12/00631/B,Installation of replacement windows and doors,07-Jun-12,Senior Planning Officer - North (CB),4 Mona Terrace Castletown Isle Of Man IM9 1BH
Permitted,12/00632/C,Removal of condition three restricting the use of dwellings to tourism (PA 02/01030/B),07-Jun-12,Senior Planning Officer - North (CB),1 & 2 Soalt Vooar Kerrowgarrow Road Greeba Isle Of Man IM4 3LQ
Permitted,12/00633/B,Installation of a solar panel,05-Jun-12,Senior Planning Officer - South (SC),33 Harcroft Avenue Douglas Isle Of Man IM2 1PE
Permitted,12/00634/B,Installation of a single shop front and fascia; use of 37/39 Victoria Street as two separate units  or as a single unit for either Class 1 purposes (retail) or Class 2 purposes (estate agents) or both.,10-Aug-12,Senior Planning Officer - South (SC),37 / 39 Victoria Street Douglas Isle Of Man IM1 2LF
Permitted,12/00635/D,Erection of signage (revised application to PA 11/00249/D),10-Aug-12,Senior Planning Officer - South (SC),37 / 39 Victoria Street Douglas Isle Of Man IM1 2LF
Permitted,12/00636/B,Erection of a maximum of one plotting / tool shed on each allotment and alteration to existing entrance gateway (retrospective),12-Jul-12,Planning Committee,Field 134249 Garey Road Garey Ramsey Isle Of Man  
Permitted,12/00637/B,Alterations and extension to dwelling and alterations to existing vehicular access,05-Jun-12,Senior Planning Officer - South (SC),Garth Cottage Ballaragh Road Laxey Isle Of Man IM4 7PH
Permitted,12/00638/B,Demolition of existing single storey extension and erection of a replacement single storey extension with roof terrace over,14-Jun-12,Senior Planning Officer - North (CB),Belle Vue House Belle Vue Peel Isle Of Man IM5 1UH
Permitted,12/00639/C,Continuation of use of conservatory as a beauty therapy treatment room (PA 10/00496/R),25-Jun-12,Planning Committee,5 Lower Cronk Orry Minorca Hill Laxey Isle Of Man IM4 7EG 
Permitted,12/00640/B,Erection of a two storey extension with revised road and parking layout,14-Jun-12,Senior Planning Officer - South (SC),Isle Of Man College  Homefield Road Douglas Isle Of Man IM2 6RB
Permitted,12/00641/C,Additional use of residential apartment as tourist accommodation,14-Jun-12,Senior Planning Officer - South (SC),28 Quay West Apartments Bridge Road Douglas Isle Of Man IM1 5AG 
Permitted,12/00642/C,Additional use of residential apartment as tourist accommodation,14-Jun-12,Senior Planning Officer - South (SC),29 Quay West Apartments Bridge Road Douglas Isle Of Man IM1 5AG 
