Decision,PA Ref,PROPOSAL,Decision issued,Determining Body,Property Address
Permitted,12/01060/B,Erection of three detached dwellings on site of previously approved two dwellings (Amendment to PA 10/00544/B),20-Sep-12,Senior Planning Officer - North (CB),"Plots B16 & B17 Field 311825 & Parts Of Fields 315097, 311826, 311827 & 314444 Between Derby Road / Poortown Road & QE2 High School And East Of Reayrt Ny Keylley Peel Isle Of Man  Reayrt Ny Cronk Poortown Road Peel Isle Of Man  "
Permitted,12/01061/B,Installation of dormer windows and erection of extension to dwelling,27-Nov-12,Senior Planning Officer - North (CB),19 Bridge Street Peel Isle Of Man IM5 1NQ
Permitted,12/01062/B,Installation of dormer to rear elevation and roof lights to front elevation,13-Sep-12,Senior Planning Officer - North (CB),Sheeoil Reesht 70 Slieau Curn Park Kirk Michael Isle Of Man IM6 1EW 
Permitted,12/01063/B,"Erection of three detached dwellings on site of previously approved four semi detached dwellings, revision of plot boundaries and extension of access road (Amendment to PA 10/00544/B)",20-Sep-12,Senior Planning Officer - North (CB),"Plots C18, C19, C20, C21 & C22 Field 311825 And Parts Of Fields 315097, 311826, 311827 & 314444 Between Derby Road / Poortown Road & QE2 High School And East Of Reayrt Ny Keylley Peel Isle Of Man "
Permitted,12/01064/B,Installation of a satellite dish,06-Sep-12,Senior Planning Officer - South (SC),Ballakermeen High School St Catherines Drive Douglas Isle Of Man IM1 4BE 
Permitted,12/01065/B,Erection of a replacement dwelling,02-Oct-12,Planning Committee,Ballarhenny Orrisdale Kirk Michael Isle Of Man IM6 2HJ 
Refused,12/01066/B,Erection of a roof extension to side elevation and installation of dormer to rear elevation,07-Sep-12,Senior Planning Officer - South (SC),12 Sunningdale Drive Onchan Isle Of Man IM3 1EQ
Refused,12/01068/B,Alterations and extensions to dwelling to form ancillary living accommodation and widening of driveway and vehicular access,20-Sep-12,Senior Planning Officer - North (CB),Amberwell Surby Road Surby Port Erin Isle Of Man IM9 6TA
Permitted,12/01069/B,Alterations to equestrian entrance gates and access,18-Sep-12,Planning Committee,Entrance To Ballamona Estate Oak Hill Port Soderick Isle Of Man  
Permitted,12/01070/B,Creation of additional hard standing and erection of canopy over front door,06-Sep-12,Senior Planning Officer - South (SC),9 Cooil Close Douglas Isle Of Man IM2 2HH
Permitted,12/01071/B,"Re-development of existing coach park including creation of three coach parking bays, manoeuvring/drop off area, waiting area, paving, seating and lighting",03-Nov-12,Department Application,Coach Park Mines Road Laxey Isle Of Man  
Application Invalid,12/01072/D,Erection of hoarding,19-Oct-12,Planning Committee,Ashdowne House Ballavale Road Santon Isle Of Man IM4 1EH
Permitted,12/01073/C,Change of use from residential to a residential care home,18-Sep-12,Planning Committee,14 Derby Road Douglas Isle Of Man IM2 3ET
Permitted,12/01074/B,Erection of extension to rear elevation,06-Sep-12,Senior Planning Officer - South (SC),Brow Crest Ballabrooie Drive Douglas Isle Of Man IM1 4HG
Permitted,12/01075/B,Installation of replacement windows to bay window,06-Sep-12,Senior Planning Officer - South (SC),3 Marathon Drive Douglas Isle Of Man IM2 4BP
Permitted,12/01076/B,Alterations and erection of extension to dwelling,07-Sep-12,Senior Planning Officer - South (SC),Riakano Lodge Pack Horse Lane Baldrine Isle Of Man IM4 6DT 
Permitted,12/01077/B,Alterations and erection of a two storey extension to dwelling,18-Sep-12,Planning Committee,Ballacowle Cottage Agneash Laxey Isle Of Man IM4 7NW 
Permitted,12/01078/B,Creation of a doorway to front elevation,13-Sep-12,Senior Planning Officer - South (SC),Railway Hotel Banks Circus Douglas Isle Of Man IM1 5AB
Permitted,12/01079/B,Erection of a replacement sun room extension and new utility extension,06-Sep-12,Senior Planning Officer - South (SC),Ballalaugh The Lhen Andreas Isle Of Man IM7 3EH 
Permitted,12/01080/B,Alterations and erection of a two storey extension to dwelling,18-Sep-12,Planning Committee,13 Cronk Cardle Corony Ramsey Isle Of Man IM7 1ET
Permitted,12/01081/B,Erection of a replacement dwelling,20-Sep-12,Senior Planning Officer - South (SC),Sarasota Ramsey Road Laxey Isle Of Man IM4 7PR
Permitted,12/01082/B,Demolition of existing and erection of a replacement dwelling,20-Sep-12,Senior Planning Officer - South (SC),Balladoole Cottage Bride Road Ramsey Isle Of Man IM7 4AB
Permitted,12/01083/D,Installation of illuminated and non illuminated signage,07-Sep-12,Senior Planning Officer - South (SC),Boots Opticians 10 Strand Street Douglas Isle Of Man IM1 2EE
Permitted,12/01084/GB,Change of use from offices to pre-school nursery (In association with 12/01085/CON),18-Sep-12,Planning Committee,Manannan House Market Square Castletown Isle Of Man IM9 1RB
Permitted,12/01085/CON,Registered Building Consent for internal alterations and change of use from office to pre-school nursery (RB no 17 in association with 12/01084/CON),28-Sep-12,Head of Development Management,Manannan House Market Square Castletown Isle Of Man IM9 1RB
Permitted,12/01086/D,Installation of a nameplate to premises (In association with 12/01087/CON),21-Sep-12,Head of Development Management,Manannan House Market Square Castletown Isle Of Man IM9 1RB
Permitted,12/01087/CON,Registered Building consent for the installation of a nameplate to premises (In association with 12/01086/D) Registered Building Nos. 17,21-Sep-12,Director Delegation,Manannan House Market Square Castletown Isle Of Man IM9 1RB
Permitted,12/01088/B,Installation of a replacement front door,06-Sep-12,Senior Planning Officer - South (SC),22 Hawarden Avenue Douglas Isle Of Man IM1 4BS
Refused,12/01089/B,"Alterations, erection of extensions and detached garage",07-Sep-12,Senior Planning Officer - South (SC),Thie Corneil Richmond Road Ramsey Isle Of Man IM8 3PA
Permitted,12/01090/B,Erection of a five storey office block with basement parking,01-Oct-12,Senior Planning Officer - South (SC),19- 20 St Georges Street Douglas Isle Of Man
Permitted,12/01091/B,Installation of replacement windows,13-Sep-12,Senior Planning Officer - South (SC),8 Somerset Square Douglas Isle Of Man IM2 5AG
Permitted,12/01092/B,Erection of a replacement agricultural building,10-Sep-12,Senior Planning Officer - South (SC),Ballaneddin Farm Main Road Ballaugh Isle Of Man IM7 5EB
Permitted,12/01093/B,Roofing works to existing storage shed,06-Sep-12,Senior Planning Officer - South (SC),Gob E Volley Depot Main Road Sulby Isle Of Man IM7 2HR
Permitted,12/01094/B,Alterations to existing car port to provide additional living accommodation,13-Sep-12,Senior Planning Officer - North (CB),49 Slieau Curn Park Kirk Michael Isle Of Man IM6 1EL
Permitted,12/01095/B,Alterations and erection of extension to dwelling,10-Sep-12,Head of Development Management,1 Kewaigue Cottages Kewaigue Douglas Isle Of Man IM4 1AF 
Permitted,12/01096/B,Erection of a portal frame building to accommodate an indoor dog training and rehabilitation centre,18-Sep-12,Planning Committee,Ard Jerkyll East Foxdale Road Eairy Isle Of Man IM4 3HL 
Permitted,12/01097/B,Erection of building to accommodate yard office and facilities,10-Sep-12,Head of Development Management,Mount Rule Equestrian Centre Mount Rule Douglas Isle Of Man IM4 4HW 
Permitted,12/01098/B,Alterations and extension to outhouse to create a studio,13-Sep-12,Senior Planning Officer - North (CB),Lyndale Glen Wyllin Kirk Michael Isle Of Man IM6 1AN 
Refused,12/01099/B,Removal of chimney stack,13-Sep-12,Senior Planning Officer - South (SC),7 Mount Pleasant Douglas Isle Of Man IM1 2PU
Permitted,12/01100/B,Erection of a detached dwelling with integral garage,20-Sep-12,Senior Planning Officer - North (CB),4 Perwick Road Port St. Mary Isle Of Man IM9 5QA 
Permitted,12/01101/B,Erection of extension to front elevation,07-Sep-12,Head of Development Management,8 Ellerslie Gardens Castletown Isle Of Man IM9 1LT 
Permitted,12/01102/B, Installation of replacement windows,05-Oct-12,Senior Planning Officer - South (SC),17 Christian Road Douglas Isle Of Man IM1 2QH
Permitted,12/01103/B,Installation of replacement windows to front and rear elevations,05-Oct-12,Senior Planning Officer - South (SC),26 Christian Road Douglas Isle Of Man IM1 2QN 
Permitted,12/01105/B,Erection of a store/tractor shed,08-Oct-12,Senior Planning Officer - North (CB),Coach House Old Castletown Road Crogga Santon Isle Of Man IM4 1EB
Permitted,12/01106/D,Creation of signage to premises,28-Sep-12,Senior Planning Officer - South (SC),Quality Furnishing Fort Street Douglas Isle Of Man IM1 2LJ 
Permitted,12/01107/B,Creation of a raised decking area with fencing to provide an outdoor seating area (Retrospective),15-Oct-12,Senior Planning Officer - South (SC),The Mailbox Capital House Circular Road Douglas Isle Of Man IM1 1AG 
Permitted,12/01108/B,Alterations and erection of extension to dwelling and vehicular access alterations,13-Sep-12,Senior Planning Officer - South (SC),Carla Beck 28 Devonshire Road Douglas Isle Of Man IM2 3RB
Permitted,12/01109/B,Erection of porch to front elevation,28-Sep-12,Senior Planning Officer - South (SC),24 Rheast Mooar Avenue Ramsey Isle Of Man IM8 3LR
Permitted,12/01110/B,Alterations and extensions to dwelling (Amendments to PA 12/00552/B),20-Sep-12,Senior Planning Officer - North (CB),Ballaman Ballnahowe Port Erin Isle Of Man IM9 6JF 
Permitted,12/01111/B,Erection of a detached garage,20-Nov-12,Senior Planning Officer - North (CB),Ballacain Bungalow Mount Rule Douglas Isle Of Man IM4 4HW 
Refused,12/01112/B,Erection of a garage and workshop extension,20-Sep-12,Senior Planning Officer - South (SC),Kione Y Churree Nassau Road Dogmills Ramsey Isle Of Man IM7 4AQ 
Permitted,12/01113/B,"Alterations, erection of extensions, roofing works and installation of dormer windows to dwelling (Amendments to PA 12/00017/B)",13-Sep-12,Senior Planning Officer - North (CB),14 Cronk Drine Union Mills Isle Of Man IM4 4NG
Permitted,12/01114/B,Window alterations to dwelling,14-Sep-12,Senior Planning Officer - North (CB),Majolica Ballagawne Road Colby Isle Of Man IM9 4BB
Permitted,12/01115/B,Erection of extension to replace existing conservatory,14-Sep-12,Senior Planning Officer - South (SC),4 Close Oard Ramsey Isle Of Man IM8 3PY 
Permitted,12/01116/B,Replace existing doorway with a window to rear elevation of dwelling,14-Sep-12,Senior Planning Officer - South (SC),1 Larch Hill Highton Wood Hill Tromode Douglas Isle Of Man IM2 5NQ
Permitted,12/01117/B,Removal of existing front boundary wall to form off street parking in front garden,18-Sep-12,Planning Committee,11 Third Avenue Onchan Isle Of Man IM3 4LZ
Refused,12/01119/C,Change of use to private garden/amenity land,17-Dec-12,Planning Committee,Land To The Rear Of Clybane Rise Douglas Isle Of Man  
Permitted,12/01120/B,Installation of roof lights to dwelling,14-Sep-12,Senior Planning Officer - North (CB),87 Ballabrooie Drive Douglas Isle Of Man IM1 4HH
Permitted,12/01121/B,Alterations and extension to rear of dwelling,14-Sep-12,Senior Planning Officer - North (CB),10 Stanley Road Peel Isle Of Man IM5 1NX
Permitted,12/01122/B,Alterations to existing garage to create a double garage,20-Sep-12,Senior Planning Officer - South (SC),Flat 2  Seafield Ballure Road Ramsey Isle Of Man IM8 1NL
Permitted,12/01123/B,Erection of five dwellings (Amendments to house types approved under PA 10/00544/B),15-Oct-12,Senior Planning Officer - North (CB),"Plots C13,C16,C17,C24 And C 26, Residential Development  Field 311825 And Parts Of Fields 315097, 311826, 311827 & 314444 Between Derby Road / Poortown Road & QE2 High School And East Of Reayrt Ny Keylley Peel Isle Of Man  "
Permitted,12/01124/B,Erection of a building to provide three apartments and associated integral parking,16-Oct-12,Head of Development Management,Site Of Former No 2 Princes Street Douglas Isle Of Man  
Permitted,12/01126/GB,"Installation of replacement windows, doors and thatching to dwelling, rebuild boundary wall and creation of parking bay (partial retrospective) (In association with 12/01127/CON)",12-Nov-12,Head of Development Management,Cranstal Cottage Cranstal Bride Isle Of Man IM7 4BP 
Permitted,12/01127/CON,"Registered Building consent for the installation of replacement windows, doors and thatching to dwelling, rebuild boundary wall and creation of parking bay (partial retrospective) (In association with 12/01126/GB) Registered Building Nos. 3",12-Nov-12,Head of Development Management,Cranstal Cottage Cranstal Bride Isle Of Man IM7 4BP 
Permitted,12/01128/B,"Erection of a sludge import, thickening and storage facility",17-Oct-12,Planning Committee,Meary Veg Sewage Treatment Works Balnahowe Santon Isle Of Man IM4 1HL 
Permitted,12/01129/B,Removal of condition 3 from 09/00428/B regarding the suspension of permitted development rights from the Town and Country Planning (Permitted Development) Order,02-Oct-12,Planning Committee,Aigney Mie Shore Road Bay Ny Carrickey Port St. Mary Isle Of Man IM9 5LZ
Permitted,12/01130/B,Erection of garden shed and greenhouse,27-Sep-12,Senior Planning Officer - North (CB),Aigney Mie Shore Road Bay Ny Carrickey Port St. Mary Isle Of Man IM9 5LZ
Application Withdrawn,12/01131/B,Variation of condition 4 of PA 10/01329/B concerning the demolition of structures prior to the occupation of the replacement dwelling,08-Oct-12,Withdrawn,Close Leece Farm Patrick Road St Johns Isle Of Man IM4 3BR
Permitted,12/01132/B,Installation of replacement windows (Retrospective),20-Sep-12,Senior Planning Officer - South (SC),Flat 2   9 Princes Road Douglas Isle Of Man IM2 4HX
Permitted,12/01133/B,Erection of porch to front elevation,20-Sep-12,Senior Planning Officer - North (CB),10 Close Corneil Port Erin Isle Of Man IM9 6BN
Permitted,12/01134/B,Alterations and extension to dwelling (Amendments to PA 11/00876/B),20-Sep-12,Senior Planning Officer - North (CB),Mountain View 36 Cannan Avenue Kirk Michael Isle Of Man IM6 1HG
Certificate of Lawfulness AGREED,12/01135/LAW,Application for a Certificate of Lawful Use of land for equestrian uses,01-Nov-12,Head of Development Management,Ballawhetstone  Douglas Road Ballabeg Castletown Isle Of Man IM9 4ED
Permitted,12/01136/B,Alterations and replacement entrance conservatory,25-Oct-12,Department Application,Pre-School Assessment Centre  Pulrose Road Douglas Isle Of Man IM2 1AT
Permitted,12/01138/B,Erection of a terrace of three dwellings with parking and new vehicular access onto Ramsey Road,02-Nov-12,Planning Committee,Land Adjacent To Carnaween Battery Road Peel Isle Of Man  
Permitted,12/01139/B,Alterations and extension to dwelling (Amendments to PA 11/01281/B),20-Sep-12,Senior Planning Officer - South (SC),7 Taubman Street Ramsey Isle Of Man IM8 1DH
Permitted,12/01141/B,Demolition of existing rear extension and erection of a replacement extension (Amendments to PA 12/00372/B),20-Sep-12,Senior Planning Officer - South (SC),British Hotel North Quay Douglas Isle Of Man IM1 4LB
Permitted,12/01142/B,Re-instatement of window to side elevation,24-Dec-12,Senior Planning Officer - South (SC),Hairdressers  4 New Road Laxey Isle Of Man IM4 7BE
Permitted,12/01143/B,Extend driveway and widen vehicular access (retrospective),20-Sep-12,Senior Planning Officer - South (SC),38 Port E Chee Avenue Douglas Isle Of Man IM2 5ER
Permitted,12/01144/B,Alterations and extensions to dwelling and alterations to vehicular access,20-Sep-12,Senior Planning Officer - North (CB),The Old Vicarage Kionslieu Hill Foxdale Isle Of Man IM4 3HB
Permitted,12/01145/B,Reduction in height of existing roadside fencing,20-Sep-12,Senior Planning Officer - North (CB),Crogga Mansion House Old Castletown Road Crogga Santon Isle Of Man IM4 1EB
Permitted,12/01146/B,Alterations to existing detached garage,21-Sep-12,Senior Planning Officer - South (SC),Ballagarey Ramsey Road Laxey Isle Of Man IM4 7PT
Permitted,12/01147/B,Erection of a dwelling,23-Oct-12,Senior Planning Officer - South (SC),Land Adjacent To Alberta  Grove Mount Ramsey Isle Of Man  
Permitted,12/01148/B,Installation of a flue,20-Sep-12,Senior Planning Officer - North (CB),17 Wallberry Mews Douglas Isle Of Man IM2 2NE
Permitted,12/01149/D,Erection of signage,28-Sep-12,Senior Planning Officer - South (SC),Building Associated With Wessex Garage Woodbourne Lane Douglas Isle Of Man IM2 3QL
Refused,12/01150/C,Change of use from tourist accommodation to residential accommodation,02-Nov-12,Planning Committee,Waterfall Barn Ballakerkey Farm Shore Road Glen Maye Isle Of Man IM5 3BG 
Permitted,12/01151/B,Installation of a roof lantern,20-Sep-12,Senior Planning Officer - South (SC),5 Thornhill Park Ramsey Isle Of Man IM8 3NA
Permitted,12/01152/B,Demolition of existing garage and erection of an extension to side elevation,20-Sep-12,Senior Planning Officer - North (CB),The Old Post Office  Main Road Colby Isle Of Man IM9 4NS 
Permitted,12/01153/B,Erection of an extension to garage and enlargement of existing balcony,20-Sep-12,Senior Planning Officer - North (CB),20 Lime Street Port St. Mary Isle Of Man IM9 5EF
Application Withdrawn,12/01154/B,Installation of replacement windows to front elevation,24-Oct-12,Withdrawn,Glenwood Glen Road Laxey Isle Of Man IM4 7AH
Permitted,12/01155/B,Erection of a replacement sun room extension and window alterations,20-Sep-12,Senior Planning Officer - South (SC),Ballamoar Farm Doarlish Ard Foxdale Isle Of Man IM4 3BH 
Permitted,12/01156/GB,Installation of telecommunication antennas and equipment ( In association with 12/01157/CON),19-Nov-12,Head of Development Management,The George Hotel The Parade Castletown Isle Of Man IM9 1LG
Permitted,12/01157/CON,Registered Building Consent for installation of telecommunication antennas and equipment (RB no 38 in association with 12/01156/GB),19-Nov-12,Head of Development Management,The George Hotel The Parade Castletown Isle Of Man IM9 1LG
Permitted,12/01158/GB,Installation of four face mounted antennas to existing chimneys (In association with 12/01159/CON),10-Dec-12,Head of Development Management,Nightlife Market Place West Ramsey Isle Of Man IM8 1JU
Permitted,12/01159/CON,Registered Building consent for the installation of four face mounted antennas to existing chimneys and installation of internal wall mounted equipment cabinets (In association with 12/01158/GB) Registered Building Nos. 144,10-Dec-12,Head of Development Management,Nightlife Market Place West Ramsey Isle Of Man IM8 1JU
Refused,12/01160/B,Installation of flood lighting to riding arena,25-Oct-12,Senior Planning Officer - South (SC),Field Number 614732 Baldrine Farm Baldrine Road Baldrine Isle Of Man  
Committee Declined to consider,12/01161/A,Approval in principle for the erection of a detached agricultural dwelling,16-Oct-12,Planning Committee,Ballanybaa Blue Point Road The Lhen Ramsey Isle Of Man IM7 3EQ 
Permitted,12/01162/B,Erection of a single storey extension to replace existing garage,20-Sep-12,Senior Planning Officer - North (CB),The Old Chapel House Strang Hill Strang Douglas Isle Of Man IM4 4NX
Permitted,12/01163/B,Removal of two dormer windows and installation of two roof lights to dwelling,20-Sep-12,Senior Planning Officer - South (SC),8 Albert Street Douglas Isle Of Man IM1 2QA
Permitted,12/01164/B,Erection of kitchen extension and decking to rear elevation,20-Sep-12,Senior Planning Officer - South (SC),2 Mount Bradda Douglas Isle Of Man IM1 4AR
Permitted,12/01165/B,Installation of replacement double doors to front elevation,20-Sep-12,Senior Planning Officer - North (CB),The Anchorage Athol Park Port Erin Isle Of Man IM9 6EX
Permitted,12/01166/B,Erection of an agricultural building,01-Oct-12,Senior Planning Officer - South (SC),Ballaskelly Farm  Mountain Road Onchan Isle Of Man IM4 5BL
Permitted,12/01167/B,Installation of replacement windows to ground floor on front elevation,20-Sep-12,Senior Planning Officer - North (CB),The Anchorage Athol Park Port Erin Isle Of Man IM9 6EX
Permitted,12/01168/B,Installation of a replacement front door and frame,20-Sep-12,Senior Planning Officer - South (SC),12 Queens Avenue Douglas Isle Of Man IM1 4DA
Permitted,12/01169/B,"Erection of timber side boundary fence, re-rendering of dwelling and amendments to vehicular access and hardstanding (Retrospective) and permission for new bay windows with French doors, removal of chimney stack and erection of greenhouse in front garden",01-Nov-12,Senior Planning Officer - South (SC),9 Cronk Road Union Mills Isle Of Man IM4 4NJ
Permitted,12/01170/B,Installation of replacement windows,28-Sep-12,Senior Planning Officer - South (SC),White House 1 Drury Terrace Douglas Isle Of Man IM2 3HY
Permitted,12/01171/B,Erection of an extension to front elevation,03-Oct-12,Senior Planning Officer - North (CB),1 Queens Court Queens Road Port St. Mary Isle Of Man IM9 5EU 
Permitted,12/01172/B,Alteration to front elevation bay window and other window apertures on front elevation of dwelling,05-Oct-12,Senior Planning Officer - South (SC),Theakstons Regaby West Road Andreas Isle Of Man IM7 3HL
Permitted,12/01173/B,Enclosure of area under existing canopy to front of shop area to create a coffee lounge,16-Oct-12,Head of Development Management,Hanly's Diamond House Demesne Road Douglas Isle Of Man IM1 3DS
Permitted,12/01174/B,Alterations and extensions to dwelling,15-Nov-12,Senior Planning Officer - South (SC),Port E Vullen House Port E Vullen Ramsey Isle Of Man IM7 1AN 
Permitted,12/01176/B,Installation of new windows and alterations to existing windows,28-Sep-12,Senior Planning Officer - South (SC),Port E Vullen House Port E Vullen Ramsey Isle Of Man IM7 1AN 
Permitted,12/01177/B,Alterations and erection of a three storey extension (comprising amendments to PA 09/02065/B),28-Sep-12,Senior Planning Officer - South (SC),Baldromma Christian Ballamenagh Road Baldrine Isle Of Man IM4 6AG
Permitted,12/01178/B,Alterations and erection of extensions to dwelling,02-Oct-12,Planning Committee,Ballig Cottage Handleys Corner Kirk Michael Isle Of Man IM6 1AY
Permitted,12/01179/B,Alterations and erection of extensions to dwelling,16-Oct-12,Planning Committee,Boodee Beg Bride Road Bride Isle Of Man IM7 4AF 
Permitted,12/01180/B,Conversion of building into three apartments,02-Nov-12,Planning Committee,38 Demesne Road Douglas Isle Of Man IM1 3DY
Permitted,12/01181/B,Erection of latticed fencing (partial retrospective),05-Oct-12,Senior Planning Officer - South (SC),61 Devonshire Road Douglas Isle Of Man IM2 3RA
Permitted,12/01182/B,Erection of a two storey extension to north west elevation,28-Sep-12,Senior Planning Officer - North (CB),2 Rhenwyllan Close Port St. Mary Isle Of Man IM9 5NH
Permitted,12/01183/B,Installation of replacement windows to front elevation of dwelling,28-Sep-12,Senior Planning Officer - North (CB),21 Mona Street Peel Isle Of Man IM5 1HJ
Permitted,12/01184/C,Change of use of former dental practice to three dwellings (Retrospective),28-Sep-12,Senior Planning Officer - South (SC),1-3 Kensington Road Douglas Isle Of Man IM1 3ER
Permitted,12/01185/TEL,Installation of a 12.5 metre high slim line monopole with two antennas and associated cabinets,01-Nov-12,Director Delegation,"Embankment Off A2, Bulgham Bay A2 Isle Of Man  "
Permitted,12/01186/B,Creation of a skate park,02-Oct-12,Planning Committee,Cronk Grianagh Park Strang Douglas Isle Of Man  
Permitted,12/01187/B,Alterations and extension to dwelling including erection of roadside walls and gates,28-Sep-12,Senior Planning Officer - South (SC),Carrick House Clay Head Road Baldrine Isle Of Man IM4 6DP 
Certificate of Lawfulness AGREED,12/01188/LAW,Application for a certificate of lawful development for conversion of floor above garage into living accommodation,12-Nov-12,Head of Development Management,Yn Rheash Corlea Road Ballasalla Isle Of Man IM9 3BA
Permitted,12/01189/B,Installation of replacement roof tiles and roof light,28-Sep-12,Senior Planning Officer - South (SC),38 York Road Douglas Isle Of Man IM2 3AX
Permitted,12/01190/B,Erection of a field shelter and stable,05-Oct-12,Senior Planning Officer - South (SC),Melrose Cottage St Judes Road Andreas Isle Of Man IM7 3HF
Permitted,12/01191/B,Erection of an open sided all weather shelter,06-Nov-12,Senior Planning Officer - North (CB),The Bowling Green The Crofts   Castletown Isle Of Man 
Refused,12/01192/B,"Erection of a detached garage, creation of new vehicular access and drive and extension of domestic curtilage into adjacent Field no 224042",06-Nov-12,Senior Planning Officer - South (SC),Harleys Killane Ballaugh Isle Of Man IM7 5BB 
Permitted,12/01194/B,Installation of double doors and side lights to replace existing garage doors and widening of driveway and access onto highway,05-Oct-12,Senior Planning Officer - South (SC),12 Farmhill Gardens Douglas Isle Of Man IM2 2EG
Permitted,12/01195/B,Erection of a first floor level porch to rear elevation of converted barn,05-Oct-12,Senior Planning Officer - South (SC),Margher E Kew Hibernia Ramsey Isle Of Man IM7 1ER 
Permitted,12/01196/B,"Alterations, erection of a single and a two storey extension and installation of replacement windows to dwelling",27-Nov-12,Planning Committee,Stuggadhoo  St Marks Road Braaid Isle Of Man IM4 2AL 
Permitted,12/01198/B,Alterations to shop front and installation of replacement windows,05-Oct-12,Senior Planning Officer - South (SC),Whitehouse Buildings New Road Laxey Isle Of Man IM4 7BB
Permitted,12/01199/B,Erection of a detached storage building,05-Oct-12,Senior Planning Officer - South (SC),Stella Maris Mountain Road Ramsey Isle Of Man IM8 2JJ
Permitted,12/01200/B,Erection of an extension to replace existing conservatory,08-Oct-12,Senior Planning Officer - North (CB),1 Homefield Villas Douglas Road Ballasalla Isle Of Man IM9 2EJ
