Decision,PA Ref,PROPOSAL,Decision issued,Determining Body,Property Address
Certificate of Lawfulness AGREED,22/00730/LAW,"Certificate of lawful development for the installation of replacement roof slates, roof windows and ventilation spigots",09-Aug-22,Director 2017+,4 Stanley Terrace Douglas Isle Of Man IM2 4EP
Permitted,22/00731/B,Installation of a replacement ground floor front elevation window and front door,15-Jul-22,Head of Development Management,27 Hope Street Castletown Isle Of Man IM9 1AP
Permitted,22/00732/B,Proposed single storey Sun Lounge extension to rear and first floor extension over garage,05-Aug-22,Principal Planner- North (CB),7 Oak Park Peel Isle Of Man IM5 1XH 
Permitted,22/00734/CON,Registered Building Consent for demolition elements to PA 22/00570/B,15-Jul-22,Head of Development Management,25 Market Street Douglas Isle Of Man IM1 2PA 
Permitted,22/00735/B,Erection of a replacement dwelling,19-Aug-22,Principal Planner - South (JS),Scravorley Curragh Road St Johns Isle Of Man IM4 3LN
Permitted,22/00736/B,Conversion of existing outbuildings into ancillary accommodation with additional tourist use,23-Nov-22,Principal Planner - South (JS),Ballaragh Old Farmhouse Ballaragh Laxey Isle Of Man IM4 7PN 
Refused,22/00737/B,Erection of fencing (retrospective),18-Nov-22,Principal Planner- North (CB),3 King Edward Park Onchan Isle Of Man IM3 2AD
Permitted,22/00739/B,Installation of replacement windows to front elevation,15-Jul-22,Principal Planner- North (CB),21 Mona Street Douglas Isle Of Man IM1 2QE
Permitted,22/00740/B,New gable window to bathroom,12-Aug-22,Principal Planner- North (CB),5 King Edward Bay Apartments Sea Cliff Road Onchan Isle Of Man IM3 2JE 
Permitted,22/00741/B,Erection of replacement single storey extension to the rear,05-Aug-22,Head of Development Management,Conifer Cottage 10 Park Close Glen Vine Isle Of Man IM4 4HB
Permitted,22/00742/B,Installation of replacement windows to rear elevation,15-Jul-22,Head of Development Management,4 Bank Street Castletown Isle Of Man IM9 1AT 
Refused,22/00743/B,Installation of a first floor balcony,29-Jul-22,Principal Planner- North (CB),4 Windsor Terrace Douglas Isle Of Man IM1 3LU
Permitted,22/00744/B,Alterations and erection of a 2 storey extension,19-Dec-22,Principal Planner - South (JS),Ballagarraghyn Cottage Main Road Greeba Isle Of Man IM4 3LH
Permitted,22/00745/C,Change of use of building from office space (class 2.1) to retail (class 1.1),14-Sep-22,Principal Planner - South (JS),32  Market Street Peel Isle Of Man IM5 1AE 
Refused,22/00746/B,Installation of an air source heat pump replacing existing fossil fuel burner,05-Aug-22,Head of Development Management,5 Cronk Y Berry Mooar Douglas Isle Of Man IM2 6HJ
Permitted,22/00747/B,Installation of two flues,20-Jul-22,Head of Development Management,Ben Vane Phildraw Road Ballasalla Isle Of Man IM9 3EH
Refused,22/00748/GB,Alterations and extension to dwelling (in association with RB consent application 22/00750/CON),26-Oct-22,Principal Planner - South (JS),Old School House Main Road Sulby Isle Of Man IM7 2HP 
Permitted,22/00749/B,Erection of a detached garage,16-Sep-22,Principal Planner- North (CB),Field 324226 Main Road Glen Vine Isle Of Man IM4 4AZ 
Refused,22/00750/CON,"Alterations to dwelling including the removal of the existing rear conservatory, erection of two single storey extensions at the rear and creation of an additional entrance door on the front elevation - RB171 (in association with application 22/00748/GB)",26-Oct-22,Principal Planner - South (JS),Old School House Main Road Sulby Isle Of Man IM7 2HP 
Permitted,22/00751/B,Alterations and erection of a 2 storey extension,21-Sep-22,Principal Planner- North (CB),Garthcote Ballakillowey Road Colby Isle Of Man IM9 4BD
Permitted,22/00752/B,"Erection of patio, walling with adjoining clock towers and associated landscaping works (Retrospective)",27-Oct-22,Principal Planner - South (JS),Copper Top 1 Booilushag Ballajora Ramsey Isle Of Man IM7 1BD
Permitted,22/00753/B,"Alterations including roofing works, cladding removal of windows, installation of a new fire door and additional use of first floor storage area for dog day care business",08-Nov-22,Planning Committee,The Warehouse Demesne Road Douglas Isle Of Man  
Permitted,22/00754/B,Erection of a rear extension,28-Jul-22,Principal Planner- North (CB),23 Ballaquark Douglas Isle Of Man IM2 2EZ
Permitted,22/00755/B,"Landscaping works involving installation of a detached sauna room, composite timber decking and hot tub, rear fencing and alteration to external balustrading and installation of new glass balustrading",21-Oct-22,Principal Planner - Enf (AM),Milner Mount Bradda West Road Spaldrick Port Erin Isle Of Man IM9 6PN
Certificate of Lawfulness DECLINED,22/00756/LAW,Certificate of lawful development for the installation of replacement rear windows and roof,13-Sep-22,Principal Planner- North (CB),6 Osborne Grove Douglas Isle Of Man IM1 3LE
Permitted,22/00759/B,Relocation of existing shed from beside of dwelling to the rear,11-Aug-22,Head of Development Management,27 Cannan Court Kirk Michael Isle Of Man IM6 1FA 
Permitted,22/00760/B,Erection of replacement single storey rear porch extension and removal of side conservatory,29-Jul-22,Principal Planner- North (CB),Westhall Farm Bridge Road Ballasalla Isle Of Man IM9 3DQ
Permitted,22/00761/B,Erection of a detached domestic building,12-Aug-22,Head of Development Management,72 Birch Hill Crescent Onchan Isle Of Man IM3 3DA
Permitted,22/00762/B,"First floor extension with alterations to west elevation",29-Jul-22,Principal Planner - South (JS),Ballayockey Beg Ballayockey Lane Regaby Ramsey Isle Of Man IM7 3HP
Permitted,22/00764/B,Erection of single storey flat roof rear extension and repositioning of existing conservatory to side elevation,04-Nov-22,Principal Planner- North (CB),Watership Down 4 Mourne View Peel Isle Of Man IM5 1UJ
Permitted,22/00765/B,Installation of automatic vehicle barrier to school car park,29-Jul-22,Principal Planner- North (CB),Laxey School Quarry Road Laxey Isle Of Man IM4 7DU
Permitted,22/00767/B,Conversion of four apartments into a single residential dwelling and the erection of new terraced residential dwelling,25-Nov-22,Principal Planner- North (CB),104 Summerhill Road Onchan Isle Of Man IM3 1NJ
Permitted,22/00768/B,First floor pitched roof extension on top of existing rear single storey extension with associated works,04-Nov-22,Principal Planner- North (CB),3 Grafton Street Douglas Isle Of Man IM2 3HD
Permitted,22/00769/B,Extension of dropped kerb to widen existing vehicular access and provide additional off street parking space including re-surfacing of existing hardstanding,21-Oct-22,Principal Planner- North (CB),Seabridge 16 Bowring Road Ramsey Isle Of Man IM8 3EJ
Refused,22/00770/B,"Erection of stable, feed store and field shelter.",26-Oct-22,Principal Planner - South (JS),Field 510788 Old Castletown Road Santon Isle Of Man IM4 1HG 
Permitted,22/00771/B,Installation of replacement windows and doors,12-Aug-22,Head of Development Management,2 Marlborough Terrace Douglas Isle Of Man IM2 3QJ
Permitted,22/00772/B,Replacement of high level fencing to school play ground,29-Jul-22,Principal Planner- North (CB),Laxey School Quarry Road Laxey Isle Of Man IM4 7DU
Permitted,22/00773/CON,Registered building consent for the restoration of the crenellations to the Tower and Hall including the installation of stone copings throughout and reinstatement of stone banding on the Tower - RB1,12-Aug-22,Head of Development Management,Bishopscourt Mansion House Bishopscourt Kirk Michael Isle Of Man IM6 2EZ 
Permitted,22/00774/B,Erection of a single storey rear extension,07-Oct-22,Principal Planner - South (JS),56 Royal Avenue Onchan Isle Of Man IM3 1LB
Permitted,22/00775/CON,Registered building consent for restoration works to farmhouse (RB336),12-Aug-22,Head of Development Management,Ballavarry Farm Bernahara Road Andreas Isle Of Man IM7 3HH
Permitted,22/00776/C,Proposed additional use of residential dwelling as tourist accommodation,05-Sep-22,Principal Planner - South (JS),5 Springfield Terrace Castletown Isle Of Man IM9 1AW
Permitted,22/00777/B,Erection of an extension,18-Nov-22,Principal Planner- North (CB),4 Murrays Lake Drive Mount Murray Douglas Isle Of Man IM4 2GZ
Permitted,22/00778/B,Installation of two Air Source Heat Pumps,03-Oct-22,Principal Planner- North (CB),Lhergy Vreck Farm Douglas Road Kirk Michael Isle Of Man IM6 1AS
Permitted,22/00779/B,Erection of ground and first floor extension to dwelling,09-Nov-22,Principal Planner - South (JS),7 Ballatessan Meadow Peel Isle Of Man IM5 1DU 
Permitted,22/00780/B,Alterations including replacement roofing and installation of dome roof windows to outbuilding,07-Oct-22,Principal Planner - South (JS),California Cottage Glen Road Colby Isle Of Man IM9 4NU 
Permitted,22/00781/B,Erection of a detached dwelling,21-Dec-22,Planning Committee,Plot 1 Field Adjcent To Beechfield Glen Auldyn Ramsey Isle Of Man  
Permitted,22/00783/B,Demolition of existing dwelling and erection of replacement 2 storey detached dwelling with pitched roofs and solar panels with integrated garage and front and rear terrace with balustrade surround,16-Nov-22,Principal Planner - Enf (AM),Tamarisk Main Road Kirk Michael Isle Of Man IM6 1AJ
Permitted,22/00784/CON,Registered Building Consent for the demolition of existing property and erection of replacement dwelling (in association with PA 22/00783/B),18-Nov-22,Principal Planner - Enf (AM),Tamarisk Main Road Kirk Michael Isle Of Man IM6 1AJ
Permitted,22/00785/B,Replacement of existing gas boiler with an air source heat pump,11-Oct-22,Principal Planner - South (JS),Audley House Main Road Union Mills Isle Of Man IM4 4AG 
Permitted,22/00786/D,Installation of a non Illuminated Site Sales Board,06-Sep-22,Principal Planner - South (JS),Bayqueen Hotel The Promenade Port St Mary Isle Of Man IM9 5DG 
Permitted,22/00787/B,Installation of replacement door and window to side elevation and internal reconfiguration to reception area,12-Aug-22,Head of Development Management,Jurby School School Close Jurby Isle Of Man IM7 3BJ
Permitted,22/00788/B,Alterations to School Yard Entrance Lobby including new entrance door and replacement window,12-Aug-22,Head of Development Management,Jurby Primary School School Close Jurby Isle Of Man IM7 3BJ
Permitted,22/00790/C,Change of Use: for additional use as tourist accommodation,17-Aug-22,Principal Planner - South (JS),49 Scarlett Road Castletown Isle Of Man IM9 1PN 
Permitted,22/00791/B,"Alterations including rendering, replacement roofing with installation of velux roof lights",29-Jul-22,Principal Planner- North (CB),1 Frederick Street Douglas Isle Of Man IM1 2EY
Permitted,22/00792/B,Alterations and refurbishment to existing dwelling with additional use for tourist accommodation,17-Aug-22,Principal Planner - South (JS),Bridge Cottage Bridge Street Castletown Isle Of Man IM9 1AX 
Refused,22/00793/B,"Erection of a double storey front extension with balcony and external stairs, a single storey rear extension installation of dormer window to the front elevation and  replacement flat roof to the conservatory and installation of 2 replacement french doors",23-Nov-22,Principal Planner - South (JS),The Garelly Earystane Colby Isle Of Man IM9 4HN 
Permitted,22/00794/B,Erection of a Sun lounge extension to rear of property and extension of existing hard standing area to front of property,19-Aug-22,Principal Planner - South (JS),4 Grove Mount Ramsey Isle Of Man IM8 3HQ
Permitted,22/00795/B,Erection of a double storey rear extension and a single storey side extension.,21-Sep-22,Principal Planner - South (JS),85 Cronk Grianagh Estate Douglas Isle Of Man IM4 4RR 
Permitted,22/00796/B,Cladding and window alterations to existing first floor front elevation and installation of a flue.,21-Sep-22,Principal Planner - South (JS),Ballamar Clifton Road Port St Mary Isle Of Man IM9 5EL 
Permitted,22/00797/B,Remove of existing chimney stack,13-Oct-22,Principal Planner- North (CB),Glen View Cottage Main Road Ballaugh Isle Of Man IM7 5EF
Permitted,22/00798/B,Erection of car port (Retrospective),14-Nov-22,Principal Planner- North (CB),The Granary Ballachrink Farm Dalby Isle Of Man IM5 3BN 
Permitted,22/00799/B,Installation of 2 ponds and associated works,29-Jul-22,Principal Planner - South (JS),Manx Telecom Corporate Headquarters Isle Of Man Business Park Douglas Isle Of Man IM2 2QJ 
Application Withdrawn,22/00800/B,"Formation of bowling green and construction of associated pavilion, shelters, car parking and landscaping",22-Aug-22,Withdrawn,"Field Numbers  411628, 411629 (now 414759) & 411638 Station Road Port St Mary Isle Of Man "
Application Withdrawn,22/00801/B,"Variation of Condition 5 of 18/01022/B, in order to permit pedestrian and vehicular access from existing access onto the public highway, through the parking area, to the land to the west for the purposes of a separately proposed community facility (bowlin",22-Aug-22,Withdrawn,Part Field 411629 (know 414759) Station Road Port St Mary Isle Of Man IM9 5LF 
Permitted,22/00802/B,Erection of rear single storey flat roof extension with bi-fold doors and installation of raised patio and extension of existing driveway hardstanding to the side elevation.,30-Aug-22,Principal Planner- North (CB),1 Eskdale Road Onchan Isle Of Man IM3 2AL
Permitted,22/00804/B,Replacement of roof to outbuilding (retrospective),21-Sep-22,Principal Planner - South (JS),4 Hope Street Castletown Isle Of Man IM9 1AS
Permitted,22/00805/B,Widening of vehicle access to the front elevation and replacement of single storey side garage with the erection of replacement 2 storey extension with pitched roof and erection of single storey pitched roof conservatory and raised decking and ballustrade,03-Oct-22,Principal Planner - South (JS),Thie-Ny-Corneil Peveril Avenue Peel Isle Of Man IM5 1QB
Permitted,22/00806/GB,"Replacement of part of rear external wall, replacement of roof to corridor, works to cell roofs, and change of use of building to hotel reception (class3.1) and exhibition / community space (class 4.3) (in association with 22/00808/CON)",24-Nov-22,Principal Planner - South (JS),Former Police Station The Quay Castletown Isle Of Man IM9 1LD
Permitted,22/00807/B,Installation of a flue,26-Aug-22,Principal Planner- North (CB),3 Royal Park Ramsey Isle Of Man IM8 3UF 
Permitted,22/00808/CON,"External and internal alterations to building including replacement of corridor roof, works to cell roofs, replacement floors and works in connection with a change of use of building to hotel reception and community exhibition space(in association with PA",02-Dec-22,Principal Planner - South (JS),Former Police Station The Quay Castletown Isle Of Man IM9 1LD
Permitted,22/00809/B,"Erection of replacement conservatory to the rear, installation of ground floor level window and removal of gate pillar at the front entrance with associated works",27-Oct-22,Principal Planner - South (JS),1 Hamilton Close Lower Foxdale Isle Of Man IM4 3BA
Permitted,22/00810/B,Removal of flat and pitched roof over ground floor yard with associated works and installation of french doors to side elevation,07-Oct-22,Principal Planner - South (JS),New Inn New Road Laxey Isle Of Man IM4 7HS
Permitted,22/00811/B,Planting of trees to part of field (Retrospective),05-Aug-22,Principal Planner - South (JS),Field 334104 Creggan Moar House Lhagg Road Dalby Isle Of Man IM5 3BU
Permitted,22/00812/B,Erection of dwelling,08-Nov-22,Principal Planner- North (CB),"Field 434091 Plot C43, Phase 3 Of Approved Residential Development, Between Railway Line And By-pass Douglas Road Ballasalla  "
Permitted,22/00814/B,Variation of condition 3 of PA 15/00613/C to increase the number of children on site from 41 to 56.,10-Nov-22,Principal Planner - South (JS),Play Centre Alexandra Road Castletown Isle Of Man IM9 1TE 
Permitted,22/00815/B,Installation of a replacement front door,17-Aug-22,Principal Planner - South (JS),24 Stanley Road Peel Isle Of Man IM5 1NY
Permitted,22/00816/B,"Second floor extension to front and rear with balcony to the front, erection of single story extension to the front and side with glazed balcony  and the installation of replacement doors windows and roof",04-Nov-22,Principal Planner- North (CB),Southwinds Church Road Onchan Isle Of Man IM3 1BF
Permitted,22/00817/B,Demolition of single storey side extension and rebuilding of gable wall and removal of kitchen door entrance with associated works,04-Aug-22,Head of Development Management,The Old Police Station Andreas Village Isle Of Man IM7 4EZ 
Permitted,22/00818/B,Erection of rear extension to dwelling,17-Aug-22,Principal Planner - South (JS),12A Bromet Road Castletown Isle Of Man IM9 1BR 
Permitted,22/00819/B,Replacement Dwelling and Integral Garage,11-Oct-22,Planning Committee,The Warren Clannagh Road Santon Isle Of Man IM4 2HP 
Permitted,22/00820/B,Installation of replacement windows and doors,26-Oct-22,Principal Planner - South (JS),Peel Post Office Douglas Street Peel Isle Of Man IM5 1BB 
Permitted,22/00821/B,Creation of new driveway and parking in front garden and to side of dwelling,14-Nov-22,Principal Planner - South (JS),9 Western Avenue Douglas Isle Of Man IM1 4EP
Permitted,22/00822/B,"Alterations, erection of rear extension, and use of garage as storage, associated bicycle storage to replace a lost parking space and use as a dog grooming business",18-Nov-22,Principal Planner- North (CB),22 Alberta Drive Onchan Isle Of Man IM3 1LS
Permitted,22/00823/B,Creation of a skate park and erection of surrounding fence,22-Aug-22,Principal Planner - South (JS),Skateboard Park Glen Road Laxey Isle Of Man IM4 7AH
Permitted,22/00824/D,Installation of illuminated and non illuminated signage,12-Oct-22,Principal Planner- North (CB),The Chapel Nursery Avenue Onchan Isle Of Man IM3 4HG 
Permitted,22/00825/B,"Variation of condition one of PA 18/00602/B, Erection of a detached dwelling with associated landscaping, creation of an additional driveway and alterations to existing vehicular access, to extend the period of permission by four years",14-Sep-22,Principal Planner - South (JS),Ashbourne House Ballacraine St Johns Isle Of Man IM4 3NF 
Permitted,22/00829/B,Installation of flue for woodburner,23-Aug-22,Principal Planner - South (JS),33 Glebe Aalin Ballaugh Isle Of Man IM7 5BX
Permitted,22/00830/B,Installation of replacement windows and door to front elevation,14-Dec-22,Principal Planner- North (CB),56 Patrick Street Peel Isle Of Man IM5 1BS
Permitted,22/00833/B,Proposed new dormer window,17-Aug-22,Principal Planner - South (JS),Lower Ballahowin Braaid Road St Marks Ballasalla Isle Of Man IM9 3AR
Refused,22/00835/B,Erection of bollards to the front of the property and rendering of external front wall,06-Sep-22,Principal Planner - South (JS),2 - 3 Castle Quay Castletown Isle Of Man IM9 1AU 
Refused,22/00836/B,Creation of hardstanding in part of field 534374 (Retrospective),07-Oct-22,Principal Planner - South (JS),Field 534374 Creg-Ny-Baa Back Road Creg Ny Baa Onchan Isle Of Man  
Permitted,22/00838/B,Creation of boundary wall,04-Aug-22,Head of Development Management,Cronk-E-Chule Wheel Hill Laxey Isle Of Man IM4 7NL
Permitted,22/00839/MCH,Minor Change application to PA 19/01084/B to replace rosemary roof tiles with natural slate tiling and to install external steps to side elevation to suite change in site levels,16-Aug-22,Principal Planner- North (CB),Linksfield Bradda West Road Spaldrick Port Erin Isle Of Man IM9 6PN
Permitted,22/00840/B,Drill a borehole to test for a viable potable water supply to replace existing shallow spring,14-Nov-22,Principal Planner - South (JS),Field 324404 Braaid Farm Top Road Crosby Isle Of Man IM4 4HJ 
Permitted,22/00842/B,Removal of an existing chimney,14-Sep-22,Principal Planner - South (JS),15 Baldrine Park Baldrine Isle Of Man IM4 6DD
Permitted,22/00843/B,Erection of summer house with decking (Retrospective),13-Sep-22,Principal Planner - South (JS),Ballawillyn Cottage Patrick Road St Johns Isle Of Man IM4 3BR
Permitted,22/00844/B,Installation of lighting to Prospect Hill elevation,30-Sep-22,Principal Planner- North (CB),Standard Bank House 1 Circular Road Douglas Isle Of Man IM1 1SB
Permitted,22/00845/B,Installation of replacement front door (retrospective),17-Aug-22,Head of Development Management,46 Main Road Onchan Isle Of Man IM3 1AL 
Permitted,22/00847/B,Erection of a summerhouse in rear garden to be used as a therapy room,15-Nov-22,Principal Planner - South (JS),1 Springfield Rise Foxdale Isle Of Man IM4 3JX 
Permitted,22/00849/B,Loft conversion involving the raising of existing roof and installation of dormers and erection of a porch extension,13-Sep-22,Principal Planner - South (JS),South View Clannagh Road Santon Isle Of Man IM4 2HP 
Permitted,22/00850/B,"Conversion of retail space and existing residential units into a total of 5 self-contained apartments and the installation of replacement windows and doors, replacement pitched roofs and flat roofs to the rear, installation of balustrade to the rear, and ",24-Nov-22,Principal Planner - South (JS),58-60 Strand Street Douglas Isle Of Man IM1 2EL 
Permitted,22/00851/MCH,Minor Change application to PA 21/00359/B involving the installation of an additional door to West Elevation,19-Aug-22,Principal Planner - South (JS),West Loghan Cottage West Loughan Jurby Isle Of Man IM7 3EZ 
Permitted,22/00853/B,Alterations to convert existing roof space into additional bedrooms and en suite bathrooms together with replacement / enlarged of dormer windows to rear elevation,26-Sep-22,Principal Planner- North (CB),Longfield Old Castletown Road Port Soderick Isle Of Man IM4 1BB
Permitted,22/00854/B,Erection of a single storey extension to rear of property,17-Aug-22,Principal Planner - South (JS),3 Victoria Way Castletown Isle Of Man IM9 1DX 
Permitted,22/00855/B,Erection of pitched roof porch to the front elevation and erection of first floor pitched roof extension above existing garage/utility and single storey pitched roof extension to the rear with bi-fold doors,13-Oct-22,Principal Planner- North (CB),23 Farmhill Meadows Douglas Isle Of Man IM2 2LJ
Permitted,22/00856/C,Additional use of residential property as tourist accommodation,23-Aug-22,Principal Planner- North (CB),La Petite Colline Snaefell Road Agneash Isle Of Man IM4 7NR
Permitted,22/00857/B,Erection of replacement rear rendered wall and widening of access gate,13-Oct-22,Principal Planner- North (CB),16 Castle Street Peel Isle Of Man IM5 1AN 
Permitted,22/00859/B,"Erection of extension, removal of a chimney stack, replacement of kitchen and porch flat roofs with pitched roofs and alteration to existing windows and installation of additional windows",12-Oct-22,Principal Planner- North (CB),Hazeldene Orrisdale Kirk Michael Isle Of Man IM6 2HL 
Permitted,22/00860/B,Installation of replacement door to existing window,09-Aug-22,Head of Development Management,Trinity House Marathon Avenue Douglas Isle Of Man IM2 4JA 
Permitted,22/00861/C,Additional use of Childcare or Education (class 4.2) as well as existing Community Facilities use (class 4.3),06-Sep-22,Principal Planner - South (JS),Millennium Hall Old Church Road Crosby Isle Of Man IM4 2HA 
Permitted,22/00863/B,Removal of rear chimney stack,12-Oct-22,Principal Planner- North (CB),3 & 5 Allan Street Douglas Isle Of Man IM1 3DQ
Permitted,22/00864/D,Erection of two non-illuminated signs (Retrospective),19-Aug-22,Principal Planner - South (JS),92 Bucks Road Douglas Isle Of Man IM1 3AG 
Permitted,22/00866/B,Reinstatement of pole with weather vane on top in the same position as removed pole,13-Oct-22,Principal Planner- North (CB),Municipal Gardens Derby Square Douglas Isle Of Man IM1 3LS
Permitted,22/00867/CON,Installation of stair-lift from ground to first floor - RB 250,17-Aug-22,Principal Planner- North (CB),Whitehouse Main Road Kirk Michael Isle Of Man IM6 2HH
Permitted,22/00869/CON,Registered Building consent for demolition elements to PA 22/00880/B,07-Nov-22,Principal Planner- North (CB),Scotland House North Quay Douglas Isle Of Man IM1 4LE
Permitted,22/00870/B,Erection of a single storey rear extensions one pitched roof and one with a flat roof and installation of replacement windows and a bi-fold door and the erection of a pitched roof front porch,20-Sep-22,Principal Planner - South (JS),10 Rheast Mooar Avenue Ramsey Isle Of Man IM8 3LR
Refused,22/00872/B,Erection of detached garage (retrospective),27-Oct-22,Principal Planner- North (CB),6 Fisher Close Crosby Isle Of Man IM4 2EF 
Refused,22/00874/A,Approval in principle for the erection of a detached dwelling,02-Dec-22,Principal Planner - South (JS),Charnwood House Bradda West Lane Port Erin Isle Of Man IM9 6PW
Refused,22/00876/B,Construction of new balcony to first floor of coffee house and additional parking at ground floor (retrospective),26-Oct-22,Principal Planner - South (JS),Retail Unit  Crosby Meadows Crosby IM4 2EE
Permitted,22/00877/B,"Erection of single storey flat roof extension to the rear, replacement windows, rendering and removal of both chimney stacks.",21-Sep-22,Principal Planner - South (JS),15 Central Drive Onchan Isle Of Man IM3 1ES
Permitted,22/00878/B,Demolition and erection of replacement 2 storey dwelling,23-Nov-22,Principal Planner - South (JS),29 Maghergarran Port Erin Isle Of Man IM9 6BZ
Permitted,22/00880/B,"Conversion of office building (class 2.1) to mixed use office and residential (class 3.3) involving alterations including removal of rear extension; new rear extension and fire escape stair; replacement windows, roof finish including solar slates and rain",17-Nov-22,Principal Planner- North (CB),Scotland House North Quay Douglas Isle Of Man IM1 4LE
