Decision,PA Ref,PROPOSAL,Decision issued,Determining Body,Property Address
Permitted,22/00434/C,Change of use of side extension from residential to tourist accommodation,19-May-22,Head of Development Management,Elgin Stables Elgin Jacks Lane Port E Vullen Ramsey Isle Of Man IM7 1AW 
Refused,22/00435/B, Alterations and extensions to dwelling formed by earlier approval to reinstate (and extend) Tholtan,07-Oct-22,Principal Planner - South (JS),Field 425114 Nancy's Ballaglonney Farm Ronague Road Ronague Castletown Isle Of Man  
Permitted,22/00436/B,Removal of existing rear extensions and erection of replacement single storey extension,01-Jul-22,Principal Planner- North (CB),47 Sunningdale Drive Onchan Isle Of Man IM3 1EL
Permitted,22/00437/B,Removal of a conservatory,06-Jun-22,Head of Development Management,The Old Farmhouse Queens Road Port St. Mary Isle Of Man IM9 5EZ
Application Withdrawn,22/00438/C,Change of use of ground floor office space into fitness gym,30-Sep-22,Withdrawn,Ground Office  Samuel Harris House 5 - 11 St Georges Street Douglas Isle Of Man IM1 1AJ 
Permitted,22/00440/B,Replacement of fossil fuel oil boiler with installation of Air Source Heat Pump,13-Jun-22,Principal Planner- North (CB),41 Selborne Drive Douglas Isle Of Man IM2 3NJ 
Permitted,22/00441/B,Erection of single storey extension to rear elevation,30-Sep-22,Principal Planner - South (JS),9 Hollydene Avenue Onchan Isle Of Man IM3 3HB
Permitted,22/00442/B,Extensions and alterations to existing dwelling to include replacement windows and doors and associated works,02-Dec-22,Principal Planner - South (JS),Ballacreg Dreemskerry Hill Dreemskerry Ramsey Isle Of Man IM7 1BE
Permitted,22/00444/B,Erection of 2 detached dwellings with integral garages,05-Aug-22,Principal Planner - South (JS),Land Adjacent To St Olave's Jurby Road Ramsey Isle Of Man  
Refused,22/00445/B,Conversion of existing offices into 4 self contained 1 bedroom apartments and 1 studio apartment,04-Aug-22,Principal Planner - South (JS),Newcourt Chambers Offices 39 Bucks Road Douglas Isle Of Man IM1 3DE 
Permitted,22/00446/GB,"Removal of external staircase on west elevation, structural works to wash house gable and various repairs to external walls (in association with PA 22/00328/CON)",13-Jun-22,Head of Development Management,Bishopscourt Mansion House Bishopscourt Kirk Michael Isle Of Man IM6 2EZ 
Permitted,22/00448/B,Demolition of existing stables and store and erection of replacement equestrian single storey building,24-Aug-22,Principal Planner - South (JS),Kiondhooag East Foxdale Road Foxdale Isle Of Man IM4 3HQ
Permitted,22/00451/GB,"Alterations, erection of ground floor extension and installation of replacement windows (in association with 22/00452/CON)",26-May-22,Principal Planner - South (JS),5 Victoria Terrace Douglas Isle Of Man IM2 4EU
Permitted,22/00452/CON,"Registered building consent for internal alterations to first floor including moving bathroom and making access from landing, ground floor extensions to kitchen and side and replacement windows (in association with 22/00451/GB) Registered Building Nos. 18",26-May-22,Head of Development Management,5 Victoria Terrace Douglas Isle Of Man IM2 4EU
Permitted,22/00453/B,Proposed replacement of existing bay window and porch with new entrance extension,27-Jul-22,Principal Planner- North (CB),Millbrook Beach Road Port St Mary Isle Of Man IM9 5NE 
Certificate of Lawfulness AGREED,22/00454/LAW,Replacement windows to front elevation,31-May-22,Head of Development Management,Southlands 34 Albany Road Douglas Isle Of Man IM2 3ND 
Permitted,22/00455/B,Conversion from shop (Class 1.1) to food and drink (Class 1.3) involving the installation of a rear flue and reinstatement of rear double doors,08-Jul-22,Principal Planner- North (CB),10 St Pauls Square Ramsey Isle Of Man IM8 1LE 
Permitted,22/00456/B,Removal of existing balcony and raising of the canopy over the front porch and the erection of entrance gates and posts,19-May-22,Principal Planner- North (CB),8 Hillberry Green Douglas Isle Of Man IM2 6DE
Permitted,22/00457/C,Additional use of a Residential apartment to provide self-catering tourist accommodation,04-Aug-22,Principal Planner - South (JS),Apartment 2 First Floor  Formerly Known As Rosslare 7 Mount Morrison Peel Isle Of Man IM5 1PN 
Permitted,22/00459/B,"Alterations to side extension including change of roof pitch, installation of a flue, installation of door to front elevation, and increase in size of window on rear elevation (retrospective)",22-Jul-22,Principal Planner- North (CB),48 Groudle Road Onchan Isle Of Man IM3 2EE 
Permitted,22/00460/B,"Alterations, extension of extension, roofing works, window / door alterations and installation of a flue",27-Jul-22,Principal Planner - South (JS),Cronk Breck Grenaby Ballasalla Isle Of Man IM9 3BD 
Permitted,22/00461/B,Re-render the existing front rendered wall and render existing brick side elevation,24-Jun-22,Head of Development Management,Savoy 6 Castlemona Terrace Central Promenade Douglas Isle Of Man IM2 4LU 
Permitted,22/00462/B,Erection of extension to replace existing conservatory,26-May-22,Principal Planner - South (JS),Dreemskerry Dreemskerry Hill Dreemskerry Ramsey Isle Of Man IM7 1BE
Permitted,22/00463/B,Erection of a rear Sun Room,05-Aug-22,Principal Planner - South (JS),2 Church View Court Ballakilley Port Erin Isle Of Man IM9 6DZ 
Permitted,22/00464/B,Erection of a building to provide a Veterinary Practice,03-Oct-22,Planning Committee,Kennaa Farm Stables Kennaa Equestrian Centre  Kennaa Road St Johns Isle Of Man IM4 3LW
Refused,22/00466/B,Installation of replacement windows and doors to front and rear elevations,22-Jul-22,Principal Planner- North (CB),Many Tides 2 Minorca Cottages Minorca Hill Laxey Isle Of Man IM4 7DN
Permitted,22/00467/D,Installation of replacement illuminated signage,16-Jun-22,Principal Planner - South (JS),Shore Hotel Old Laxey Hill Laxey Isle Of Man IM4 7DA
Permitted,22/00468/B,Installation of replacement windows and entrance doors to existing building,15-Jun-22,Principal Planner - South (JS),Shore Hotel Old Laxey Hill Laxey Isle Of Man IM4 7DA
Permitted,22/00469/GB,Alterations to facilitate a change of use of property to a single residential dwelling (in association with PA 22/00472/CON),20-Jun-22,Principal Planner - South (JS),The Court House Main Road Kirk Michael Isle Of Man IM6 1AJ 
Permitted,22/00470/B,Erection of single storey triple garage with glazed link to dwelling.,29-Jul-22,Principal Planner - South (JS),Silverburn Farm Ballamodha Straight Ballasalla Isle Of Man IM9 3ES
Permitted,22/00471/B,"Alterations, erection of extension to replace rear conservatory, replacement roof tiles and installation of a flue",05-Aug-22,Director 2017+,2 King Orry Road Glen Vine Isle Of Man IM4 4EL
Permitted,22/00472/CON,Registered Building consent for internal and external alterations to facilitate a change of use of property to a single residential dwelling (in association with 22/00469/GB) Registered Building Nos. 136,15-Jun-22,Principal Planner - South (JS),The Court House Main Road Kirk Michael Isle Of Man IM6 1AJ 
Permitted,22/00473/B,"Reinstatement to dwelling, erection of two storey rear extension and rear pitch roof dormer, and alterations (including roof lights, re-rendering, re-roofing, chimney repair, and new window and door installations)",05-Dec-22,Planning Committee,Ballamaddrell Cottage Grenaby Road Ballabeg Castletown Isle Of Man IM9 4HD
Permitted,22/00474/B,"Conversion of existing roof space into additional living accommodation, including rear dormer and erection of front Porch.",20-Jul-22,Principal Planner - South (JS),Halcyon 5 Cooil Avenue Kirk Michael Isle Of Man IM6 1HD 
Permitted,22/00476/B,Additional use of part of field 430720 for the erection of three polytunnels,09-Aug-22,Planning Committee,Field 430720 Bayrauyr Road St Marks Ballasalla Isle Of Man  
Permitted,22/00477/C,Additional use for storage and distribution to existing light industrial unit,28-Jul-22,Principal Planner - South (JS),Unit 9 The Paddocks Jurby Industrial Estate Jurby Isle Of Man IM7 3BD 
Permitted,22/00478/B,A single storey rear extension to replace the existing conservatory,15-Jun-22,Principal Planner - South (JS),73 Silverburn Crescent Ballasalla Isle Of Man IM9 2DY
Permitted,22/00479/B,"Replace full height window from Master Bedroom to a pair of glazed doors and creation of terrace on the flat roof of a single storey extension, with associated frameless glass balustrade.",22-Jul-22,Head of Development Management,Westwood House Dalby Isle Of Man IM5 3BT 
Permitted,22/00480/B,Replacement roof (Retrospective),21-Jun-22,Principal Planner - South (JS),11 Shirragh Way Port Erin Isle Of Man IM9 6FB
Permitted,22/00481/B,Removal of chimney stack,01-Jul-22,Principal Planner- North (CB),Hi-Lo House Croit E Quill Road Laxey Isle Of Man IM4 7JD
Permitted,22/00484/B,Replacement windows,27-Jun-22,Principal Planner- North (CB),32 Derby Road Douglas Isle Of Man IM2 3ET
Permitted,22/00485/B,Temporary erection of a stage and associated structures for four weeks over the TT period,07-May-22,Principal Planner - Enf (AM),Villiers Square Fort Street Douglas Isle Of Man IM1 2AX 
Permitted,22/00486/B,Extension to residential curtilage and the installation of a new vehicular access and driveway and the blocking up of two existing accesses,06-Sep-22,Planning Committee,Heatherlea Ballakillowey Road Colby Isle Of Man IM9 4BW
Permitted,22/00487/GB,Replacement of existing roof light with velux conservation style roof light (in association with Registered Building application 22/00384/CON),30-May-22,Principal Planner - South (JS),Ivy Bank Falcon Cliff Terrace Douglas Isle Of Man IM2 4AY
Permitted,22/00488/B,Raise the level of existing roof over garage to create new first floor living accommodation,29-Jul-22,Principal Planner - South (JS),16 Manor Park Onchan Isle Of Man IM3 2EP 
Permitted,22/00489/MCH,Minor Change application to PA 16/00925/B involving the application of render to both front and rear elevations,23-May-22,Head of Development Management,45 Harcroft Meadow Douglas Isle Of Man IM2 1JT 
Permitted,22/00490/B,Erection of replacement detached workshop and storage of motor vehicles.,02-Aug-22,Principal Planner - South (JS),Ellan Shilley Barrule Road Foxdale Isle Of Man IM4 3ES
Refused,22/00492/B,Engineering works to existing bridge and provision of a new pedestrian footpath on the west side of the bridge,04-Oct-22,Principal Planner - South (JS),Santon Bridge Main Road Santon Isle Of Man IM4 1EN 
Permitted,22/00494/B,Erection of a sunroom extension to replace existing conservatory,19-May-22,Principal Planner- North (CB),18A Hilltop Rise Douglas Isle Of Man IM2 2LE 
Permitted,22/00495/B,"Alterations, erection of a 2nd floor extension, re-roofing works, installation of four dormer windows, replacement windows and an electric vehicle charge point and provision of split level apartment and kitchen to upper floors for employee use",29-Jul-22,Principal Planner- North (CB),Westmoreland House 32 Circular Road Douglas Isle Of Man IM1 1AE 
Permitted,22/00496/B,Installation of replacement windows to front elevation,19-May-22,Head of Development Management,32 Selborne Drive Douglas Isle Of Man IM2 3NH
Refused,22/00497/B,Single storey Flat Roof Extension to the rear elevation,05-Aug-22,Principal Planner - South (JS),8 Sandringham Drive Onchan Isle Of Man IM3 4HH
Permitted,22/00498/B,Replacement roof,01-Jul-22,Principal Planner- North (CB),2 Belmont Villas Jurby Road Ramsey Isle Of Man IM8 3PF 
Permitted,22/00500/B,Alterations and erection of rear extension,15-Jul-22,Head of Development Management,1 Belgravia Douglas Isle Of Man IM2 7DL
Permitted,22/00504/B,Erection of a quadruple garage and storage building,01-Jul-22,Head of Development Management,Lower Milntown Farm Lezayre Road Ramsey Isle Of Man IM8 2TH
Permitted,22/00505/B,"Conversion of dwelling into two flats. Removal of second floor dormers and installation of replacement single dormer and roof terrace. Removal of rear chimney stack, external staircase and walls. Installation of rear doors and window to ground floor with ",01-Nov-22,Principal Planner - South (JS),Devonshire House 4 Victoria Terrace Peel Isle Of Man IM5 1PG 
Permitted,22/00506/B,Erection of a Multi-Purposes Agricultural Shed,24-Nov-22,Principal Planner- North (CB),Close Yn Ellan St Judes Road Sulby Isle Of Man IM7 2ES
Permitted,22/00507/B,Replacement door at main entrance to property,22-Jul-22,Principal Planner- North (CB),10 Water Street Ramsey Isle Of Man IM8 1JP 
Permitted,22/00508/B,Demolition of utility room to the rear elevation. Erection of replacement utility room to the rear elevation,05-Aug-22,Director 2017+,Ballagawne Farm Ballagawne Road Ballabeg Castletown Isle Of Man IM9 4PD
Permitted,22/00509/B,Removal of a fossil fuel boiler and the installation of an Air Source Heat Pump.,22-Jun-22,Head of Development Management,22 Erin Way Port Erin Isle Of Man IM9 6EF 
Permitted,22/00510/B,Installation of replacement windows to front and rear elevations,31-May-22,Head of Development Management,46 Woodbourne Road Douglas Isle Of Man IM1 3AN
Permitted,22/00511/B,Erection of a replacement sun room and installation of a flue,13-Jul-22,Principal Planner - South (JS),Ballafletcher Cottage Peel Road Braddan Douglas Isle Of Man IM4 4LD
Permitted,22/00513/B,Two storey extension with roof terrace and creation of replacement porch entrance,07-Oct-22,Principal Planner - South (JS),Waterfall Barn Shore Road Glen Maye Isle Of Man IM5 3BG 
Permitted,22/00514/B,"Conversion of attached garage into bedroom, removal of garage door and installation of replacement window",15-Jul-22,Principal Planner - Enf (AM),31 Ballellis Ballawattleworth Estate Peel Isle Of Man IM5 1WZ 
Permitted,22/00515/B,Replacement of garage door with a window and doorway and formation of French doors to side elevation and bi folding door to rear elevation,13-Jul-22,Head of Development Management,4 Stowell Place Castletown Isle Of Man IM9 1HF
Permitted,22/00516/B,Erection of a detached summer house with storage,22-Jul-22,Principal Planner- North (CB),Chequers Garey Ramsey Isle Of Man IM7 2EQ 
Permitted,22/00517/B,2 storey extension to front elevation with internal alterations and minor landscaping works,09-Dec-22,Planning Committee,Braywood 51 Howe Road Onchan Isle Of Man IM3 2AZ
Refused,22/00518/B,Erection of a detached dwelling with integral garage,28-Jul-22,Principal Planner - South (JS),Land Adjacent To Peacehaven Minorca Hill Laxey Isle Of Man IM4 7DN
Permitted,22/00519/C,Change of use of first floor to a gaming lounge,05-Sep-22,Planning Committee,Unit 2 Concorde House Westbourne Road Ramsey Isle Of Man IM8 2ER 
Permitted,22/00520/B,Proposed erection of dwelling,03-Oct-22,Planning Committee,Land To The West Of 17 Royal Park Royal Park Ramsey Isle Of Man  
Permitted,22/00521/B,Erection of a rear conservatory,01-Jul-22,Principal Planner- North (CB),26 Claughbane Drive Ramsey Isle Of Man IM8 2AY
Permitted,22/00522/B,"Erection of rear and side extension, installation of replacement roof tiles and creation of additional off road parking",31-May-22,Head of Development Management,86 Birch Hill Crescent Onchan Isle Of Man IM3 3DA
Permitted,22/00523/B,Creation of driveway and vehicular access,29-Jul-22,Principal Planner- North (CB),3A Coburg Road Ramsey Isle Of Man IM8 3EH
Permitted,22/00525/B,Alteration and erection of extension to first floor over existing garage,12-Jul-22,Principal Planner- North (CB),2 River Vale Braddan Douglas Isle Of Man IM4 4TH
Permitted,22/00526/B,Single storey extension to rear and side elevations,05-Aug-22,Director 2017+,28 St Catherines Close Douglas Isle Of Man IM1 4JA 
Permitted,22/00527/B,Single storey extension to the rear of the house and re-roofing to main house and bay window,22-Jun-22,Principal Planner- North (CB),9 Bay View Road Onchan Isle Of Man IM3 1HX
Permitted,22/00529/B,Installation of a rooflight (retrospective),13-Oct-22,Principal Planner- North (CB),2 Marguerite Cottage Glen Road Laxey Isle Of Man IM4 7AN
Permitted,22/00530/B,Demolition of kitchen and conservatory and erection of replacement kitchen and sunroom with pitched roof also covering garage and workshop,22-Sep-22,Principal Planner- North (CB),Carraghyn Glenlough Circle Glen Vine Isle Of Man IM4 4AX
Refused,22/00531/B,Creation of a patio door to front elevation,31-May-22,Head of Development Management,Flat 1 5 The Esplanade Central Promenade Douglas Isle Of Man IM2 4LR 
Refused,22/00532/B,Erection of agricultural building,07-Oct-22,Principal Planner - South (JS),Field 624395 Ballavelt Farm  Cornaa Ramsey Isle Of Man  
Permitted,22/00533/CON,Registered Building consent for the replacement of ground floor windows and door (in association with PA 22/00534/GB) Registered Building Nos. 31,06-Jun-22,Head of Development Management,Lloyd's Pharmacy  1 Malew Street Castletown Isle Of Man IM9 1LG
Permitted,22/00534/GB,Replacement of existing ground floor windows and door (in association with PA 22/00533/CON),06-Jun-22,Head of Development Management,Lloyd's Pharmacy  1 Malew Street Castletown Isle Of Man IM9 1LG
Permitted,22/00536/B,Alteration and erection of a two storey extension to provide ancillary living accommodation,10-Aug-22,Planning Committee,Ballacoraige House Cronk Road Ballaugh Isle Of Man IM7 5AT
Permitted,22/00537/B,Siting of a cold storage container and change of use of unit from industrial to food distribution (retrospective),02-Sep-22,Principal Planner - South (JS),Unit 9 Kirby Farm Industrial Estate Vicarage Road Douglas Isle Of Man IM4 4LA 
Permitted,22/00538/B,Creation of 4 vehicle parking spaces,22-Jun-22,Head of Development Management,Tromode House Ballafletcher Road Cronkbourne Douglas Isle Of Man IM4 4QE
Permitted,22/00539/B,Installation of fixed glazed panel / doors to rear elevation,22-Jun-22,Principal Planner- North (CB),2 Banks Howe Onchan Isle Of Man IM3 2ET 
Permitted,22/00540/B,Installation of panelling and rendering,01-Jul-22,Principal Planner- North (CB),Former Shelter Shore Road Port Erin Isle Of Man IM9 6HL 
Refused,22/00541/B,Removal of existing artificial chimney stack and make roof good and single storey rear extension and attic conversion with front and rear dormers.,21-Jul-22,Principal Planner - South (JS),10 Imman Stronnag Reayrt Ny Cronk Peel Isle Of Man IM5 1GP 
Permitted,22/00542/B,Erection of replacement single storey detached double garage,22-Sep-22,Principal Planner- North (CB),Eairy Kennels Tosaby Road Eairy Isle Of Man IM4 3HP 
Permitted,22/00544/B,Rendering of property (Retrospective),23-Jun-22,Principal Planner- North (CB),Reaghbel 1 Birchleigh Close Onchan Isle Of Man IM3 4EX 
Permitted,22/00545/B,To erect a cycle shelter at the rear of the Town Hall,15-Jul-22,Principal Planner- North (CB),Town Hall Parliament Square Ramsey Isle Of Man IM8 1RT 
Permitted,22/00546/B,To erect a cycle shelter,13-Jul-22,Principal Planner- North (CB),Car Park Supermarket Station / Bowring Road Ramsey Isle Of Man IM8 2LL 
Application Withdrawn,22/00547/B,Re-configuration of layout of houses and two no. accessible bungalows,29-Jul-22,Withdrawn,Westhill Avenue Castletown Isle Of Man IM9 1HX
Permitted,22/00548/B,Erection of single storey extension to Dog Kennels to provide indoor exercise area,19-Jul-22,Planning Committee,Dog Kennels Knock E Nean Smeale Road Andreas Isle Of Man IM7 4JA
Permitted,22/00549/B,"Creation of a parkland campus facility comprising of a head-quarters office building with restaurant, caf‚, collaborative working areas and 66 associated staff accommodation units with associated landscaping",22-Nov-22,Planning Committee,Former Isle Of Man Holiday Camp Switzerland Road Douglas Isle Of Man  
Refused,22/00550/B,Side and single storey extension to detached garage,21-Oct-22,Principal Planner - Enf (AM),Yn Rheash Corlea Road Ballasalla Isle Of Man IM9 3BA
Refused,22/00551/B,"Change of use to a residential property. Removal of existing garage roof and replace with 2 storey extension, including balcony to front elevation with associated works.",21-Oct-22,Principal Planner - Enf (AM),The Garage Esplanade Lane Central Promenade Douglas Isle Of Man IM2 4LP 
Permitted,22/00553/B,"Conversion of existing garage into living space, internal alterations and installation of raised deck over existing rear patio",12-Jul-22,Principal Planner- North (CB),Renshent 18 Manor Park Onchan Isle Of Man IM3 2EP
Permitted,22/00554/C,Additional use of residence as tourist accommodation,12-Sep-22,Principal Planner - South (JS),33 Hope Street Castletown Isle Of Man IM9 1AP
Permitted,22/00556/B,Demolish rear conservatory and erection of replacement two storey rear extension and erection of front porch,26-Aug-22,Principal Planner- North (CB),9 Cronk Y Berry Mooar Douglas Isle Of Man IM2 6HJ
Permitted,22/00557/B,"Erection of detached single storey storage shed and the erection of a detached single storey leisure building with bi-folding doors to side elevation, erection of replacement front porch and installation of a window in existing rear glazed double door to ",30-Sep-22,Principal Planner- North (CB),9 Cronk Drean Douglas Isle Of Man IM2 6AX
Permitted,22/00558/B,Replacement of an existing window with French doors,22-Jun-22,Head of Development Management,Ballacubbon Farmhouse Main Road Colby Isle Of Man IM9 4NF 
Permitted,22/00559/B,Installation of replacement windows,22-Jun-22,Head of Development Management,The Coach House Arbory Street Castletown Isle Of Man IM9 1LN 
Permitted,22/00560/B,Convert existing guesthouse into 7no. one bedroom apartments with associated works,20-Jul-22,Head of Development Management,8 Clifton Terrace Douglas Isle Of Man IM2 3HX
Permitted,22/00561/B,Extension to existing burial ground,09-Aug-22,Planning Committee,Part Field 434062 Malew And Castletown Burial Ground  Great Meadow Castletown Isle Of Man  
Permitted,22/00562/C,Additional use of agricultural shed for the parking of a HGV vehicle,06-Sep-22,Planning Committee,Upper Ballachrink Farm St Marks Road Ballasalla Isle Of Man IM9 3AG
Permitted,22/00563/B,Demolish existing rear sun lounge and erection of replacement single storey extension.,06-Jul-22,Principal Planner - Enf (AM),Eaynin Dress 14 The Meadows Kirk Michael Isle Of Man IM6 1EX
Permitted,22/00564/MCH,Minor change application to reduce the floor area of one unit in Block D and corresponding changes to the elevations,07-Jun-22,Principal Planner - Enf (AM),Former Parkinsons Yard Peel Road Braddan Douglas Isle Of Man IM4 4LE 
Permitted,22/00565/B,Demolish rear conservatory and erection of replacement single storey extension,13-Jul-22,Principal Planner- North (CB),Thie Ain Ballagawne Road Baldrine Isle Of Man IM4 6EL
Permitted,22/00567/B,Installation of larger junction and pedestrian crossings and the creation of a highway and footpath with associated works.,28-Sep-22,Planning Committee,Balthane Junction Douglas Road Ballasalla Isle Of Man IM9 2DJ
Permitted,22/00568/GB,Alterations to part of an existing outbuilding in connection with the change of use to a refreshments kiosk (in association with PA 22/00569/CON),06-Jul-22,Planning Committee,Point Of Ayre Lighthouse Cranstal Bride Isle Of Man IM7 4BS 
Permitted,22/00569/CON,Registered Building consent for the replacement of two windows and the installation of lighting on an existing outbuilding (in association with PA 22/00568/GB) Registered Building Nos. 147,06-Jul-22,Planning Committee,Point Of Ayre Lighthouse Cranstal Bride Isle Of Man IM7 4BS 
Permitted,22/00570/B,Proposed demolition of existing garage/store and construction of replacement garage/store building,15-Jul-22,Head of Development Management,25 Market Street Douglas Isle Of Man IM1 2PA 
Refused,22/00572/B,Installation of replacement windows and door,15-Jul-22,Principal Planner- North (CB),10 Auckland Terrace Parliament Street Ramsey Isle Of Man IM8 1AF 
Refused,22/00573/B,Erection of proposed detached general storage building to rear of dwelling.,02-Aug-22,Principal Planner - South (JS),Prospect Villa Andreas Road Aust Ramsey Isle Of Man IM7 4EF 
Permitted,22/00575/B,"Rebuilding of outbuilding including new roof, door and window and installation of three replacement rear windows and rear door (retrospective)",15-Sep-22,Principal Planner - South (JS),Overdale 5 Albany Road Douglas Isle Of Man IM2 3NP
Permitted,22/00576/B,Erection of a storage unit for the duration of 5 years,27-Jun-22,Head of Development Management,Unit 2 Ballapaddag Industrial Estate Douglas Isle Of Man IM4 2AF 
Permitted,22/00577/B,Alterations and extension to provide ancillary living accommodation to dwelling and creation new vehicle parking and access,30-Sep-22,Principal Planner- North (CB),15 Fairway Drive Ramsey Isle Of Man IM8 2BB
Permitted,22/00578/B,"Alterations including the creation of infill extension, installation of flue, windows, patio door, disability access ramp, re-roofing and demolition of chimney stack",24-Nov-22,Principal Planner- North (CB),23 Alberta Drive Onchan Isle Of Man IM3 1LT
Permitted,22/00579/B,Erection of proposed front canopy porch extension and external alterations to existing Bedroom to provide five roof lights,19-Aug-22,Principal Planner - South (JS),3 Parsonage Glebe St Johns Isle Of Man IM4 3LT 
Permitted,22/00580/B,"Alterations and erection of a two storey extension to existing public house to provide restaurant, hotel accommodation and staff manager accommodation with associated alterations to existing car park comprising amendments to PA 21/00336/B",20-Oct-22,Principal Planner- North (CB),Shore Hotel Old Laxey Hill Laxey Isle Of Man IM4 7DA
Certificate of Lawfulness AGREED,22/00581/LAW,Certificate of lawful development for replacement garage roof and replacement roof tiles to dwelling,21-Sep-22,Principal Planner- North (CB),44 Alexander Drive  (11 Woodbourne Villas) Douglas Isle Of Man IM2 3QG 
