Permitted,15/00598/CON,"Registered Building consent for change of external footway surface, including option to raise pavement (In association with PA 15/00594/B) Registered Building Nos. 200",22-Mar-16,Department Application,Gaiety Theatre Harris Promenade Douglas Isle Of Man IM1 2HHPermitted,15/00599/CON,Registered Building consent for changes of surface to external footway (In association with PA 15/00594/B) Registered Building Nos. 82,22-Mar-16,Department Application,Castle Mona Colonnade Central Promenade Douglas Isle Of Man IM2 4LY Permitted,15/00993/B,Erection of three detached dwellings to replace existing single dwelling,29-Mar-16,Planning Committee,The Mariners South Cape Laxey Isle Of Man IM4 7JB Permitted,15/01369/B,Alterations and erection of an extension to dwelling,19-Jan-16,Senior Planning Officer - North (CB),27 Birch Hill Grove Onchan Isle Of Man IM3 4ENPermitted,15/01371/C,Additional use of residential dwelling as tourist living accommodation,22-Jan-16,Head of Development Management,Thie Corneil Stanley Mount West Ramsey Isle Of Man IM8 1LRPermitted,16/00290/B,"Conversion of existing buildings from warehouse & light industrial to display, distribution, warehousing and sales of industrial  / automotive products, creation of vehicular access and additional car parking and erection of fencing and boundary bollards",26-Aug-16,Planning Committee,"Units 48A, 48B & 48C Spring Valley Industrial Estate Douglas Isle Of Man IM2 2QS "Permitted,16/00465/CON,Registered Building consent for the erection of non-illuminated signage (in association with 16/00464/D) Registered Building Nos. 26,21-Jun-16,Interim Director 2016,Former Social Security Office Castle Street Castletown Isle Of Man IM9 1LD Permitted,16/00466/B,Alterations and erection of a two storey side extension to provide garage with living accommodation above,26-May-16,Senior Planning Officer - North (CB),33 Ballanoa Meadow Santon Isle Of Man IM4 1HQ Permitted,16/00632/B,Alterations and erection of an extension to existing conservatory,26-Jul-16,Interim Director 2016,Kates Cottage 66 Birch Hill Crescent Onchan Isle Of Man IM3 3DBPermitted,16/00633/B,Alterations and erection of extension (amendment to PA 15/01292/B),19-Jul-16,Interim Director 2016,Struie Highfield Drive Baldrine Isle Of Man IM4 6EDPermitted,16/00634/B,Installation of replacement windows to rear elevation,05-Aug-16,Senior Planning Officer - South (SC),Mariners House Back Shore Road Laxey Isle Of Man IM4 7DQCertificate of Lawfulness AGREED,16/00644/LAW,Application to make lawful the use as residential,21-Oct-16,Senior Planning Officer - North (CB),Somerset Cottage Thorny Road Douglas Isle Of Man IM2 5ADPermitted,16/00645/B,Erection of an agricultural building to provide barn / store and stabling (amendment to PA 15/00163/B),19-Jul-16,Senior Planning Officer - South (SC),Part Field 110275 Ballamoar Farmhouse Cranstal Bride Isle Of Man IM7 4BP Permitted,15/00713/B,Demolition of existing building containing two flats and erection of two semi-detached dwellings,24-Feb-16,Head of Development Management,Land At Cliff Cottage Larch Hill Grove Tromode Douglas Isle Of Man IM4 4QBPermitted,16/01054/B,Renovations to front elevation and replacement windows.,09-Nov-16,Senior Planning Officer - South (SC),12 Derby Square Douglas Isle Of Man IM1 3LSPermitted,15/01286/B,Alterations and conversion of existing single retail unit into two retail units and two courtyard facing apartments with landscaping and bin stores,04-Jan-16,Planning Committee,17 & 19 Malew Street Callows Yard  Castletown Isle Of Man IM9 1AB Permitted,15/01360/B,Erection of a detached implement store to replace existing container units,19-Jan-16,Senior Planning Officer - North (CB),St Johns Football Club Mullen E Cloie Foxdale Road St Johns Isle Of Man IM4 3ARPermitted,16/00427/D,Installation of illuminated signage and a non-illuminated projecting sign to premises,06-Jun-16,Senior Planning Officer - North (CB),69 Strand Street Douglas Isle Of Man IM1 2ENPermitted,16/00428/B,"Replacement of rear kitchen window and door with large single opening, creation of gable windows and construction of walls between rear gardens",06-Jun-16,Senior Planning Officer - South (SC),Plots 1 - 10 Housing Development On Former Gasworks Site North Shore Road Ramsey Isle Of Man IM8 3DB Permitted,16/00429/B,Replacement of existing conservatory with a garden room extension to dwelling,06-Jun-16,Senior Planning Officer - South (SC),23 Ballaterson Fields Ballaugh Isle Of Man IM7 5AWPermitted,16/00430/GB,Installation of a protective metal plate to corner of building (in association with 16/00431/CON),02-Jun-16,Interim Director 2016,Former House Of Keys Building Parliament Square Castletown Isle Of Man IM9 1LAPermitted,16/00431/CON,Registered Building consent for the installation of a protective metal plate to corner of building (in association with 16/00430/GB) Registered Building Nos. 29,02-Jun-16,Interim Director 2016,Former House Of Keys Building Parliament Square Castletown Isle Of Man IM9 1LAPermitted,16/00702/B,Removal of chimney stack (retrospective),11-Aug-16,Senior Planning Officer - South (SC),Greensleeves Douglas Road Kirk Michael Isle Of Man IM6 1ATPermitted,16/00743/B,"Removal / demolition of existing structures and installation of fencing, stone flagstones and wooden pergola to pub garden",01-Sep-16,Senior Planning Officer - North (CB),Mines Tavern Captains Hill Laxey Isle Of Man IM4 7AYPermitted,16/00744/CON,Registered Building consent for the demolition of an external wooden shelter,01-Sep-16,Senior Planning Officer - North (CB),Mines Tavern Captains Hill Laxey Isle Of Man IM4 7AYPermitted,16/00745/B,Repositioning of an existing and installation of an additional roof light to dwelling,15-Aug-16,Senior Planning Officer - South (SC),37 Selborne Drive Douglas Isle Of Man IM2 3NJ Permitted,16/00746/B,Alterations and erection of extension to dwelling,19-Oct-16,Senior Planning Officer - South (SC),Ballacreg Dreemskerry Hill Dreemskerry Ramsey Isle Of Man IM7 1BEPermitted,16/00747/B,Application of render to dwelling,15-Aug-16,Senior Planning Officer - South (SC),Victoria Cottage St Marks Ballasalla Isle Of Man IM9 3AH Permitted,16/00748/B,Creation of a porch,12-Aug-16,Senior Planning Officer - South (SC),33 Ballagarey Road Glen Vine Isle Of Man IM4 4EBPermitted,16/00938/B,"Erection of a building to provide bicycle servicing / repair and sales, cycling fitness centre, cafe, meeting rooms and offices with associated parking and vehicular access",20-Oct-16,Planning Committee,"Vacant Site, East Of RL360 House Isle Of Man Business Park Douglas Isle Of Man  "Permitted,16/00939/B,Erection of a detached dwelling with integral garage,28-Sep-16,Senior Planning Officer - South (SC),Plot Adjacent To 28 Clifton Drive Ramsey Isle Of Man  Permitted,16/00697/B,Demolition of existing conservatory and construction of 2 storey extension to rear,26-Jul-16,Interim Director 2016,Thie Bane 40 Ballanard Road Douglas Isle Of Man IM2 5HEPermitted,16/00808/B,Replacement of existing glazed conservatory roof with tiles,07-Sep-16,Senior Planning Officer - North (CB),Alberta Cottage 36 Alberta Drive Onchan Isle Of Man IM3 1LXPermitted,16/00809/B,Replacement of existing glazed conservatory roof with tiles,21-Sep-16,Senior Planning Officer - North (CB),21 Maple Avenue Onchan Isle Of Man IM3 3HJPermitted,16/00810/B,Alterations and erection of a replacement garage to rear elevation,31-Oct-16,Senior Planning Officer - South (SC),37 Derby Square Douglas Isle Of Man IM1 3LWRefused,16/00812/B,Installation of replacement roofing tiles (retrospective),29-Nov-16,Planning Committee,Kilduff 14 Governors Road Onchan Isle Of Man IM3 1AUPermitted,16/00813/B,Installation of replacement roof tiles,21-Sep-16,Senior Planning Officer - North (CB),23 / 24 St Pauls Mews Ramsey Isle Of Man IM8 1EERefused,16/00957/B,Erection of an indoor equestrian arena with associated stables and facilities,01-Dec-16,Planning Committee,Field 224122 Adjacent To Croit E Crye The Curragh Ballaugh Isle Of Man  Permitted,16/01013/A,Approval in principle for residential development,01-Dec-16,Senior Planning Officer - South (SC),31-39 South Quay Douglas Isle Of Man IM1 5AX Application Withdrawn,16/01352/A,Construction of additional dwelling in grounds of existing property.,24-Dec-16,Withdrawn,Hazelmere Glen Auldyn Ramsey Isle Of Man IM7 2AF Permitted,16/00228/B,Proposed apartment building on vacant site and associated highway alterations,12-Dec-16,Planning Committee,Site Adjacent To Hanley Court North Shore Road Ramsey Isle Of Man  Permitted,16/00229/B,Installation of replacement windows and door to front elevation and replacement doors to rear elevation,25-Apr-16,Senior Planning Officer - North (CB),15 Crosby Terrace Douglas Isle Of Man IM2 5DGPermitted,16/00230/B,Alterations and extensions to dwelling,10-May-16,Senior Planning Officer - North (CB),Treetops  6 Highfield Crescent Onchan Isle Of Man IM3 3BHPermitted,16/00231/B,Creation of outside seating area on front pavement,13-Apr-16,Senior Planning Officer - South (SC),Royal George Hotel 10 - 12 Market Place East Ramsey Isle Of Man IM8 1JY Permitted,16/00232/B,Erection of a residential development of 81 dwellings with associated hard and soft landscaping and on site infrastructure,08-Aug-16,Interim Director 2016,Fields 131047 & 134069 Royal Park Phase 2  The Vollan  Ramsey Isle Of Man  Permitted,16/00259/B,"Alterations, widening of roads, creation of additional parking bays and resurfacing works",21-Jun-16,Planning Committee,Car Parking Associated With Barna Beg Port St. Mary Isle Of Man  Refused,16/00072/B,Installation of a replacement door and outdoor decking area to dwelling (retrospective),06-Sep-16,Senior Planning Officer - North (CB),6 Wesley Terrace Douglas Isle Of Man IM1 3HFPermitted,16/00073/B,Alterations and extension to dwelling and erection of an extension to existing garage,08-Mar-16,Head of Development Management,Signpost Cottage Cronk Ny Mona Mountain Road Onchan Isle Of Man IM3 3TD Permitted,16/00074/B,"Alterations, erection of extension and creation of roof terraces to dwelling",03-Jun-16,Interim Director 2016,51 Derby Square Douglas Isle Of Man IM1 3LPPermitted,16/00156/B,Erection of a rear first floor sunroom and deck area to dwelling,29-Mar-16,Senior Planning Officer - South (SC),11 Cambridge Terrace Douglas Isle Of Man IM1 3LLRefused,16/00158/A,"Approval in principle to remove existing outbuildings and erection of a detached dwelling with garage addressing siting, means of access and landscaping",09-May-16,Planning Committee,Thie Usheg Ballachurry Road Greeba Isle Of Man IM4 3LEPermitted,16/00391/B,Erection of a detached agricultural building,18-May-16,Senior Planning Officer - North (CB),Colooneys Farm Colooneys Lane Cooil Douglas Isle Of Man IM4 2AGPermitted,16/00392/B,Erection of a detached dwelling (replace dwelling approved under PA 13/91289/B),18-May-16,Senior Planning Officer - North (CB),Plot 42 Of Approved Residential Development Off Raad Kirree Varrey Slieau Whallian View Peel Isle Of Man  Permitted,16/00393/B,Installation of render and dash to gable end of building,16-May-16,Senior Planning Officer - South (SC),80 Derby Road Douglas Isle Of Man IM2 3EB Permitted,16/00394/GB,Installation of a replacement roof and front elevation external door to utility room (In association with 16/00395/CON),02-Jun-16,Interim Director 2016,4 Victoria Terrace Douglas Isle Of Man IM2 4EUPermitted,16/00395/CON,Registered Building consent for the installation of a replacement roof and front elevation external door to utility room (In association with 16/00394/GB) Registered Building Nos. 187,02-Jun-16,Interim Director 2016,4 Victoria Terrace Douglas Isle Of Man IM2 4EUPermitted,16/00396/B,Erection of a spiral staircase to rear elevation of dwelling,18-May-16,Senior Planning Officer - North (CB),Kimmeragh Ballafesson Road Port Erin Isle Of Man IM9 6TXDeemed withdrawn 4(3) Dev Pro Order 2005,16/00397/B,Conversion of premises from retail to a takeaway including the installation of an extractor flue to rear elevation,22-Dec-16,Withdrawn,62 Parliament Street Ramsey Isle Of Man IM8 1AJ Permitted,16/00398/B,Erection of a detached building to provide garaging and a garden implement and machinery store,27-Oct-16,Senior Planning Officer - North (CB),Barrule View Main Road Foxdale Isle Of Man IM4 3ERPermitted,16/00399/B,Replacement of existing glazed conservatory roof with tiles,25-May-16,Senior Planning Officer - South (SC),92 Pine Grove Ballasalla Isle Of Man IM9 2EAPermitted,16/00910/B,Highway improvement works and creation of off road parking and vehicular access to garage at Dingle Nook,20-Sep-16,Planning Committee,A3 / A24 Mines Road Junction & Dingle Nook A3 Main Road Higher Foxdale Isle Of Man  Permitted,16/00932/B,Erection of a display sun lounge to replace existing display conservatory,27-Sep-16,Senior Planning Officer - South (SC),Unit 28 Snugborough Trading Estate Union Mills Isle Of Man IM4 4LHPermitted,16/01049/B,Erection of steel framed agricultural building.,25-Nov-16,Senior Planning Officer - South (SC),Land At Glendown Farm Truggan Road Port St. Mary Isle Of Man  Permitted,16/01068/B,Replacement windows to front.,01-Nov-16,Senior Planning Officer - South (SC),20 Glenfaba Road Peel Isle Of Man IM5 1BUPermitted,16/01078/C, Change of use to occasional holiday cottage.,08-Nov-16,Senior Planning Officer - South (SC),Apple Garth Patrick Road St Johns Isle Of Man IM4 3BNPermitted,16/01084/B,Erection of agricultural barn in field 510984,08-Nov-16,Senior Planning Officer - North (CB),Field 510984 Balnahowe Santon Isle Of Man  Permitted,16/00698/B,Erection of single garage and hardstanding.,27-Jul-16,Interim Director 2016,Land Adjacent To 4 Windsor Terrace Douglas Isle Of Man IM1 3LHPermitted,16/00716/B,Erection of security and fencing and vehicular access gates,09-Aug-16,Senior Planning Officer - North (CB),Hazardous Waste Transfer Unit Field 524740 Kewaigue Douglas Isle Of Man  Permitted,15/01147/B,Installation of replacement windows,16-Feb-16,Director Delegation,The Craig 16 New Road Laxey Isle Of Man IM4 7BFPermitted,15/01150/C,Change of use of premises from dairy to the preparation and distribution of sandwiches (retrospective),05-Jan-16,Planning Committee,Old Dairy  Spring Gardens Douglas Isle Of Man IM1 3JWPermitted,15/01152/D,Installation of illuminated signage (in association with PA 15/00153/CON),05-Feb-16,Head of Development Management,18A-20 Victoria Street Douglas Isle Of Man IM1 2LE Permitted,15/01153/CON,Registered Building consent for the installation of illuminated signage (in association with PA 15/00152/D) Registered Building Nos. 223,05-Feb-16,Head of Development Management,18A - 20 Victoria Street Douglas Isle Of Man IM1 2LE Permitted,16/00729/B,Demolition of existing redundant workshop and erection of a dwelling,01-Nov-16,Planning Committee,40 Douglas Street Peel Isle Of Man  Refused,16/01075/B,Conversion of 2 properties into 1 plus other works.,03-Nov-16,Planning Committee,2 Castle Quay Castletown Isle Of Man IM9 1AUPermitted,16/01246/B,"Alterations, partial demolition works, relocation of fire escapes, erection of walling and creation of new windows, entrance, canopy and foyer to hotel",13-Dec-16,Planning Committee,Comis At Mount Murray Mount Murray Road Mount Murray Santon Isle Of Man IM4 2HTPermitted,15/01253/C,Additional use of existing dwelling for tourist accommodation,07-Jan-16,Senior Planning Officer - South (SC),24 Baldrine Park Baldrine Isle Of Man IM4 6DDPermitted,15/01254/B,Creation of roof terrace on existing garage roof with access stairs and balustrading,11-Jan-16,Director Delegation,39 York Road Douglas Isle Of Man IM2 3AYPermitted,16/00143/B,Replacement of existing glazed conservatory roof with roof tiles,14-Mar-16,Director Delegation,Beehive Kindergarten (Shelleig) Hillberry Road Onchan Isle Of Man IM3 3JPPermitted,16/00144/B,Replacement of existing glazed conservatory roof with light weight roof tiles,17-Mar-16,Director Delegation,13 Close Corlett Peel Isle Of Man IM5 1QH Permitted,16/00145/B,Removal of the agricultural occupancy condition attached to PA90/01792/B for the re-construction and extension of the dwelling,29-Mar-16,Planning Committee,Knocksharry Farm Ramsey Road Peel Isle Of Man IM5 2AFPermitted,16/00168/D,Re-location of two existing and retention of one existing illuminated advertising signs,26-May-16,Senior Planning Officer - North (CB),McDonald's Restaurant  Peel Road Douglas Isle Of Man IM1 5ED Permitted,16/00603/B,Installation of a replacement front door,08-Jul-16,Senior Planning Officer - South (SC),6 Hilary Road Douglas Isle Of Man IM2 3EGPermitted,16/00604/B,Erection of a wind break screen to front elevation entrance door,11-Jul-16,Senior Planning Officer - South (SC),Pets At Home Spring Valley Industrial Estate Douglas Isle Of Man IM2 2QR Permitted,16/00605/B,"Alterations, erection of extension and creation of rear parking and vehicular access",15-Jul-16,Senior Planning Officer - South (SC),9 Dalton Street Douglas Isle Of Man IM1 3JTPermitted,16/00606/B,Conversion of garage to provide a beauty therapy salon and widening of existing vehicular access and driveway,18-Jul-16,Planning Committee,4 Albany Close Peel Isle Of Man IM5 1JXPermitted,16/01048/B,Removal and installation of roof to rear and removal of wall and creation of double doors.,01-Nov-16,Senior Planning Officer - South (SC),43 Palatine Road Douglas Isle Of Man IM2 3BPPermitted,16/00607/B,Relocation of existing vehicular access,19-Jul-16,Interim Director 2016,Kimmeragh Ballafesson Road Port Erin Isle Of Man IM9 6TXPermitted,16/00630/C,Change of use of existing residential apartment to commercial use including hair and beauty treatment,18-Aug-16,Senior Planning Officer - South (SC),Apartment 2 & Unit 1 Royal Buildings Main Road Onchan Isle Of Man IM3 1AP Permitted,16/00631/B,Erection of an agricultural building,26-Sep-16,Senior Planning Officer - South (SC),Field 110929 West Kimmeragh Farm West Kimmeragh Road Bride Isle Of Man  Permitted,16/01053/VAR,Variation of condition 3 of 10/01001/B,14-Nov-16,Planning Committee,Fo-Glion Glen Rushen Road Glen Maye Isle Of Man IM5 3BAPermitted,15/01064/B,Erection of nine detached dwellings with associated landscaping and access,20-Dec-16,Interim Director 2016,Site Of Former Grand Island Hotel Bride Road Ramsey Isle Of Man IM8 3UN Permitted,15/01275/B,Conversion of part of integral garage to living accommodation and alterations,05-Jan-16,Director Delegation,5 Pinehurst Glen Douglas Isle Of Man IM2 1PHRefused,15/01276/B,"Erection of a marquee adjacent to overflow car park to be used for promotional events, charity functions, exhibitions, children's activities, and leisure activities including ice rink and roller skating (retrospective)",18-Oct-16,Planning Committee,Car Park Tynwald Mills Road St Johns Isle Of Man  Permitted,15/01278/B,Erection of a conservatory to rear elevation (retrospective),05-Jan-16,Director Delegation,6 Cronk Y Berry Mooar Douglas Isle Of Man IM2 6HJPermitted,15/01279/B,Installation of replacement French doors to front elevation,03-Feb-16,Senior Planning Officer - South (SC),11 Eastfield Douglas Isle Of Man IM1 4AUPermitted,15/01281/B,Installation of French window and blocking-up external doorway (retrospective),05-Jan-16,Director Delegation,Overdale Quarterbridge Road Douglas Isle Of Man IM2 3RJPermitted,15/01400/B,Alterations and erection of a two storey extension to dwelling,24-Feb-16,Head of Development Management,Bergen Belmont Hill Douglas Isle Of Man IM1 4NTRefused,16/00104/B,Removal of chimney stack,17-Mar-16,Director Delegation,22 Belmont Terrace Douglas Isle Of Man IM1 4NHPermitted,16/00169/B,Erection of a sun room extension to rear elevation,05-May-16,Senior Planning Officer - North (CB),26 St Runius Way Glen Vine Isle Of Man IM4 4FGPermitted,16/00170/B,Erection of a replacement storage barn,03-May-16,Senior Planning Officer - North (CB),"Barn, Red Gap Farm Arbory Road Castletown Isle Of Man  "Permitted,16/00174/B,"Alterations and extensions to dwelling, erection of a detached garage, alterations to vehicular access and landscaping works",24-Aug-16,Interim Director 2016,3 The Falls Tromode Douglas Isle Of Man IM4 4PZ Refused,16/00177/GB,Conversion of existing garage/store area into additional ground floor living accommodation (in association with 16/00178/CON),04-Jul-16,Planning Committee,The Old Sail Loft  Shore Road Underway Port St. Mary Isle Of Man IM9 5DX Refused,16/00178/CON,Registered Building Consent for conversion of existing garage/store area into additional ground floor living accommodation (RB no 203 in association with 16/00177/GB),04-Jul-16,Planning Committee,The Old Sail Loft Shore Road Underway Port St. Mary Isle Of Man IM9 5DX Permitted,16/00308/B,Installation of external flue for wood burning stove,16-Jun-16,Senior Planning Officer - South (SC),Erinwood Bay View Road Port Erin Isle Of Man IM9 6NA Permitted,16/00310/B,Widening of driveway and vehicular access onto highway,18-May-16,Senior Planning Officer - South (SC),Cronk Beg 39 Bray Hill Douglas Isle Of Man IM2 5BDPermitted,16/00313/B,Alterations and extension to dwelling (comprising amendments to PA 14/01183/B),03-Jun-16,Senior Planning Officer - South (SC),23 Ridgeway Road Onchan Isle Of Man IM3 1HTPermitted,16/00330/B,Removal of agricultural worker's occupancy condition from dwelling approved under PA 93/00945/B,21-Jun-16,Planning Committee,Withaney Balnahowe Santon Isle Of Man IM4 1HN Permitted,16/00332/B,Erection of a replacement front porch,18-May-16,Senior Planning Officer - North (CB),6 Howe Road Onchan Isle Of Man IM3 2BBPermitted,16/00400/B,Replacement of existing glazed conservatory roof with tiles,27-May-16,Senior Planning Officer - South (SC),20 Keeill Pharick Park Glen Vine Isle Of Man IM4 4EW Permitted,16/00484/B,Erection of a rear porch,11-Aug-16,Planning Committee,Beehive Kindergarten (shelleig) Hillberry Road Onchan Isle Of Man IM3 3JPPermitted,16/00526/B,Erection of a rear two storey extension,23-Jun-16,Senior Planning Officer - North (CB),Harbour House Queens Road Port St. Mary Isle Of Man IM9 5EPPermitted,16/00527/C,"Change of use from storage to the manufacture, sale, storage and distribution of alcohol including a tasting facility",06-Jul-16,Planning Committee,Part Of Former Coal Shed Breakwater Road Port Erin Isle Of Man IM9 6JA Permitted,16/00528/B,"Alterations, erection of extension and widening of existing driveway",24-Jun-16,Senior Planning Officer - North (CB),Uplands Main Road Glen Vine Isle Of Man IM4 4AZRefused,16/00529/B,Creation of a dormer extension,30-Jun-16,Senior Planning Officer - South (SC),13 Cronk Drine Union Mills Isle Of Man IM4 4NGPermitted,16/00530/B,Alterations and erection of an extension,24-Jun-16,Senior Planning Officer - North (CB),The Sheeling Bay View Road Port Erin Isle Of Man IM9 6LFPermitted,16/00646/B,"Alterations, installation of a dormer window and creation of off road parking to dwelling",21-Sep-16,Senior Planning Officer - North (CB),39 Selborne Drive Douglas Isle Of Man IM2 3NJPermitted,16/00647/B,Replacement of existing garage door with a window and alteration to rear window,19-Jul-16,Senior Planning Officer - South (SC),The Rigs Mount Auldyn Ramsey Isle Of Man IM8 3PJPermitted,16/00998/A,Approval in principle for the erection of a detached dwelling with garaging,01-Nov-16,Senior Planning Officer - South (SC),Field 432538 Ballavoddan Farm Phildraw Road Ballasalla Isle Of Man  Permitted,16/01000/B,Installation of replacement windows and rear door to dwelling,29-Sep-16,Senior Planning Officer - South (SC),44 Woodbourne Road Douglas Isle Of Man IM1 3ANRefused,15/01156/A,Approval in principle for the residential development of thirty six dwellings addressing siting and means of access,01-Dec-16,Planning Committee,"Part Of Grounds Associated With Close Jairg Beg And Field's 324318, 320912 & 324316 Old Church Road Crosby Isle Of Man  "Permitted,16/01191/B,"Erection of a front porch, ground and first floor extension to dwelling",05-Dec-16,Senior Planning Officer - South (SC),11 Harcroft Meadow Douglas Isle Of Man IM2 1JS Permitted,16/01192/B,Replacement of garage door with a doorway,05-Dec-16,Senior Planning Officer - South (SC),Ballacannell Dhoor Ramsey Isle Of Man IM7 4ED Permitted,16/00673/B,"Alterations, erection of extension and second floor dormer extension to dwelling",20-Jul-16,Interim Director 2016,49 Arbory Street Castletown Isle Of Man IM9 1LLPermitted,16/00674/B,Installation of replacement windows and door to rear elevation (retrospective),20-Jul-16,Interim Director 2016,Hillbrae Main Road Kirk Michael Isle Of Man IM6 1EDPermitted,16/00675/B,Replacement of existing garage sheet roof with tiles,18-Aug-16,Senior Planning Officer - South (SC),Tyrerhennie 2 The Crescent Douglas Isle Of Man IM2 5ET Permitted,16/01175/B,Erection of garage extension and erection of a sun room and first floor dormer extension to dwelling.,21-Nov-16,Interim Director 2016,Seafield Bride Road Bride Isle Of Man IM7 4AD Permitted,15/01320/B,"Layout of sports pitches for rugby, cricket and other community uses, including access, car parking, prefabricated changing rooms and storage units",01-Mar-16,Planning Committee,Field 414532 Land Off Ballafesson Road Rushen Isle Of Man  Permitted,16/00149/B,Erection of a single storey extension to side elevation,14-Mar-16,Director Delegation,15 Furman Close Onchan Isle Of Man IM3 1BTPermitted,16/00485/B,Erection of a shed and timber fence,23-Jun-16,Senior Planning Officer - North (CB),2 Bayr Grianagh Castletown Isle Of Man IM9 1HJPermitted,16/00486/B,Widening of existing vehicular access,23-Jun-16,Senior Planning Officer - North (CB),2 Bayr Grianagh Castletown Isle Of Man IM9 1HJ