Permitted,16/00314/B,Erection of two Eco Pod structures to provide tourist accommodation,27-Apr-16,Planning Committee,Ballawyllin Farm East Baldwin Isle Of Man IM4 5ER Permitted,16/00315/B,"Alterations, replacement of existing windows (partial retrospective), installation of roof lights and replacement of window with bi-folding doors",16-May-16,Senior Planning Officer - South (SC),Wychwood House Alexander Drive Douglas Isle Of Man IM2 3QRPermitted,16/00316/B,Installation of a dormer window to dwelling,16-May-16,Senior Planning Officer - South (SC),Wychwood House Alexander Drive Douglas Isle Of Man IM2 3QRPermitted,16/00317/B,Replacement of existing glazed conservatory roof with fibreglass finish,18-May-16,Senior Planning Officer - South (SC),1 Laurys Avenue Ramsey Isle Of Man IM8 2HEPermitted,16/00447/C,Change of use from tourist accommodation to residential use,21-Jun-16,Planning Committee,The Old Police Station Strand Road Port Erin Isle Of Man IM9 6HBPermitted,16/00561/REM,Reserved Matters application for the demolition of existing farmhouse and outbuildings and erection of a replacement detached dwelling with associated garaging and landscaping,04-Jul-16,Planning Committee,Lanjaghan Farm Lanjaghan Road Abbeylands Isle Of Man IM4 5EQ Permitted,16/00562/B,Installation of a flue to side elevation of dwelling,10-Aug-16,Senior Planning Officer - South (SC),31 Thorny Road Douglas Isle Of Man IM2 5EGPermitted,16/00563/B,"Alterations, replacement of garage door with a window and erection of an extension to dwelling",07-Jul-16,Senior Planning Officer - North (CB),2 Mountain View Peel Isle Of Man IM5 1QDPermitted,16/00564/B,Demolition of existing out buildings and erection of a conservatory,29-Jun-16,Senior Planning Officer - South (SC),18 Stanley Road Peel Isle Of Man IM5 1NXPermitted,16/00565/B,Erection of a single storey open fronted building to provide a six bay golf driving range with associated facilities,30-Jun-16,Interim Director 2016,King Edward Bay Golf Club Groudle Road Onchan Isle Of Man IM3 2JR Permitted,16/00676/B,Replacement windows to front elevation,09-Aug-16,Planning Committee,27 Hildesley Road Douglas Isle Of Man IM2 5AXPermitted,16/00750/B,Change of Material for Conservatory Roof to match existing property,21-Sep-16,Senior Planning Officer - North (CB),12 Glebe Aalin Ballaugh Isle Of Man IM7 5BWPermitted,16/00846/B,Installation of replacement windows,12-Sep-16,Senior Planning Officer - North (CB),14 Christian Road Douglas Isle Of Man IM1 2QNPermitted,16/00849/B,Internal alterations and refurbishment including increased opening for new entrance and replacement of glazed shopfronts,08-Sep-16,Senior Planning Officer - North (CB),Isle Of Man Bank 2 - 4 Regent Street Douglas Isle Of Man IM1 2EA Permitted,16/00887/D,Erection of two advertisement hoardings,08-Sep-16,Senior Planning Officer - North (CB),Entrance To Reayrt Ny Cronk & Slieau Whallian Residential Developments  Poortown Road Peel Isle Of Man  Permitted,16/00889/B,"Erection of a detached stable block and creation of a vehicular access, track and turning area",15-Nov-16,Planning Committee,Avistine Glen Road Colby Isle Of Man IM9 4HWPermitted,16/00919/B,Erection of garage with external hardstanding to front,05-Dec-16,Senior Planning Officer - South (SC),Garage Opposite 4 Windsor Terrace Douglas Isle Of Man IM1 3LHPermitted,16/00965/B,The creation of a new front entrance to the property plus external alterations,29-Sep-16,Senior Planning Officer - South (SC),Sunnybank 2 Brookside Ballanard Road Douglas Isle Of Man IM2 5PWPermitted,16/01077/B,Creation of a doorway and replacement of an existing doorway with a window,19-Oct-16,Senior Planning Officer - South (SC),16 Cronk Ny Greiney Douglas Isle Of Man IM2 5LWPermitted,16/01113/B,Installation of an external timber staircase (retrospective) and creation of two additional windows to agricultural building,25-Nov-16,Senior Planning Officer - South (SC),Ballaghennie Farm Lhen Road Bride Isle Of Man IM7 4BFPermitted,16/01115/B,"Alteration, erection of extension, creation of a turning area, entrance access alterations and landscaping.",01-Dec-16,Senior Planning Officer - South (SC),Dhoon Plat Main Road Dhoon Ramsey Isle Of Man IM7 1HL Permitted,16/01116/B,External positioning of multi-fuel burner flue. (16/00169/B),18-Nov-16,Senior Planning Officer - South (SC),26 St Runius Way Glen Vine Isle Of Man IM4 4FGPermitted,15/00724/A,"Approval in principle for erection of two dwellings to replace existing dwelling, addressing siting and means of access",01-Mar-16,Planning Committee,Millmount House Millmount Douglas Isle Of Man IM2 1HDPermitted,16/01156/B,Demolition of and Replacement store/stables.,21-Nov-16,Interim Director 2016,Stables Upper Scard Farm Ballakillowey Road Colby Isle Of Man IM9 4BP Certificate of Lawfulness AGREED,16/01170/LAW,Application to make lawful the use of land as a garden,15-Nov-16,Senior Planning Officer - South (SC),Maynrys Saint Marys Road Port Erin Isle Of Man IM9 6JPPermitted,16/01179/B,Roofing works and erection of first floor extension to dwelling.,14-Dec-16,Senior Planning Officer - North (CB),White House Bungalow Fistard Port St Mary Isle Of Man IM9 5PQ Permitted,16/01204/D,Installation of illuminated and non-illuminated signage.,24-Nov-16,Senior Planning Officer - North (CB),11 - 11A Michael Street Peel Isle Of Man IM5 1HBPermitted,16/01249/C,Additional use of residential accommodation as tourist living accommodation,20-Dec-16,Senior Planning Officer - South (SC),The Boat House Head Road Douglas Isle Of Man IM1 5BF Permitted,16/01276/B,"Alterations including replacement dormer, external decking, alterations to windows and cladding to rear elevation",15-Dec-16,Senior Planning Officer - South (SC),Misselthwaite Lodge Clay Head Road Baldrine Isle Of Man IM4 6DH Permitted,15/01339/D,Erection of illuminated signage,15-Jan-16,Head of Development Management,RL360 House Isle Of Man Business Park Douglas Isle Of Man IM2 2SP Permitted,15/01350/B,Erection of a detached store building to rear of dwelling,02-Mar-16,Senior Planning Officer - North (CB),White Coppice Glen Auldyn Ramsey Isle Of Man IM7 2AG Permitted,15/01351/B,Replacement of existing glazed conservatory roof with roof tiles,12-Jan-16,Senior Planning Officer - South (SC),47 Claughbane Drive Ramsey Isle Of Man IM8 2BJPermitted,15/01354/B,Alterations and erection of a first floor extension to dwelling,21-Jun-16,Planning Committee,Linden Lea Cannan Avenue Kirk Michael Isle Of Man IM6 1HFPermitted,15/01356/D,Erection of signage,15-Jan-16,Head of Development Management,37 South Quay Douglas Isle Of Man IM1 5AX Permitted,15/01363/B,"Installation of three air handling units, transformer and condensers in rear yard of Data Centre (part retrospective)",19-Jan-16,Senior Planning Officer - South (SC),"Continent 8 House Units 3B, 3C & 3D   Middle River Industrial Estate Douglas Isle Of Man IM2 1AL "Permitted,15/01365/B,Replacement of existing glazed conservatory roof with light weight roof tiles,19-Jan-16,Senior Planning Officer - North (CB),12 Seafield Crescent Onchan Isle Of Man IM3 3BYPermitted,16/00049/B,Installation of a replacement door and side window to dwelling,18-Feb-16,Senior Planning Officer - South (SC),Harbour View Back Shore Road Laxey Isle Of Man IM4 7DQPermitted,16/00050/B,Erection of a summerhouse (retrospective),18-Feb-16,Senior Planning Officer - South (SC),20 Claughbane Drive Ramsey Isle Of Man IM8 2AYPermitted,16/00052/B,"Alterations, demolition of existing porch and erection of a two storey side extension to dwelling",22-Feb-16,Senior Planning Officer - North (CB),Westbourne Darragh Port Erin Isle Of Man IM9 6JBPermitted,16/00340/B,Replacement of existing glazed conservatory roof with tiles,31-May-16,Senior Planning Officer - South (SC),46 Ballakermeen Drive Douglas Isle Of Man IM1 4HSPermitted,16/00437/B,Conversion of existing residential property to provide three residential apartments,05-Aug-16,Senior Planning Officer - South (SC),Waverley House 5 Christian Road Douglas Isle Of Man IM1 2QHPermitted,16/00438/B,Installation of replacement front elevation balcony door and rear elevation door to dwelling,06-Jun-16,Senior Planning Officer - South (SC),36 Selborne Drive Douglas Isle Of Man IM2 3NHPermitted,16/00439/B,Installation of replacement windows to dwelling,11-Jul-16,Senior Planning Officer - South (SC),67 Derby Square Douglas Isle Of Man IM1 3LRPermitted,16/00440/B,Creation of a driveway and vehicular access to dwelling,06-Jun-16,Senior Planning Officer - South (SC),9 St Catherines Close Douglas Isle Of Man IM1 4HY Refused,16/00441/A,Approval in principle for the erection of a detached dwelling addressing siting and means of access,28-Jul-16,Interim Director 2016,Land To Rear Of Trammon Walpole Road Ramsey Isle Of Man  Permitted,16/00442/B,Replacement of existing barn with cattle shed,15-Jul-16,Senior Planning Officer - South (SC),Barn Ballellin Farm Lower Glen Mona Road Glen Mona Maughold Isle Of Man  Permitted,16/00443/C,Creation of a temporary camp site with associated facilities,22-Jun-16,Planning Committee,Field 334939 Knockaloe Beg Farm Knockaloe Beg Lane Raggatt Peel Isle Of Man  Permitted,16/00718/B,Removal of rear wall to create off road parking,08-Aug-16,Senior Planning Officer - South (SC),26 Mona Street Douglas Isle Of Man IM1 2QDPermitted,16/00825/B,Alterations and erection of extension to dwelling,07-Sep-16,Senior Planning Officer - North (CB),Arkadia Alexander Drive Douglas Isle Of Man IM2 3QXPermitted,16/00826/B,Replacement of existing glazed conservatory roof with a solid roof with tiles,22-Sep-16,Senior Planning Officer - North (CB),31 Cedar Walk Douglas Isle Of Man IM2 5NFPermitted,16/00827/B,Alterations and erection of a side extension to dwelling,31-Oct-16,Senior Planning Officer - South (SC),75 Port E Chee Avenue Douglas Isle Of Man IM2 5EZPermitted,16/00828/B,Erection of a building to provide a hydrotherapy pool and adjacent covered barbecue area (retrospective),02-Nov-16,Senior Planning Officer - South (SC),The Old Vicarage Lonan Church Road Laxey Isle Of Man IM4 7JXPermitted,16/00829/B,Erection of a garden implement shed (retrospective),02-Nov-16,Senior Planning Officer - South (SC),The Old Vicarage Lonan Church Road Laxey Isle Of Man IM4 7JXPermitted,16/00922/B,Installation of replacement windows,27-Sep-16,Senior Planning Officer - South (SC),Harris View Apartments Mona Terrace Douglas Isle Of Man  Permitted,16/00923/B,Installation of external fire escape stairway,21-Sep-16,Senior Planning Officer - North (CB),Callows Yard Malew Street Castletown Isle Of Man IM9 1DQ Permitted,16/01092/CON,"Registered Building consent for the installation of replacement rear door, window, front fascia boards and guttering (in association with 16/01091/GB) Registered Building Nos. 127",18-Nov-16,Senior Planning Officer - South (SC),23 Governors Road Onchan Isle Of Man IM3 1AYPermitted,16/01095/B,Replacement roof atrium.,01-Nov-16,Senior Planning Officer - South (SC),Crenagh Glen Auldyn Ramsey Isle Of Man IM7 2AG Permitted,16/00037/B,Installation of replacement shop windows and door,22-Feb-16,Senior Planning Officer - North (CB),Chantilly Lace Bay View Road Port St. Mary Isle Of Man IM9 5AG Permitted,16/00038/C,Additional use of existing ancillary living accommodation over garage as tourist accommodation,31-Mar-16,Planning Committee,Close Vark Farm Kerroogarroo Regaby Ramsey Isle Of Man IM7 3HG Permitted,16/01021/B,Provision of second 40ft storage container.,14-Oct-16,Senior Planning Officer - South (SC),Old River Road Yard Old River Road Ramsey Isle Of Man IM8 3AEPermitted,16/01064/B,Removal and installation of new windows.,09-Dec-16,Senior Planning Officer - South (SC),3 Christian Street Peel Isle Of Man IM5 1NWRefused,16/01122/B,Creation of driveway and vehicular access.,28-Nov-16,Senior Planning Officer - South (SC),74 Westbourne Drive Douglas Isle Of Man IM1 4BDPermitted,16/00051/B,Alterations and conversion of building to form a dwelling with integral garage,01-Mar-16,Planning Committee,Alpine Mews Strathallan Lane Onchan Isle Of Man IM3 1NJPermitted,16/00132/B,Erection of a first floor extension to dwelling,29-Mar-16,Senior Planning Officer - South (SC),Mar Rhenny Upper Ballastrooan Colby Isle Of Man IM9 4NRPermitted,16/00133/B,"Alteration and conversion of part of outbuilding to a dwelling, extension to outbuilding to create tack/store room and installation of replacement windows",25-Jul-16,Senior Planning Officer - North (CB),Upper Garth Farm  Garth Road Crosby Isle Of Man IM4 2HBPermitted,16/00401/B,Installation of three penstocks to bridge,11-May-16,Interim Director 2016,Apostle's Bridge Castletown Isle Of Man  Permitted,16/00402/D,Erection of a timber hoarding to extend around area of demolition works,26-May-16,Senior Planning Officer - North (CB),Central Area Of Clagh Vane Estate ( 2-44 (even) & 41-79 (odd) Ballasalla Isle Of Man IM9 2HEApplication Withdrawn,16/00403/CON,"Registered Building consent for change of external footway surface, including option to raise pavement (In association with PA 16/00379/B) Registered Building Nos. 200",25-Jul-16,Withdrawn,Gaiety Theatre Harris Promenade Douglas Isle Of Man IM1 2HHRefused,16/00404/B,Alterations and extension to existing building to create a dwelling and extension of residential curtilage into adjacent field,06-Jun-16,Senior Planning Officer - South (SC),Store Adjacent To Glen View St. Judes Isle Of Man  Permitted,16/00405/B,Removal of a chimney,25-May-16,Senior Planning Officer - South (SC),4 Malew Street Castletown Isle Of Man IM9 1ABPermitted,16/00680/B,Conversion and extensions to existing barns and out buildings to provide a watchmakers workshop,09-Aug-16,Planning Committee,Outbuildings Claddagh Farm Sulby Bridge Sulby Isle Of Man  Permitted,16/00687/A,Approval in principle for the erection of a detached dwelling with garaging,23-Aug-16,Planning Committee,Land To Rear Of Olinda South Cape Laxey Isle Of Man  Permitted,16/00688/B,Replacement of existing cladding with composite cladding,23-Aug-16,Interim Director 2016,Storage Hut 2 Island Seafare Ltd The Quay Port St. Mary Isle Of Man IM9 5EDPermitted,16/00977/B,"Replacement of existing conservatory with garden room extension, including new bay window to existing house",13-Oct-16,Senior Planning Officer - North (CB),Ballacollister Grange Ballacollister Road Laxey Isle Of Man IM4 7JRPermitted,15/01272/B,"Alterations, erection of a gable end porch and creation of a rear canopy and an external doorway to rear outlet",15-Jan-16,Senior Planning Officer - South (SC),Union Mills Memorial Hall Main Road Union Mills Isle Of Man IM4 4ADPermitted,16/00064/D,Erection of advertising signage (in association with 16/00065/CON),24-Feb-16,Head of Development Management,5 Parliament Square Castletown Isle Of Man IM9 1LAPermitted,16/00065/CON,Registered Building Consent for erection of advertising signage (RB no 64 in association with 16/00064/D),24-Feb-16,Head of Development Management,5 Parliament Square Castletown Isle Of Man IM9 1LAPermitted,16/00135/B,Replacement of existing doorway with a window and creation of a porch over main entrance,09-Mar-16,Head of Development Management,Kittiwake Cottage Minorca Hill Laxey Isle Of Man IM4 7EAPermitted,16/00137/B,Alterations and extension to rear elevation to provide additional living accommodation,09-Mar-16,Head of Development Management,13 Westlands Close Ramsey Isle Of Man IM8 3PU Permitted,16/00717/B,Removal of conservatory and erection of extension,05-Aug-16,Senior Planning Officer - South (SC),21 Abbots Way Ballasalla Isle Of Man IM9 3EQ Permitted,16/00963/B,"Erection of a replacement helicopter hangar, conversion of existing hangar in to an equipment store and extension to residential curtilage",18-Oct-16,Planning Committee,Cronk Breck Bernahara Road Andreas Isle Of Man IM7 3HH Permitted,16/00964/B,Creation of a water borehole,02-Nov-16,Senior Planning Officer - South (SC),Island Aggregates Site At Oatlands Quarry Oatlands Road Santon Isle Of Man  Permitted,16/00966/B,Creation of field accesses,09-Nov-16,Senior Planning Officer - South (SC),Field 124385 & Field 124388 Smeale Road Andreas Isle Of Man  Permitted,16/01024/D,Installation of a digital sign (retrospective),08-Nov-16,Interim Director 2016,Skanco Court Cooil Road Douglas Isle Of Man IM2 2SR Permitted,16/01155/B,Conversion of existing conservatory to sunroom with pitched roof.,10-Nov-16,Senior Planning Officer - South (SC),27 Ballaterson Fields Ballaugh Isle Of Man IM7 5AWPermitted,16/00681/B,Erection of a dwelling with integral garage,29-Nov-16,Planning Committee,Vacant Plot With Garage Gellings Avenue Port St. Mary Isle Of Man  Application Withdrawn,14/00357/A,Approval in principle for the erection of twenty three dwellings with associated road layout and public open space,20-Jul-16,Withdrawn,Former Gas Works Port St Mary Isle Of Man IM9 5LF Permitted,16/00019/B,Erection of a dwelling (amendments to PA 15/00975/B),11-Apr-16,Planning Committee,Ballaughton Manor Saddle Road Douglas Isle Of Man IM2 1HGPermitted,16/00021/B,Conversion of two existing barns to create three tourist / residential units,10-May-16,Senior Planning Officer - North (CB),Barnagh  Rhencullen Kirk Michael Isle Of Man IM6 2HB Permitted,16/00184/GB,Alterations and refurbishment works to building (part retrospective in association with 16/00185/CON),14-Apr-16,Interim Director 2016,The Nook Quarterbridge Road Douglas Isle Of Man IM1 5EGPermitted,16/00185/CON,"Registered Building Consent for alterations and refurbishment works to building (part retrospective, in association with 16/00184/GB, RB no 137)",14-Apr-16,Interim Director 2016,The Nook Quarterbridge Road Douglas Isle Of Man IM1 5EGPermitted,16/00189/B,Erection of a single storey extension to rear elevation,31-Mar-16,Head of Development Management,Hillcrest Ballagale Avenue Surby Port Erin Isle Of Man IM9 6QJPermitted,16/00692/B,Construction of raised timber decking area to rear of dwelling,19-Oct-16,Senior Planning Officer - South (SC),146 Ballabrooie Drive Douglas Isle Of Man IM1 4HJPermitted,16/00700/D,Erection of illuminated and non-illuminated signage,26-Jul-16,Interim Director 2016,3 Christian Street Ramsey Isle Of Man IM8 1DG Permitted,16/01005/B,Replacement of existing sewage treatment works.,27-Oct-16,Senior Planning Officer - North (CB),Ballagarey Stw Glen Vine Isle Of Man  Permitted,16/01148/B,Replacement roof to rear annex.,10-Nov-16,Senior Planning Officer - South (SC),7 Hillcroft Rise Douglas Isle Of Man IM2 7EHPermitted,16/01183/B,Demolition of existing and erection of a replacement detached dwelling and garage.,13-Dec-16,Planning Committee,Hazeldene Orrisdale Kirk Michael Isle Of Man IM6 2HL Certificate of Lawfulness AGREED,16/01212/LAW,Application to make lawful chimney stack alterations,07-Dec-16,Senior Planning Officer - North (CB),12 Wesley Terrace Douglas Isle Of Man IM1 3HFPermitted,16/01269/B,Replacement of existing sun room roof with new flat roof incorporating glazed lantern,15-Dec-16,Senior Planning Officer - North (CB),20 Birch Hill Crescent Onchan Isle Of Man IM3 3DJDeemed withdrawn 4(3) Dev Pro Order 2005,16/00273/C,Creation of a temporary campsite with associated facilities for the periods 26th May to 13th June and 19th August to 6th September 2016,22-Dec-16,Withdrawn,Field 315139 Adjacent To Glen Moar Mill Glen Helen Road Laurel Bank St Johns Isle Of Man  Permitted,16/00275/B,Alterations to existing steps and replacement of existing railings,10-May-16,Senior Planning Officer - North (CB),Public Access To Churchyard St Peters Church Church Road Onchan Isle Of Man  Permitted,16/01008/A,Approval in principle for the erection of a dwelling addressing matters for means of access,25-Nov-16,Senior Planning Officer - South (SC),Field 614729 Baldrine Road Baldrine Isle Of Man  Permitted,16/01161/B,New patio doors to basement apartment. (In association with 16/00722/B),10-Nov-16,Senior Planning Officer - South (SC),Savoy 6 Castlemona Terrace Central Promenade Douglas Isle Of Man IM2 4LU Permitted,16/00079/B,Replacement of existing glazed conservatory roof with light weight roof tiles,03-Mar-16,Senior Planning Officer - South (SC),35 Oak Road Ballawattleworth Peel Isle Of Man IM5 1WB Permitted,16/00080/B,Erection of four flood lights mounted on columns at each corner of bowling green,24-Jun-16,Senior Planning Officer - North (CB),Marown Bowling Club Marown Memorial Playing Fields  Old Church Road Crosby Isle Of Man IM4 2HAPermitted,16/01120/B,Construction and extension to rear.,09-Nov-16,Senior Planning Officer - North (CB),16 Queen Margaret Road Glen Vine Isle Of Man IM4 4ETPermitted,16/01144/B,Construction of a drainage lake with associated landscaping works. (Retrospective),29-Nov-16,Planning Committee,Field 122328 Bernahara Road Andreas Isle Of Man  Permitted,16/01256/B,Installation of sliding/folding doors to replace window,05-Dec-16,Interim Director 2016,15 St Catherines Drive Douglas Isle Of Man IM1 4BHPermitted,16/00124/B,Installation of replacement dormer windows to rear elevation,14-Mar-16,Director Delegation,123 Woodbourne Road Douglas Isle Of Man IM2 3AU Permitted,16/00446/B,Erection of two storey extension to dwelling,06-Jun-16,Senior Planning Officer - South (SC),19 Bayr Grianagh Castletown Isle Of Man IM9 1HLPermitted,16/00460/B,"Alterations to approved PA 15/00075/B: Reconstruction of the highway and footpaths, drainage, services, street lighting, street furniture and signage",06-Jun-16,Senior Planning Officer - North (CB),Market Place: Douglas Street To Michael Street: Michael Street To Orry Lane Peel Isle Of Man Permitted,16/00461/B,Removal of chimneys and roof lights and replacement of existing flat canopy roofs with pitched slate canopies,21-Jun-16,Planning Committee,1 - 14 Orestal Colby Isle Of Man IM9 4ASPermitted,16/00462/B,Removal of existing chimney stacks,25-May-16,Senior Planning Officer - South (SC),15- 35 Ballacrosha Ballaugh Isle Of Man IM7 5AGPermitted,16/00463/B,Removal of existing chimney stacks,25-May-16,Senior Planning Officer - South (SC),2 - 16 (even No's Only) Archallagan Terrace Foxdale Isle Of Man IM4 3EZPermitted,16/00464/D,Erection of non-illuminated signage (in association with 16/00465/CON),21-Jun-16,Interim Director 2016,Former Social Security Office Castle Street Castletown Isle Of Man IM9 1LD Permitted,16/00536/B,Installation of roof lights to dwelling,24-Jun-16,Senior Planning Officer - South (SC),36 Selborne Drive Douglas Isle Of Man IM2 3NHPermitted,16/00537/C,Additional use of residential dwelling as tourist accommodation,13-Jul-16,Senior Planning Officer - South (SC),64 Slieau Curn Park Kirk Michael Isle Of Man IM6 1EW Permitted,16/00538/B,"Alterations, erection of a rear porch extension and installation of roof lights and decking",24-Jun-16,Senior Planning Officer - South (SC),The Orchids Park View Agneash Laxey Isle Of Man IM4 7NS Permitted,16/00539/B,Erection of extensions to extend garage and provide additional living space,15-Aug-16,Senior Planning Officer - South (SC),11 Mountain View Ballaugh Isle Of Man IM7 5EPPermitted,16/00665/B,Erection of a terrace of seven dwellings with associated parking,13-Dec-16,Planning Committee,Car Park And Whitestones And Former Coastguard Store Maine Road Port Erin Isle Of Man IM9 6LQRefused,15/01198/B,Removal of chimney stack on rear elevation,26-Jan-16,Senior Planning Officer - South (SC),Commercial Hotel Market Place West Ramsey Isle Of Man IM8 1JU Permitted,15/01199/B,Removal of chimney stack and installation of dormer windows to front and rear elevations,15-Jan-16,Head of Development Management,Rainbows End Beaumont Road Ramsey Isle Of Man IM8 2HN Permitted,16/00140/B,Erection of a first floor extension to rear elevation to create additional workspace with roof terrace over,10-May-16,Senior Planning Officer - North (CB),64 Bucks Road Douglas Isle Of Man IM1 3AEPermitted,16/00141/B,Demolition of existing single storey extension and erection of replacement two storey extension to provide additional living accommodation,11-Apr-16,Planning Committee,The Old Parsonage St Marks Ballasalla Isle Of Man IM9 3AH Permitted,16/00161/B,Alterations and creation of a first floor to dwelling,05-Apr-16,Senior Planning Officer - South (SC),Sea Point Booilushag Ballajora Ramsey Isle Of Man IM7 1BDPermitted,16/00218/D,Erection of signage (in association with 16/00219/CON),12-Apr-16,Interim Director 2016,Co-op Store  The Parade Castletown Isle Of Man IM9 1LG Permitted,16/00219/CON,Registered Building Consent for erection of signage (RB no 32 in association with 16/00218/D),12-Apr-16,Interim Director 2016,Co-op Store  The Parade Castletown Isle Of Man IM9 1LG Permitted,16/00221/B,Replacement of existing glazed conservatory roof with a fibreglass roof,10-May-16,Senior Planning Officer - North (CB),Rivendell Lhergy Cripperty Union Mills Isle Of Man IM4 4NFPermitted,16/00222/B,Installation of replacement windows and patio door,31-Mar-16,Head of Development Management,Fishermans Cottage Dandy Hill Port Erin Isle Of Man IM9 6HNPermitted,16/00223/B,Replacement of existing glazed conservatory roof with light weight roof tiles,10-May-16,Senior Planning Officer - North (CB),82 Fairways Drive Mount Murray Douglas Isle Of Man IM4 2JF Permitted,16/00225/B,Installation of replacement door and side window to rear elevation (retrospective),10-May-16,Senior Planning Officer - North (CB),14 Stanley Mount Peel Isle Of Man IM5 1NEPermitted,16/00226/B,Creation of an all-weather equestrian arena,04-Apr-16,Interim Director 2016,Westmoor Ballavartyn Road Santon Isle Of Man IM4 1HTPermitted,15/01246/B,Erection of extension to garage,08-Jan-16,Senior Planning Officer - South (SC),Rosy Vigra May Hill Ramsey Isle Of Man IM8 2HG