RB_Number,Building_Name,Date_Registered,Links,Parish,Features,Status,architect_names,builder_names,reasons_for_registration,construction_start_year,construction_end_year,construction_start_date_text,construction_end_date_text,registration_date_text,deregistration_date_text,notes_extraction,cleaned_text_source,md_path,Needs_Review
140,The Quarter Bridge Hotel,,https://www.gov.im/media/632225/0500140regbld-quarterbridge-hotel-add.pdf,Douglas,,De-registered,[],[],"[""architectural interest"", ""historic interest""]",,,,,1st day of August 1991,15 January 1992,,fenced_block,data/gov.im/registered-buildings/outputs/rb-140/rb-140.md,no_names; no_dates
141,"Landmark Tower known as The Herring Tower, Langness",01/08/1991,https://www.gov.im/media/632567/0500141regbldherringtower.pdf,Malew,,Registered,[],[],"[""architectural and historic interest""]",,,,,21st June 1991,,,fenced_block,data/gov.im/registered-buildings/outputs/rb-141/rb-141.md,no_names; no_dates
142,"The Powder House, Langness",01/08/1991,https://www.gov.im/media/632573/0500142regbldthepowderhouse.pdf,Malew,,Registered,[],[],"[""architectural interest"", ""historic interest""]",,,,,1st day of August 1991,,,fenced_block,data/gov.im/registered-buildings/outputs/rb-142/rb-142.md,no_names; no_dates
143,"Orrisdale Limekiln, Glentrunk, Michael",15/10/1991,https://www.gov.im/media/632657/0500143regbldorrisdalelimekiln.pdf,Michael,,Registered,[],[],"[""architectural interest"", ""historic interest""]",,,,,4th October 1991,,,fenced_block,data/gov.im/registered-buildings/outputs/rb-143/rb-143.md,no_names; no_dates
144,"The Saddle Hotel, Parliament Street",01/01/1991,https://www.gov.im/media/632909/0500144regbldnightlifemarketplace.pdf,Ramsey,,Registered,[],[],"[""architectural and historic interest""]",,,,,11th March 1992,,,fenced_block,data/gov.im/registered-buildings/outputs/rb-144/rb-144.md,no_names; no_dates
145,"Okells Brewery, Glen Falcon",17/03/1992,https://www.gov.im/media/632231/0500145regbldoldbrewerywinetradi.pdf,Douglas,,Registered,[],[],"[""architectural interest"", ""historic interest""]",,,,,11th March 1992,,,fenced_block,data/gov.im/registered-buildings/outputs/rb-145/rb-145.md,no_names; no_dates
146,"Thurot Cottage Outbuildings and Gate, Hill Road",21/10/1992,https://www.gov.im/media/631631/0500146regbldthurotcottageoutbuil.pdf,Bride,,Registered,[],[],"[""architectural and historic interest""]",,,,,16th September 1992,,,fenced_block,data/gov.im/registered-buildings/outputs/rb-146/rb-146.md,no_names; no_dates
147,Point of Ayre Lighthouse,05/11/1993,https://www.gov.im/media/631637/0500147regbldlighthouse.pdf,Bride,,Registered,[],[],"[""architectural interest"", ""historic interest""]",,,,,15th October 1993,,,fenced_block,data/gov.im/registered-buildings/outputs/rb-147/rb-147.md,no_names; no_dates
148,Langness Lighthouse,05/11/1993,https://www.gov.im/media/632579/0500148regbldlangnesslighthouse.pdf,Malew,,Registered,[],[],"[""architectural and historic interest""]",,,,,15th October 1993,,,fenced_block,data/gov.im/registered-buildings/outputs/rb-148/rb-148.md,no_names; no_dates
149,Douglas Head Lighthouse,05/11/1993,https://www.gov.im/media/632237/0500149regblddouglasheadlighthous.pdf,Douglas,,Registered,[],[],"[""architectural interest"", ""historic interest""]",,,,,15th October 1993,,,fenced_block,data/gov.im/registered-buildings/outputs/rb-149/rb-149.md,no_names; no_dates
150,Balladoole Farm Buildings,08/02/1994,https://www.gov.im/media/631517/0500150regbldballadoolefarm.pdf,Arbory,,Registered,[],[],"[""architectural interest"", ""historic interest""]",,,,,"17th December, 1993",,,fenced_block,data/gov.im/registered-buildings/outputs/rb-150/rb-150.md,no_names; no_dates
151,"2, 4, 6, 8, 10, 12, 14, 16, & 18, Albion Terrace",24/08/1994,https://www.gov.im/media/632915/0500151regbld218albionterrace.pdf,Ramsey,,Registered,[],[],"[""architectural interest"", ""historic interest""]",,,,,2nd August 1994,,,fenced_block,data/gov.im/registered-buildings/outputs/rb-151/rb-151.md,no_names; no_dates
152,"3, 4, 5, 6, 7, 8, 9 & 10 Auckland Terrace & West House",24/08/1994,https://www.gov.im/media/632921/0500152regbldbeanoa.pdf,Ramsey,,Registered,[],[],"[""architectural and historic interest""]",,,,,25th May 1994,,,fenced_block,data/gov.im/registered-buildings/outputs/rb-152/rb-152.md,no_names; no_dates
154,Queens Pier,06/02/1995,https://www.gov.im/media/632927/0500154regbldqueenspierentrance.pdf,Ramsey,,Registered,[],[],"[""architectural and historic interest""]",,,,,"6th day of February, 1995",,,fenced_block,data/gov.im/registered-buildings/outputs/rb-154/rb-154.md,no_names; no_dates
155,Ballure Inn,12/07/1995,https://www.gov.im/media/632933/0500155regbld7ballureroad.pdf,Ramsey,,Registered,[],[],"[""architectural interest"", ""historic interest""]",,,,,23rd June 1995,,,fenced_block,data/gov.im/registered-buildings/outputs/rb-155/rb-155.md,no_names; no_dates
156,"Facade and Foyer, Strand Cinema",11/07/1995,https://www.gov.im/media/632243/0500156regbldsiteformerlyknownas.pdf,Douglas,,Registered,[],[],"[""architectural and historic interest"", ""earliest and best example of a tiled facade"", ""strikingly good example of \""People's Palace\"" Architecture"", ""major contribution to the streetscape""]",,1913.0,,"26th July, 1913","7th April, 1995",,,fenced_block,data/gov.im/registered-buildings/outputs/rb-156/rb-156.md,no_names
157,"The Village House, Foxdale",31/10/1995,https://www.gov.im/media/632795/0500157regbldvillagehouse.pdf,Patrick,,Registered,[],[],"[""architectural and historic interest""]",,,,,26th October 1995,,,fenced_block,data/gov.im/registered-buildings/outputs/rb-157/rb-157.md,no_names; no_dates
159,"""Ivydene"", Little Switzerland",26/01/1996,https://www.gov.im/media/632249/0500159regbldivydene.pdf,Douglas,Baillie Scott,Registered,"[""Mackay Hugh Baillie Scott""]",[],"[""architectural and historic interest"", ""one of the earliest recorded works of Mackay Hugh Baillie Scott"", ""example of Arts and Crafts style"", ""internationally renowned architect""]",1893.0,1894.0,1893,1894,12th January 1996,,"The building ""Ivydene"" in Little Switzerland, Douglas, was designed by Mackay Hugh Baillie Scott and built between 1893-94. It is recognized for its architectural and historic interest, being one of the earliest works of Baillie Scott, an internationally renowned architect. The building is a notable example of the Arts and Crafts style and is recommended for listing for both its internal and external features. The registration prohibits alteration or demolition without prior consent.",fenced_block,data/gov.im/registered-buildings/outputs/rb-159/rb-159.md,
160,"The Red House, Victoria Road",26/01/1996,https://www.gov.im/media/632255/0500160regbldredhouse.pdf,Douglas,Baillie Scott,Registered,"[""Mackay Hugh Baillie Scott""]",[],"[""architectural and historic interest"", ""good example of its style blending traditional British rural features with American influences"", ""important works of the internationally renowned Architect Mackay Hugh Baillie Scott"", ""innovative approach to planning""]",1892.0,1893.0,October 20th 1892,,12th January 1996,,"The Red House was designed and built by Mackay Hugh Baillie Scott for his own occupation. It is noted for its architectural and historic interest, blending traditional British rural features with American influences. The building is a significant example of Baillie Scott's work and is maintained to high standards.",fenced_block,data/gov.im/registered-buildings/outputs/rb-160/rb-160.md,
161,"""Oakleigh"", Glencrutchery Road",26/01/1996,https://www.gov.im/media/632261/0500161regbldoakleigh.pdf,Douglas,Baillie Scott,Registered,"[""Mackay Hugh Baillie Scott""]","[""W Macadam""]","[""architectural and historic interest"", ""one of the major works of the internationally renowned Architect Mackay Hugh Baillie Scott"", ""architectural significance as a few examples of design by an internationally recognised architect"", ""important contribution to the built Heritage of the Isle of Man""]",1893.0,1893.0,1893,1893,12th January 1996,,"The building is a significant example of Mackay Hugh Baillie Scott's work, showcasing his early development and unique architectural style. It is noted for its picturesque facade and innovative use of space and materials.",fenced_block,data/gov.im/registered-buildings/outputs/rb-161/rb-161.md,
162,"Myrtle Bank, Little Switzerland",26/01/1996,https://www.gov.im/media/632267/0500162regbldmyrtlebank.pdf,Douglas,Baillie Scott,Registered,"[""Mackay Hugh Baillie Scott""]",[],"[""architectural interest"", ""historic interest""]",1895.0,1896.0,1895,1896,12th January 1996,,,fenced_block,data/gov.im/registered-buildings/outputs/rb-162/rb-162.md,
163,"Hollybank, Little Switzerland",26/01/1996,https://www.gov.im/media/632273/0500163regbldhollybank.pdf,Douglas,Baillie Scott,Registered,"[""Mackay Hugh Baillie Scott""]",[],"[""architectural interest"", ""historic interest""]",1895.0,1896.0,1895,1896,12th January 1996,,"The building is one of the most important works of Mackay Hugh Baillie Scott, an internationally renowned architect. It was built as a speculative venture and represents a departure from his earlier architectural style.",fenced_block,data/gov.im/registered-buildings/outputs/rb-163/rb-163.md,
164,"Falcon Cliff Terrace, Ivy Cottage, Thie Bannee, Inglenook, Thorn Bank",26/01/1996,https://www.gov.im/media/632279/rb-164-falcon-cliff-terrace-ivy-cottage-thie-bannee-inglenook-thorn-bank-terrace-registration-documents-130623.pdf,Douglas,Baillie Scott,Registered,"[""Mackay Hugh Baillie Scott""]",[],"[""architectural and historic interest"", ""one of a group of four terraced houses by Mackay Hugh Baillie Scott"", ""sensitive and creative use of craftsmanship and materials"", ""revolutionary approach to internal planning"", ""important landmark in terraced housing""]",1897.0,1898.0,1897,1898,12th January 1996,,"The building is part of a group of four terraced houses designed by Mackay Hugh Baillie Scott, known for his Arts and Crafts style. The property has been converted into two flats but retains many original features.",fenced_block,data/gov.im/registered-buildings/outputs/rb-164/rb-164.md,
166,"Cadran Cottage, Ballanard Road",15/09/1996,https://www.gov.im/media/632285/0500166regbldcadrancottage.pdf,Douglas,,Registered,"[""Mr Kewley"", ""Archibald Knox""]",[],"[""Aesthetic Quality"", ""Uniqueness"", ""It is the work of an internationally acclaimed designer Archibald Knox""]",,1910.0,,1910,"4th October, 1996",,"The cottage was originally a traditional dwelling from pre-1869, remodeled in 1910 by Mr Kewley and Archibald Knox. It features unique architectural details and fittings, and the garden contains items from the Ballanard Brickworks.",fenced_block,data/gov.im/registered-buildings/outputs/rb-166/rb-166.md,
167,Douglas Courthouse and 13 Athol Street,15/04/1997,https://www.gov.im/media/632291/0500167regbldformerdouglascourth.pdf,Douglas,,Registered,"[""John Robinson""]","[""Henry Robinson""]","[""The Aesthetic Quality of the building, in particular, the external stucco work to be found on the Athol Street and Church Street elevations"", ""The unique role which the building has played in the Sociological and Historical development of the Island, particularly by virtue of its use as the central Court House for the Island and its traditional connections with the Judicial system"", ""The building is among the most notable works of one of the Island's finest Architects, John Robinson 1798 - 1880""]",,,,,"31st January, 1997",,,fenced_block,data/gov.im/registered-buildings/outputs/rb-167/rb-167.md,no_dates
168,"Milntown House, Including the Old Mill, Mill Pond and Mill Race",21/05/1997,https://www.gov.im/media/632555/0500168regbldmilntownmansion.pdf,Lezayre,,Registered,[],[],"[""close historical association with the Christian family and Illiam Dhone Christian"", ""age, as one of the earliest sites settled by the Vikings"", ""architectural interest, including Jacobean and Gothic Revival features""]",,,,,"19th December, 1996",,"The document provides historical context and reasons for the registration of Milntown House, highlighting its architectural and historical significance. The registration prohibits alterations or demolition without consent.",fenced_block,data/gov.im/registered-buildings/outputs/rb-168/rb-168.md,no_names; no_dates
169,"Douglas Town Hall and Public Library, Ridgeway Street",22/05/1997,https://www.gov.im/media/632297/0500169regbldfreelibrary.pdf,Douglas,,Registered,"[""Mr Ardron F.R.I.B.A.""]","[""Messrs Gradwell and Co.""]","[""The aesthetic quality of the buildings"", ""The unique role which the building has played in the Sociological and Historical development of the Island's Capital""]",1897.0,1900.0,1897,1900,"22 day of May, 1997",,,fenced_block,data/gov.im/registered-buildings/outputs/rb-169/rb-169.md,
170,"St Stephens Church and former School Room, Sulby",22/4/1998,https://www.gov.im/media/1348568/rb-170-a4.pdf,Lezayre,,Registered,[],[],[],,,,,,,The OCR text provided is very limited and does not contain sufficient information to extract most of the required fields.,fenced_block,data/gov.im/registered-buildings/outputs/rb-170/rb-170.md,no_names; no_reasons; no_dates
171,"Sulby Old School, Sulby",22/4/1998,https://www.gov.im/media/1348569/rb-171-a4.pdf,Lezayre,,Registered,[],[],[],,,,,,,The OCR text provided is too limited to extract detailed information about the building.,fenced_block,data/gov.im/registered-buildings/outputs/rb-171/rb-171.md,no_names; no_reasons; no_dates
172,"Sulby Methodist Church, Sulby",22/4/1998,https://www.gov.im/media/1348570/rb-172v2.pdf,Lezayre,,Registered,[],[],"[""special architectural and historic interest""]",,,,,24th April 1998,,The document confirms the registration of Sulby Methodist Chapel due to its special architectural and historic interest. The registration prohibits alteration or demolition without consent. The document also includes procedural notes on registration and de-registration.,fenced_block,data/gov.im/registered-buildings/outputs/rb-172/rb-172.md,no_names; no_dates
173,Central Hotel,25/06/1998,https://www.gov.im/media/632303/0500173regbld-central-hotel-website.pdf,Douglas,,Registered,"[""W. J. Rennison"", ""A Pennington"", ""Edward Forrest""]","[""Louis Kelly""]","[""major contribution to the streetscape"", ""aesthetic quality"", ""high standard of decorative terracotta and lime stucco work"", ""example of High Victorian Architecture"", ""important element in historical and sociological development""]",1887.0,,"1st September, 1887",,"5th June, 1998",,"The Central Hotel is a significant example of Victorian architecture, noted for its aesthetic quality and historical importance in Douglas. It was registered due to its architectural and historic interest, with a focus on its contribution to the streetscape and its representation of High Victorian Architecture.",fenced_block,data/gov.im/registered-buildings/outputs/rb-173/rb-173.md,
174,1 Albert Terrace,25/06/1998,https://www.gov.im/media/632309/0500174regbld1albertterrace.pdf,Douglas,,Registered,"[""John Robinson""]",[],"[""The Architectural merit and aesthetic value of the building"", ""The building’s association with the renowned local Architect, John Robinson"", ""The building’s significance within the immediate locality as well as the contribution which it makes to the streetscape of Douglas as a whole"", ""The association of the building with Robert Boardman and the contribution which the building has made in marking the sociological and historical development of the town of Douglas""]",1847.0,1849.0,1847,1849,"5th June, 1998",,"The building was originally called Osborne Terrace and was built for Robert Boardman, agent for the Monarch Steamboat Company. It is associated with architect John Robinson and is significant for its architectural merit and historical associations.",fenced_block,data/gov.im/registered-buildings/outputs/rb-174/rb-174.md,
175,Majestic Hotel,,https://www.gov.im/media/632777/0500175regbld-majestic-hotel-add.pdf,Onchan,,De-registered,"[""Mackay Hugh Baillie Scott""]","[""Frederick Saunderson""]","[""First major work of M.H. Baillie Scott"", ""Important role in sociological and historical development"", ""Prominent coastal position as a landmark""]",1892.0,1893.0,1892,1893,"5th June, 1998","15th March, 1999","The Majestic Hotel, originally known as 'View Park' or 'The Mansion', was designed by Mackay Hugh Baillie Scott and constructed between 1892 and 1893. It was one of Scott's largest private commissions and is noted for its Elizabethan Revival style. The building was registered due to its architectural significance, historical role, and landmark status. However, it was later de-registered following an appeal, with the decision confirmed on 15th March, 1999.",fenced_block,data/gov.im/registered-buildings/outputs/rb-175/rb-175.md,
176,The Central Hotel,30/09/1998,https://www.gov.im/media/632939/0500176regbldcentralhotel.pdf,Ramsey,,Registered,[],"[""Thomas Mylrea""]","[""Age and rarity"", ""Historical association with persons of note"", ""Aesthetic quality"", ""Landmark quality""]",1797.0,,circa 1797,,"September, 1998",,"The Central Hotel, Ramsey, is a historically significant building with architectural merit, associated with notable figures like Frederick Tellet. It is a landmark on the Isle of Man T.T. Road Racing Course.",fenced_block,data/gov.im/registered-buildings/outputs/rb-176/rb-176.md,
177,"Erin Brae, Queen's Promenade",12/10/1998,https://www.gov.im/media/632315/0500177regblderinbrae.pdf,Douglas,,Registered,"[""Mr Peter Kelly""]",[],"[""Its historical association with the Duke of Athol."", ""Its aesthetic quality and architectural merit."", ""Age and rarity - being constructed in 1821-22, this building is one of the oldest surviving, detached buildings along the length of the Promenades.""]",1821.0,1822.0,1821,1822,"2nd day of October, 1998",,"The building is noted for its historical association with the Duke of Athol, its aesthetic quality, and its age and rarity as one of the oldest surviving buildings along the Promenades. It has alternated between use as a hotel and a private house.",fenced_block,data/gov.im/registered-buildings/outputs/rb-177/rb-177.md,
178,St Thomas Church,14/06/1999,https://www.gov.im/media/632321/0500178regbldstthomaschurch.pdf,Douglas,,Registered,"[""Ewan Christian""]","[""John Millar Nicholson""]","[""unique example of decorative art and craftsmanship"", ""designed by eminent Victorian Architect Ewan Christian"", ""important contribution to the streetscape of Douglas""]",1846.0,1872.0,"9th July, 1846","29th June, 1872","14th June, 1999",,,fenced_block,data/gov.im/registered-buildings/outputs/rb-178/rb-178.md,
179,"Harold Tower, Douglas Head Road",18/09/2000,https://www.gov.im/media/632327/0500179regbldharoldtowerfortanne.pdf,Douglas,,Registered,"[""John Welch""]",[],"[""striking example of mid-nineteenth century confidence"", ""well built in Manx slate"", ""plaster panels by a former resident artist"", ""significant and commanding site"", ""design attributed to John Welch"", ""previous occupants include John Martin""]",1833.0,,1833,,"2 day of September, 2000",,"The building is a castellated hexagonal tower, originally a folly, with subsequent alterations. It was originally part of the Nunnery estate and has associations with notable figures such as John Martin. The design is attributed to John Welch, and it features Manx Baronial Gothick style with materials like Welsh slate for the roof and Manx slate for the walls.",fenced_block,data/gov.im/registered-buildings/outputs/rb-179/rb-179.md,
181,"Old School/House, St Mark's",06/12/2000,https://www.gov.im/media/632585/0500181regbldoldschoolhouse.pdf,Malew,,Registered,"[""Armitage Rigby""]",[],"[""Aesthetic quality and the building’s association with the acclaimed architect Armitage Rigby."", ""The building’s high degree of external originality to external elevations."", ""Group importance with St Mark’s church and Church Cottages""]",1843.0,1845.0,1843,6 September 1845,17th November 2000,,"The building was registered due to its special architectural and historic interest, particularly its association with architect Armitage Rigby and its role in the development of the parish.",fenced_block,data/gov.im/registered-buildings/outputs/rb-181/rb-181.md,
182,"St Mark's Church, St Mark's",09/05/2001,https://www.gov.im/media/632591/0500182regbldstmarkschurch.pdf,Malew,,Registered,[],"[""H W Hewitt"", ""Peter Jones""]","[""Age. The property can be accurately dated as being constructed in 1772."", ""Architectural style and aesthetic quality."", ""Close historical association with Reverend John Thomas Clark, who was known as the ‘Patriarch’ of St Mark’s."", ""Landmark qualities. St Mark’s Church is situated in an elevated position and its bell-cote is visible for several miles in all directions."", ""Group interest - with the Schoolhouse and Church Cottages, St Mark’s Church forms a unique grouping of ecclesiastical properties.""]",1771.0,1772.0,1771,1772,30th March 2001,,,fenced_block,data/gov.im/registered-buildings/outputs/rb-182/rb-182.md,
183,"Bayqueen Hotel, The Promenade",,https://www.gov.im/media/1382477/rb183-de-registration-notice-combined_compressed.pdf,Port St Mary,,De-registered,"[""Alexander J. Davidson""]","[""W. McArd & Son""]","[""outstanding example of local hotel design"", ""monumental approach to its design"", ""unique example of Art Deco Style""]",1935.0,1935.0,1935,1935,30th March 2001,29th February 2024,,fenced_block,data/gov.im/registered-buildings/outputs/rb-183/rb-183.md,
184,"Church Cottages, St Mark's",09/05/2001,https://www.gov.im/media/632597/0500184regbldchurchcottage.pdf,Malew,,Registered,[],[],"[""Architectural style and aesthetic quality"", ""Historical association in the development of the hamlet"", ""Close historical association with Reverend John Thomas Clark, who was known as the ‘Patriarch’ of St Mark’s"", ""Group interest with the Schoolhouse and St Mark’s Church, forming a unique grouping of ecclesiastical properties""]",1846.0,1899.0,1846,1899,30th March 2001,,,fenced_block,data/gov.im/registered-buildings/outputs/rb-184/rb-184.md,no_names
185,"King William's College, Castletown",06/07/2001,https://www.gov.im/media/631991/0500185regbldkingwilliamscollege.pdf,Castletown,,Registered,[],[],"[""special architectural and historic interest""]",,,,,6th day of July 2001,,,fenced_block,data/gov.im/registered-buildings/outputs/rb-185/rb-185.md,no_names; no_dates
186,"Douglas Hotel, North Quay",26/07/2001,https://www.gov.im/media/632333/0500186regblddouglashotel.pdf,Douglas,,Registered,[],"[""Robert Black"", ""William Scott""]","[""Age - the property above ground is known to date from 1759: the vaulted cellars are believed to date from the late 1660’s. These would be much the oldest surviving properties in Douglas."", ""Historic interest - the building has played an important part in the historical development of the town and port of Douglas. The building represents one of the most substantial legacies of the ‘Running Trade’ and is a genuine survival of this part of the Island’s history. The property also has historical links with persons of national importance including Peter John Heywood (1739 — 1790) and the Duke of Athol who each used the property as their dwelling house for some time."", ""Substantial retention of original fabric which is capable of conservation and repair."", ""Possible links with the Lord’s cellar that requires further investigation.""]",1759.0,,1759,,"6th day of July, 2001",,,fenced_block,data/gov.im/registered-buildings/outputs/rb-186/rb-186.md,
187,"1-12 Victoria Terrace, off Victoria Road",15/08/2001,https://www.gov.im/media/632339/0500187regbld8victoriaterrace.pdf,Douglas,,Registered,[],[],"[""special architectural and historic interest""]",,,,,27th July 2001,,,fenced_block,data/gov.im/registered-buildings/outputs/rb-187/rb-187.md,no_names; no_dates
188,"All Saints Church, Alexander Drive",15/08/2001,https://www.gov.im/media/632345/0500188regbldallsaintschurchhall.pdf,Douglas,,Registered,"[""C. J. Kneen""]","[""Messrs. Parkinson Limited""]","[""outstanding example of modern ecclesiastical design"", ""first Anglican church built in the Island for over fifty years"", ""utilised many new and revolutionary construction techniques"", ""mural by the late Dorothy Nicholson""]",1898.0,1898.0,8th February 1898,14th July 1898,27th July 2001,,The church was known as the 'Tin Tabernacle' due to its iron construction. It was intended as a temporary measure but lasted much longer than expected. The original church was demolished in 1965 and replaced by a modern church consecrated in 1967.,fenced_block,data/gov.im/registered-buildings/outputs/rb-188/rb-188.md,
189,Close Lake House,15/05/2001,https://www.gov.im/media/631499/0500189regbldcloselake.pdf,Andreas,,Registered,[],[],"[""special architectural and historic interest"", ""mid-Victorian house style"", ""association with the Christian family"", ""original features"", ""unique and significant value""]",,,,,27th July 2001,,"The document provides historical and architectural context for Close Lake House, highlighting its connection to the Christian family and its mid-Victorian architectural style. The house is noted for its original features and its association with significant historical figures and agricultural improvements on the Isle of Man.",fenced_block,data/gov.im/registered-buildings/outputs/rb-189/rb-189.md,no_names; no_dates
190,"Woodlands, Alexander Drive",31/10/2001,https://www.gov.im/media/632351/0500190regbldwoodlands.pdf,Douglas,,Registered,[],[],"[""special architectural and historic interest""]",,,,,"28th September, 2001",,,fenced_block,data/gov.im/registered-buildings/outputs/rb-190/rb-190.md,no_names; no_dates
