Enclose existing shelter with glazed units and external timber studding and cladding,Bowling Green Shelter Mooragh Park Ramsey Isle Of Man  ,PER,10-Jan-14,13/91315/B
Installation of flue to side elevation,41 Sprucewood View Foxdale Isle Of Man IM4 3HA ,PER,06-Jan-14,13/91362/B
Erection of projecting advertising sign,Tanroagan Restaurant 9 Ridgeway Street Douglas Isle Of Man IM1 1EW,PER,09-Jan-14,13/01365/D
Replacement of existing conservatory roof with light weight roof tiles,3 Hailwood Avenue Douglas Isle Of Man IM2 7AD ,PER,06-Jan-14,13/91366/B
Approval in principle for erection of a replacement dwelling,White Lodge Main Road Union Mills Isle Of Man IM4 4LW,PER,14-Feb-14,14/00017/A
Erection of a replacement dwelling,Highcliffe East Baldwin Isle Of Man IM4 5EP ,PER,20-Feb-14,14/00018/B
Removal of redundant chimney stack,Carraghyn 4 Rheast Lane Peel Isle Of Man IM5 1BE,PER,21-Mar-14,14/00161/B
Erection of a single storey extension to rear elevation,14 Bowling Green Road Castletown Isle Of Man IM9 1EA,PER,28-Mar-14,14/00162/B
Replacement of existing conservatory roof with light weight roof tiles,38 Derby Road Peel Isle Of Man IM5 1HP,PER,28-Mar-14,14/00196/B
Alterations to dwelling (comprising amendments to PA 13/91265/B),Ballamoar Earystane Colby Isle Of Man IM9 4HN ,PER,17-Mar-14,14/00147/B
Erection of flat roof infill between existing two dormers,Tradewinds Surby Road Surby Port Erin Isle Of Man IM9 6TA,PER,21-Mar-14,14/00178/B
Additional use of living accommodation beneath existing detached garage as tourist accommodation,Ffald Y Brenin Gordon Peel Isle Of Man IM5 4PP ,PER,28-Mar-14,14/00182/C
Creation of entrance gates and walls (retrospective),Greenhill Jurby Road Andreas Isle Of Man IM7 2EJ,PER,31-Jul-14,14/00746/B
Erection of stables with associated hard standing and creation of off road parking and turning area,Field 425025 Ronague Road Ballabeg Castletown Isle Of Man  ,PER,22-Jul-14,14/00747/B
Alterations and extension to dwelling,18 Mountain View Douglas Isle Of Man IM2 5HX,PER,28-Jul-14,14/00749/B
Installation of replacement first floor windows,1 Bank Street Castletown Isle Of Man IM9 1AT,PER,30-Oct-14,14/01128/B
Alterations and erection of a first floor extension to detached garage to provide additional living accommodation,Ebor Peveril Road Peel Isle Of Man IM5 1PW ,REF,10-Jan-14,13/91193/B
Erection of an extension to dwelling,26 Glebe Aalin Ballaugh Isle Of Man IM7 5BX,PER,31-Jan-14,13/91497/B
Erection of a first floor extension to dwelling,62 Friary Park Road Ballabeg Castletown Isle Of Man IM9 4EW,PER,24-Jan-14,13/91499/B
Alterations and erection of a first floor extension to dwelling,7 Glen Maye Park Glen Maye Isle Of Man IM5 3AX ,PER,17-Apr-14,14/00276/B
Alterations to three windows to front elevation,Filbeys Bistro East Quay Peel Isle Of Man IM5 1AR ,PER,25-Apr-14,14/00277/B
Removal of a chimney stack and installation of a flue (partial retrospective),Woodford Mount Auldyn Ramsey Isle Of Man IM8 3PJ,PER,09-May-14,14/00372/B
Erection of a side porch and a rear extension to dwelling,13 Close Famman Port Erin Isle Of Man IM9 6BL,PER,03-Jun-14,14/00459/B
Replace existing conservatory roof with light weight roof tiles,16 Ballagarey Road Glen Vine Isle Of Man IM4 4EA,PER,22-Jan-14,13/91397/B
Installation of replacement windows and shop windows,Bourne House & Bourne Concourse  Peel Street & College Street Ramsey Isle Of Man IM8 1JW ,REF,06-Jan-14,13/91400/B
Erection of a detached dwelling with associated garage,Plot 2 Off Station Road St Johns Isle Of Man  ,REF,18-Jul-14,14/00653/B
Creation of a hard-core track,Field 430816 Glen Moar Corlea Road Ronague Isle Of Man ,PER,17-Jul-14,14/00654/B
Erection of a dwelling with driveway and parking,Alder Oaks Field 431505 St Marks Road St Marks Ballasalla Isle Of Man  ,REF,04-Aug-14,14/00761/B
Conversion of out buildings to create a detached dwelling and erection of a detached garage,Plot 3 Kerrowdhoo Farm Cranstal Bride Isle Of Man  ,PER,17-Oct-14,14/00856/B
Conversion and erection of extension to former farmhouse to create a detached dwelling with garage,Plot 4 Kerrowdhoo Farm Cranstal Bride Isle Of Man  ,PER,05-Sep-14,14/00858/B
Creation of a private equestrian facility with associated facilities,Close E Cleator Pond Road St Judes Isle Of Man  ,PER,18-Sep-14,14/00863/B
"Alterations, erection of link extension and replacement of garage door with bi-folding doors",Minard 37 Albany Road Douglas Isle Of Man IM2 3NE,PER,04-Sep-14,14/00865/B
Amendments to agricultural workers dwelling and its location (approved under PA 09/00661/B),Fields 324201 & 324202 Glen Lough Farm Ballahutchin Hill Union Mills Isle Of Man  ,PER,28-Aug-14,14/00874/B
Alterations and erection of extensions to dwelling,Shearwater Fort Island Road Derbyhaven Isle Of Man IM9 1TZ,PER,28-Aug-14,14/00877/B
Extension to dwelling to provide w. c. and store,Caardee Cottage  Main Road  Andreas Village Isle Of Man IM7 4HE ,PER,10-Jan-14,13/91166/B
Installation of a gas tank,Part Of Field 614729 Baldrine Road Baldrine Isle Of Man  ,PER,14-Aug-14,13/91169/B
Conversion of existing outbuilding into ancillary living accommodation,Cornmill Cottage Glen Mooar Road St Johns Isle Of Man IM4 3AQ,PER,10-Jan-14,13/91284/B
Installation of new window and door onto Whitehouse Close,Old Butchers Shop  Whitehouse Buildings  New Road Laxey Isle Of Man IM4 7BB,PER,06-Jan-14,13/91361/B
Change of use from a holiday flat to residential,Flat 2   34 Hutchinson Square Douglas Isle Of Man IM2 4HW,REF,08-Apr-14,14/00195/C
Erection of signage,Clarendon House  Victoria Street Douglas Isle Of Man IM1 2LN,PER,11-Apr-14,14/00238/D
Alterations and erection of extensions to dwelling and erection of a detached summerhouse,Linden Lea Old Lonan Road Baldrine Isle Of Man IM4 6DF,PER,04-Sep-14,14/00880/B
Installation of replacement windows and doors to dwellings,Alma Cottage & Ivydene Cottage Baldhoon Road Laxey Isle Of Man IM4 7NE,PER,16-Sep-14,14/00975/B
Installation of two replacement windows to rear elevation,Hazelwood 1 Cronkbourne Avenue Douglas Isle Of Man IM2 3LA,PER,10-Oct-14,14/01004/B
Alterations and erection of an extension to rear elevation of dwelling,10 Victoria Avenue Onchan Isle Of Man IM3 1BD,PER,20-Oct-14,14/01006/B
Retention of a container (retrospective),Field 431182 Bayrauyr Road St Marks Ballasalla Isle Of Man  ,REF,24-Sep-14,14/01007/B
Installation of timber fencing (retrospective),Boundary Of The Horse And Plough Isle Of Man Business Park Douglas Isle Of Man  ,PER,20-Oct-14,14/01078/B
Erection of a front porch to dwelling,Ardlhi May Hill Ramsey Isle Of Man IM8 2HJ,PER,06-Nov-14,14/01155/B
"Additional use to include serviced residential apartments as well as tourism and hotel use for third floor apartments, nos 6 and 7",Sefton Apartments  Formerly Britannia And Irwell House Harris Promenade Douglas Isle Of Man IM1 2HH ,PER,18-Dec-14,14/01313/C
Registered Building consent for repair and refurbishment works to existing windows and creation of an additional window (In association with 14/00471/GB) Registered Building Nos. 185,King Williams College Castletown Isle Of Man IM9 1TP ,PER,18-Jun-14,14/00472/CON
"Alterations, replace garage door with a window, erection of an extension and widening of driveway (amendment to PA 13/90957/B)",7 Hilltop View Douglas Isle Of Man IM2 2LA,PER,24-Jan-14,13/91495/B
Erection of single storey extension to provide garage and kitchen extension to replace existing detached garage,12 Howstrake Drive Onchan Isle Of Man IM3 1BR,PER,17-Jul-14,14/00646/B
Replacement and raising garage roof to provide additional living accommodation,54 Meadow Crescent Douglas Isle Of Man IM2 1NL,PER,17-Jul-14,14/00655/B
Erection of first floor extension over garage,3 Glen Maye Park Glen Maye Isle Of Man IM5 3AX ,PER,07-Aug-14,14/00656/B
Conversion of garage to additional living accommodation,27 Ashberry Avenue Douglas Isle Of Man IM2 1PY,PER,22-Aug-14,14/00770/B
Erection of a replacement dwelling (comprising amendments to PA 14/00905/B),Maples Brookfield Avenue Castletown Isle Of Man IM9 1TL,PER,23-Dec-14,14/01314/B
Erection of an agricultural building,Field 614872 Baldromma Farm Baldromma Road Baldrine Isle Of Man IM4 6AF ,PER,30-Dec-14,14/01315/B
"Alterations, erection of an in-fill extension to rear with roof terrace and installation of replacement windows and doors",22 - 24 Ridgeway Street Douglas Isle Of Man IM1 1EL,PER,03-Mar-14,13/91516/B
Erection of extension to side elevation,23 Greeba Avenue Glen Vine Isle Of Man IM4 4EE,PER,23-Dec-14,14/01304/B
Installation of replacement windows to front and rear elevations,Waverley House 5 Christian Road Douglas Isle Of Man IM1 2QH,PER,07-Aug-14,14/00771/B
"Removal of existing entrance pillars and walls and erection of replacement pillars, walls and new automatic entrance gates",Farm Hill Manor Farmhill Lane Douglas Isle Of Man IM2 2EF,PER,07-Aug-14,14/00772/B
Demolition of existing attached garage and erection of a replacement detached garage and alterations to dwelling,Greenfields Main Road Colby Isle Of Man IM9 4AE ,PER,07-Aug-14,14/00793/B
Installation of replacement flue and re-instatement of two windows,Deepdene Port Lewaigue Ramsey Isle Of Man IM7 1AG ,PER,07-Aug-14,14/00794/B
Removal of four redundant chimney stacks,Fairways Court Rowany Drive Port Erin Isle Of Man IM9 6LP ,PER,13-Aug-14,14/00798/B
Erection of an extension and creation of a patio to replace existing conservatory and decking,46 Sunningdale Drive Onchan Isle Of Man IM3 1EH,PER,05-Sep-14,14/00916/B
Alteration and conversion of existing store and erection of link extension to form ancillary living accommodation,15 Mountain View Ballaugh Isle Of Man IM7 5EP,PER,10-Jan-14,13/91101/B
Repair and alterations to existing barn,Barn Adjacent To Field 134413 Churchtown Ramsey Isle Of Man  ,PER,20-Feb-14,14/00054/B
Conversion of office building to create first and second floor residential apartments,19 Peel Road Douglas Isle Of Man IM1 4LS,PER,14-Oct-14,14/01087/B
Installation of replacement balcony,The British Hotel North Quay Douglas Isle Of Man IM1 4LB,PER,10-Dec-14,14/01240/B
Alterations and installation of new roofing to rear extensions,71 Strand Street Douglas Isle Of Man IM1 2EN,PER,12-Dec-14,14/01241/B
Construction of a box dormer to replace existing terrace,71 Derby Square Douglas Isle Of Man IM1 3LR,PER,12-Dec-14,14/01242/B
Alterations and extensions to dwelling,2 Windermere Avenue Onchan Isle Of Man IM3 2DT,PER,24-Jun-14,14/00055/B
Erection of advertising signage on north-east elevation,Marquis House Isle Of Man Business Park Douglas Isle Of Man IM2 2QZ ,PER,16-May-14,14/00388/D
Additional use of residential apartment as tourist accommodation,Apartment 3 Castle View Apartments  5 Marine Parade Peel Isle Of Man IM5 1PB ,PER,16-May-14,14/00389/C
Construction of footbridge over Foxdale River,The Old Mill Lower Foxdale Isle Of Man IM4 3AZ ,PER,21-May-14,14/00392/B
Replacement of existing slate roof on ground floor extension with fibreglass and installation of additional window,Fairhaven Ballanass Farm Slieau Whallian Road Lower Foxdale Isle Of Man IM4 3BJ,PER,07-Aug-14,14/00780/B
Erection of an agricultural building and depositing of excavated spoil to adjacent land,Lhergydhoo Farm  Lhergydhoo Peel Isle Of Man IM5 2AE ,PER,07-Aug-14,14/00781/B
Erection of a detached garage with living accommodation over,Brae Villa Tromode Road Douglas Isle Of Man IM2 5EJ,REF,11-Sep-14,14/00782/B
"Alterations to existing holiday cottage to provide wheelchair accessibility including new porch, driveway and car parking space",Cottage 21 Formerly 1 Groudle Glen Cottages King Edward Road Onchan Isle Of Man IM3 2JP ,PER,10-Apr-14,14/00107/B
Variation to condition one of PA 09/01324/B to extend the period of approval by six months,Cliff Lodge Switzerland Road Douglas Isle Of Man IM2 4NG,PER,21-May-14,14/00333/C
Approval in principle for the erection of a detached dwelling with associated landscaping,Field No 411409 Adjacent To Pineview The Level Colby Isle Of Man  ,REF,25-Apr-14,14/00334/A
Variation of conditions two and three of PA 11/01777/A to extend the permission by one year,Land At Fairfield House Fairfield Avenue Ramsey Isle Of Man IM8 2LS,PER,05-Jun-14,14/00337/C
Alterations and extension to detached garage,Sea Bank Off Ballafurt Road Port Erin Isle Of Man IM9 6HW,REF,16-Jul-14,14/00490/B
Erection of advertising hoardings (retrospective),Either Side Of Entrance To Reayrt Ny Cronk Adjacent To Roundabout Poortown Road Peel Isle Of Man  ,PER,21-Mar-14,14/00109/D
"Erection of a single storey extension to side and rear elevations, extension to driveway and widening of vehicular access",Quiet Ways 14 Third Avenue Douglas Isle Of Man IM2 6AL,PER,09-May-14,14/00118/B
Erection of a sun lounge extension (retrospective),The Swallows Quines Hill Port Soderick Isle Of Man  ,PER,17-Mar-14,14/00119/B
Replacement of existing conservatory roof with light weight roof tiles,20 Main Road Onchan Isle Of Man IM3 1AS,PER,09-May-14,14/00186/B
Installation of patio doors to rear elevation (retrospective),Cushag Eleanora Drive Douglas Isle Of Man IM2 3NN,PER,29-Apr-14,14/00188/B
Installation of illuminated and non-illuminated signage,7 Regent Street Douglas Isle Of Man IM1 2EB,PER,16-Jun-14,14/00494/D
Replacement of existing conservatory with a garden room and erection of a lean-to conservatory to dwelling,Ballakilley Farm Church Road Port St. Mary Isle Of Man IM9 5LW,PER,18-Jul-14,14/00717/B
"External works to dwelling including installation of stone cladding, timber style boarding, rendering and window and door alterations",Breagle View Saint Marys Road Port Erin Isle Of Man IM9 6JJ,PER,14-Nov-14,14/01181/B
Erection of a single storey extension to rear elevation,3 Auburn Road Onchan Isle Of Man IM3 1LN,PER,09-May-14,14/00189/B
Erection of two semi-detached dwellings with associated parking and relocated vehicular access to replace existing dwelling,Cedar Lodge Ballagawne Road Colby Isle Of Man IM9 4AX,PER,28-Mar-14,14/00190/B
Installation of flue,31 Barrule Park Ramsey Isle Of Man IM8 2BT,PER,28-Mar-14,14/00191/B
Erection of illuminated signage,Old Chapel Main Road Union Mills Isle Of Man IM4 4AD,PER,31-Jul-14,14/00367/D
Alterations and creation of a roof terrace,Bay View House 3 Victoria Terrace Peel Isle Of Man IM5 1PG ,PER,14-Jan-14,13/91304/B
Erection of second floor extension to rear elevation to provide additional storage area,27 - 31 Castle Street Douglas Isle Of Man IM1 2EX ,PER,22-Jan-14,13/91389/B
Erection of a link extension between dwelling and garage,Fircroft Douglas Road Ballasalla Isle Of Man IM9 2AN,PER,24-Jan-14,13/91466/B
Erection of a replacement attached garage to dwelling,10 Lhag Mooar Port Erin Isle Of Man IM9 6LY,PER,24-Jan-14,13/91469/B
Removal of chimney stack,Mona House Station Road St Johns Isle Of Man IM4 3AJ,PER,24-Jan-14,13/91473/B
Installation of replacement windows to rear elevations,5 Arbory Road Castletown Isle Of Man IM9 1NA,PER,24-Jan-14,13/91475/B
Alterations and erection of extension to dwelling,Shangri La Maine Road Port Erin Isle Of Man IM9 6LQ,PER,14-Feb-14,14/00022/B
Installation of replacement roof slates to existing dwelling,Langdale Ballaleigh Road Kirk Michael Isle Of Man IM6 1HJ,PER,03-Oct-14,14/00951/B
Construction of glazed balustrade and erection of external metal staircase (retrospective),54 Majestic Drive Onchan Isle Of Man IM3 2JL,PER,01-Oct-14,14/01022/B
Erection of a replacement summer house,1 Viking Close Ballakillowey Colby Isle Of Man IM9 4BH,PER,03-Oct-14,14/01024/B
Installation of doors and Juliet balcony to replace existing first floor window of detached ancillary accommodation,Walton House Bridge Road Ballasalla Isle Of Man IM9 3DA,PER,03-Oct-14,14/01025/B
Installation of replacement windows to front elevation,Wits End Dandy Hill Port Erin Isle Of Man IM9 6HN,PER,22-Dec-14,14/01140/B
Approval in principle for erection of a dwelling,Part Of Field 424871 Main Road Ballabeg Castletown Isle Of Man  ,REF,20-Oct-14,14/00740/A
Erection of an extension and chimney to dwelling,6 Maple Close Birchill Onchan Isle Of Man IM3 3JS,PER,24-Sep-14,14/00992/B
Change of use of premises from retail to financial services,33 - 35 Victoria Street Douglas Isle Of Man IM1 2LF ,PER,29-Sep-14,14/00993/C
"Erection of a single storey garage with roof terrace above, to front elevation",98 Ballagarey Road Glen Vine Isle Of Man IM4 4EU ,REF,31-Jan-14,13/91441/B
Alterations and erection of an extension to dwelling,97 Silverburn Crescent Ballasalla Isle Of Man IM9 2ED,PER,03-Feb-14,13/91449/B
Erection of an agricultural machine store,Ballakilley Farm Bride Isle Of Man IM7 4AT ,PER,22-Jan-14,13/91452/B
Creation of a vehicle access and off road parking (retrospective),1 Cooil Breryck Ramsey Isle Of Man IM8 3HH,PER,05-Feb-14,13/91453/B
Installation of a replacement front door,4 Bridge Street Peel Isle Of Man IM5 1NB,PER,07-Apr-14,14/00222/B
Erection of an extension to dwelling,19 Glebe Aalin Ballaugh Isle Of Man IM7 5BW,PER,06-May-14,14/00252/B
Installation of replacement windows to front elevation,The Cushag 10 Shore Road Laxey Isle Of Man IM4 7DE,REF,21-May-14,14/00256/B
Installation of replacement front door,Sunnyside Derby Road Peel Isle Of Man IM5 1HW,PER,06-May-14,14/00290/B
"Erection of eight terraced dwellings, parking provision, landscaping and a children's playground","Area Of Land Adjacent To Malew Football Club, Crossag Close And Kinnish Terrace Ballasalla Isle Of Man  ",PER,28-Feb-14,13/91443/B
Erection of fencing (retrospective),84 Eary Veg Douglas Isle Of Man IM2 5LZ,PER,24-Jul-14,13/91444/B
Creation of a window to side elevation,17 Eyreton Park Crosby Isle Of Man IM4 2DG,PER,31-Jan-14,13/91446/B
Erection of agricultural buildings,Cooley Lodge Farm Rhencullen Kirk Michael Isle Of Man IM6 2HA ,PER,02-Jun-14,14/00020/B
Alterations and rear extension to dwelling (comprising amendments to PA 12/01611/B),3 Royal Terrace Onchan Isle Of Man IM3 1EE,PER,28-Mar-14,14/00199/B
Alterations and first floor extension to provide additional living accommodation,Flat 1   1 White House Close Laxey Isle Of Man IM4 7BA,REF,21-Jan-14,13/91310/B
Alterations and erection of extension to dwelling,Close Mooar Farm Glen Roy Laxey Isle Of Man IM4 7QF ,PER,21-Jan-14,13/91376/B
Creation of vehicular access for three approved dwellings,"Fields 432533,432534 And 432535  Phildraw Road Ballasalla Isle Of Man  ",PER,03-Jan-14,13/91377/B
Erection of a flat roof to replace existing garage roof,18 Birch Hill Avenue Onchan Isle Of Man IM3 4EP,PER,17-Mar-14,14/00143/B
Erection of replacement conservatory,Glion Darragh Ballachurry Road Greeba Isle Of Man IM4 3LE,PER,17-Mar-14,14/00145/B
Erection of a machine shed to replace existing garden shed,Highfield Bibaloe Beg Road Onchan Isle Of Man IM4 5AD,PER,14-Mar-14,14/00028/B
Extension to existing dormer on rear elevation,15 Kissack Road Castletown Isle Of Man IM9 1NP,PER,12-May-14,14/00360/B
Installation of replacement windows and shop windows,Bourne House & Bourne Concourse  Peel Street & College Street Ramsey Isle Of Man IM8 1JW ,PER,18-Jun-14,14/00361/B
Erection of a dwelling to replace former dwelling and shop,1 & 1A Derby Road Douglas Isle Of Man IM2 3EU,PER,13-Jun-14,14/00362/B
Alterations to existing vehicular access and widening of driveway to dwelling,Castleward Quarterbridge Road Douglas Isle Of Man IM2 3RJ,PER,30-Oct-14,14/01134/B
Change of use from retail to coffee shop and sandwich bar,Shop  Unit 3  Whitehouse Buildings  New Road Laxey Isle Of Man IM4 7BB,PER,04-Jul-14,14/00418/C
Erection of single storey extension to rear and garage extension to side elevation,2 Faaie-Ny-Cabbal Kirk Michael Isle Of Man IM6 2HW,PER,03-Jun-14,14/00419/B
Creation of vehicular access to lower gardens,Kerrowmoar West Kerrowmoar Sulby Isle Of Man IM7 2AX ,PER,24-Jun-14,14/00498/B
Installation of replacement double doors to rear elevation,44 Michael Street Peel Isle Of Man IM5 1HD ,PER,10-Jun-14,14/00501/B
Removal of five parking spaces to increase grassed area to front of public house and enclose with fencing,Crosby Hotel Main Road Crosby Isle Of Man IM4 2DQ,PER,24-Jul-14,14/00502/B
Erection of a porch to dwelling,Cronk Ny Geayee Ballagorry Drive Glen Mona Ramsey Isle Of Man IM7 1HE,PER,20-Jun-14,14/00577/B
"Erection of a single storey garage extension, first floor lounge extension with walkway and change of facing material to front elevation",98 Ballagarey Road Glen Vine Isle Of Man IM4 4EU ,PER,02-Jun-14,14/00255/B
Erection of extensions to front and rear elevations,21 Close Quane Peel Isle Of Man IM5 1PZ,PER,28-Jul-14,14/00733/B
Erection of single storey extension to rear elevation,14 Farmhill Park Douglas Isle Of Man IM2 2EE,PER,17-Jun-14,14/00536/B
Variation of condition 1 of approved extension to dwelling (PA 10/00947/B) to extend duration of planning permission,Cains Croft Smeale Road Andreas Isle Of Man IM7 4JA,PER,18-Jun-14,14/00538/B
Construction of a pitched roof over existing detached garage to provide additional storage space,Walton House Bridge Road Ballasalla Isle Of Man IM9 3DA,PER,17-Jun-14,14/00542/B
Installation of replacement windows to front and rear elevations,11 Station Road Port Erin Isle Of Man IM9 6AE,PER,13-Jun-14,14/00543/B
Replacement of existing glazed conservatory roof with roof tiles,Glen Hazel Crescent Road Ramsey Isle Of Man IM8 2JR,PER,24-Jun-14,14/00566/B
Replace existing glazed conservatory roof with roof tiles,9 Ballaughton Manor Hill Douglas Isle Of Man IM2 1NZ,PER,18-Jun-14,14/00567/B
Erection of an extension to dwelling,4 The Millrace Sulby Isle Of Man IM7 2HT,PER,24-Jun-14,14/00568/B
Alterations to existing lean-to structure,Mona House Station Road St Johns Isle Of Man IM4 3AJ,PER,18-Jun-14,14/00569/B
Erection of a replacement garage,NW Corner Of Field 214080 Ballamoar Sandygate Ramsey Isle Of Man  ,PER,04-Jul-14,14/00570/B
Erection of a garage extension and a porch to dwelling,16 Grammah Avenue Port Erin Isle Of Man IM9 6NJ,PER,24-Jun-14,14/00571/B
Removal of existing shop front and erection of a new front consisting of a sliding folding door,35 North Quay Douglas Isle Of Man IM1 4LB,REF,09-Dec-14,14/00934/B
"Alterations and erection of extensions to dwelling, erection of detached garage with storage above, extension of existing driveway and creation of a turning bay",Blue Bell Cottage Station Road Ballaugh Isle Of Man IM7 5AE ,PER,21-Nov-14,14/00937/B
Installation of two outdoor condensing units on flat roof of pharmacy premises to serve air conditioning units to third floor offices within Well Road House,Clear Pharmacy 13 Castle Street Douglas Isle Of Man IM1 2EX,PER,14-Oct-14,14/01041/B
Erection of four dwellings with garaging to replace existing apartment building,Hillside House Vernon Road Ramsey Isle Of Man IM8 2EG,REF,31-Oct-14,14/01042/B
Alterations and extension to dwelling and creation of new vehicular access and parking space,17 The Fairway Onchan Isle Of Man IM3 2EG,PER,13-Oct-14,14/01043/B
Installation of three roof lights to rear elevation,Kenmure The Crofts Castletown Isle Of Man IM9 1LW,PER,13-Oct-14,14/01044/B
Erection of a two storey extension to create an indoor swimming pool with residential accommodation above,Laurel Bank Farm Glen Helen Road Laurel Bank St Johns Isle Of Man IM4 3NJ,PER,13-Oct-14,14/01046/B
Alterations and extensions to dwelling,Ca' D' Zan The Downs Union Mills Isle Of Man IM4 4NQ,PER,13-Oct-14,14/01047/B
Erection of a replacement extension to rear elevation,The Bungalow Main Road Ballaugh Isle Of Man IM7 5ED,PER,07-Aug-14,14/00789/B
Construction of tennis court with walling and fencing,The Crofts Chapel Lane Baldrine Isle Of Man IM4 6DG,PER,21-Aug-14,14/00791/B
Erection of roadside advertising signage,Pascoes Ltd Tromode Works Carrs Road Tromode Douglas Isle Of Man IM4 4QB,REF,10-Oct-14,14/01048/D
Erection of a workshop/garage/store building,Field 613057 Ballamenagh Moar Farm Ballamenagh Road Baldrine Isle Of Man IM4 6AJ ,REF,30-Oct-14,14/01137/B
Erection of a detached garage/workshop and extension to driveway,Lhergy Vreck Crescent Road Ramsey Isle Of Man IM8 2JR,PER,09-Jan-14,13/91439/B
Additional use of premises to combined use as car sales and car servicing workshop,The Showroom  Demesne Road Douglas Isle Of Man IM1 3DZ ,PER,18-Feb-14,13/91440/C
"Demolition of existing chimney stack, installation of steel flue and window alteration",53 Ormly Road Ramsey Isle Of Man IM8 3LH,PER,17-Mar-14,14/00105/B
Erection of porch extension to front elevation and garage/store extension to rear,Reception Cottage  Groudle Glen Cottages King Edward Road Onchan Isle Of Man IM3 2JP ,PER,16-May-14,14/00106/B
Erection of a greenhouse,37 Ballacriy Park Colby Isle Of Man IM9 4LU,PER,07-Apr-14,14/00211/B
Alterations and erection of extension to dwelling (amendment to PA 13/91102/B),33 Howe Road Onchan Isle Of Man IM3 2BA,PER,17-Apr-14,14/00212/B
Alterations to existing balcony,The Pines Woodlands Avenue Douglas Isle Of Man IM2 3QS,PER,12-May-14,14/00213/B
Replacement of existing glazed conservatory roof with a tiled roof,34 Ballamaddrell Port Erin Isle Of Man IM9 6BA,PER,07-Apr-14,14/00214/B
Erection of a shed with lean-to shelter (retrospective),Riversdale Glen Roy Laxey Isle Of Man IM4 7QB ,PER,18-Mar-14,13/91538/B
Erection of a two storey extension to east elevation and a first floor extension to west elevation,3 Perwick Rise Perwick Road Port St. Mary Isle Of Man IM9 5QA ,PER,10-Jun-14,14/00514/B
Erection of company name plate to front elevation (in association with 14/00517/CON),The Red House  1 The Parade Castletown Isle Of Man IM9 1LG,PER,04-Jul-14,14/00515/D
Erection of six advertising signs on roadside wall (retrospective),1 Clarence Terrace  Corner Of Castle Mona Avenue   Central Promenade Douglas Isle Of Man  ,REF,27-Oct-14,14/00972/D
